Danish gay men,Gay politicians,Gay men,Documentary films about gay men,Gay villages,Gay-related films,Fictional gay characters,"Gay, Russia",Gay pornography awards,"Gay, lesbian or bisexual people",Fictional gay men
Swedish gay men,Gay politicians,"Gay, lesbian or bisexual people",Documentary films about gay men,Gay villages,Gay-related films,Members of the Riksdag,Gay sportsmen,Swedish LGBT politicians,LGBT sportspeople,Gay entertainers
Spanish gay men,Gay politicians,Gay sportsmen,Documentary films about gay men,Gay villages,Gay-related films,Fictional gay characters,"Gay, Russia","Gay, lesbian or bisexual people",LGBT sportspeople,Gay entertainers
Spanish gay writers,20th-century Spanish male writers,"Gay, lesbian or bisexual people",Gay villages,Spanish male novelists,20th-century Spanish poets,Gay politicians,LGBT writers,Spaniards,Spanish film directors,Gay screenwriters
Russian gay men,Gay men,Fictional gay men,Documentary films about gay men,Gay villages,Gay-related films,Fictional gay characters,"Gay, Russia",Violence against gay men,"Gay, lesbian or bisexual people",Gay politicians
German gay men,Gay politicians,LGBT members of the Bundestag,Documentary films about gay men,Gay villages,"Gay, lesbian or bisexual people",Members of the Bundestag 2021–2025,Gay sportsmen,German LGBT rights activists,German LGBT politicians,LGBT sportspeople
French gay men,Gay politicians,"Gay, lesbian or bisexual people",Documentary films about gay men,Gay villages,Deputies of the 15th National Assembly of the French Fifth Republic,Gay sportsmen,The first openly LGBT holders of political offices,French LGBT rights activists,LGBT sportspeople,La République En Marche! politicians
American gay writers,"Gay, lesbian or bisexual people",21st-century American male writers,LGBT people from New York (state),21st-century American male actors,20th-century American male writers,American male non-fiction writers,American male screenwriters,American LGBT singers,LGBT Jews,LGBT writers
Gay-related films,LGBT-related films,British LGBT-related films,American independent films,Films shot in Los Angeles,Films set in New York City,Films about anti-LGBT sentiment,French LGBT-related films,2020 films,2022 films,Lesbian-related films
Gay male prostitutes,American male prostitutes,"Gay, lesbian or bisexual people",Films about male prostitution,Films about gay male pornography,Gay villages,Gay pornography awards,Fictional prostitutes,Actors in gay pornographic films,Gay entertainers,American gay writers
Gay pornographic films,1970s pornographic films,2000s pornographic films,Gay pornographic film actors,Actors in gay pornographic films,Pornographic film studios,Pornographic magazines,Gay villages,American pornographic films,Gay-related films,LGBT-related films
GAIS Bandy players,Swedish bandy players,GAIS players,Gay villages,Gay-related films,Gay pornographic films,Fictional gay characters,"Gay, Russia",Gay pornography awards,Gay characters in television,Gay actors
Fictional gay men,Gay men,Fictional gay characters,Violence against gay men,Fictional bisexual men,Documentary films about gay men,Gay villages,Gay-related films,"Gay, Russia",Gay pornography awards,Spanish gay men
Gay men's choruses,LGBT-related organizations and conferences,Gay villages,Gay actors,Gay artists,Gay-related films,Gay pornographic films,Fictional gay characters,"Gay, Russia",Gay pornography awards,Gay characters in television
Gay pornography awards,Adult industry awards,Film awards,Films about gay male pornography,"Orders, decorations, and medals of Japan",Pornographic magazines,Films about pornography,Gay villages,Gay actors,Gay artists,Erotica and pornography websites
Fictional gay characters,Graphic art works with LGBT characters,Fictional bisexual characters,Fictional gay men,Feature films with gay characters,Gay characters in television,DC Comics characters,Gay characters in animation,Gay characters in anime,Fictional trans characters,Fictional lesbian characters
Nazis executed by Nazi Germany,People who were executed,Nazi Party leaders and officials,Glossary of Nazi Germany,Films about Nazi Germany,Nazi Germany paramilitary ranks,Comparative ranks of Nazi Germany,Executed members of the 20 July plot,Nazi Party officials,1944 deaths,1945 deaths
Nazi culture,Nazi Party members,20th-century German painters,Glossary of Nazi Germany,Nazi Germany paramilitary ranks,Nazi parties,Neo-Nazi organizations,Nazi concentration camps,Nazi propaganda films,Neo-Nazi bands,Dragons in popular culture
Nazi fugitives,Last surviving Nazi war criminals,Fugitives,Films about Nazi fugitives,Films about Nazi fugitives in South America,Glossary of Nazi Germany,Nazi Germany paramilitary ranks,Nazi parties,Neo-Nazi organizations,Nazi concentration camps,SS personnel
Nazi hunters,Last surviving Nazi war criminals,Films about Nazi hunters,Hunter × Hunter characters,Historians of the Holocaust,Hunter × Hunter chapters,Fictional hunters,Films about hunters,Glossary of Nazi Germany,Nazi Germany paramilitary ranks,Nazi parties
Nazi parties,Neo-Nazi organizations,Defunct political parties in Sweden,Political parties in Romania,Nationalist organizations,Nazi Party members,Nazi Party officials,Parties of one-party systems,Nazi Party organizations,Political parties in Finland,Defunct political parties in Hungary
Nazi propagandists,Nazi Party leaders and officials,Nazi Party politicians,SS personnel,Gauleiters,Nazi ideologues,Members of the Reichstag of Nazi Germany,Nazi Party officials,Register of SS leaders in general's rank,1901 births,Women in Nazi Germany
Nazi ideologues,Nazi Party leaders and officials,Convicted war criminals,SS personnel,Atomwaffen Division members in the United States who faced criminal charges,Germans,Nazi Party officials,Figures in nationalism,World War II political leaders,Covers of Time magazine (1930s),People who were executed
Sudanese Arab nationalists,Heads of government of Sudan,Arab nationalists,Nationalist organizations,Nationalist parties,White nationalist organizations,Arab flags,Arab newspapers,Heads of state of Sudan,Sudanese people,Jews from the Arab world
Tunisian Arab nationalists,Arab nationalists,Tunisian politicians,Nationalist organizations,Nationalist parties,White nationalist organizations,Arab flags,Arab newspapers,Tunisian films,Airports in Tunisia,Terrorist incidents in Tunisia
Syrian Arab nationalists,Regional Command of the Arab Socialist Ba'ath Party – Iraq Region,Syrian Sunni Muslims,Syrian Air Force bases,Equipment of the Syrian Army,Syrian nationalists,Syrian politicians,Members of the Revolutionary Command Council under Ahmed Hassan al-Bakr,Syrians,Syrian ministers of defense,Arabs from the Ottoman Empire
South Tyrolean nationalists,Russian nationalists,Figures in nationalism,Nationalist organizations,Nationalist parties,White nationalist organizations,Cities in South Korea,Sovereign states and dependent territories in South America,Universities and colleges in South Korea,Public holidays in South Africa,Counties in South Carolina
Iranian religious-nationalists,Iranian journalists,Iranians,Nationalist organizations,Nationalist parties,White nationalist organizations,Religious texts,Religious organizations,New religious movements,Iranian democracy activists,Iranian prisoners and detainees
American white nationalists,Atomwaffen Division members in the United States who faced criminal charges,American conspiracy theorists,White nationalist organizations,Nationalist organizations,Nationalist parties,Black-and-white American television shows,Alt-right writers,American eugenicists,American nationalists,American white supremacists
Algerian Arab nationalists,Algerians,Algerian novelists,Nationalist organizations,Nationalist parties,White nationalist organizations,Arab flags,Political parties in Algeria,Arab newspapers,Algerian films,Arab nationalists
British white nationalists,White nationalist organizations,American white nationalists,Russian nationalists,British black-and-white films,Nationalist organizations,Nationalist parties,White House,Betty White filmography,White Collar episodes,White Collar characters
Ottoman Arab nationalists,Arabs from the Ottoman Empire,Syrian Arab nationalists,Nationalist organizations,Nationalist parties,White nationalist organizations,Arab flags,Syrian Sunni Muslims,Arab nationalists,Iraqi Arab nationalists,Palestinian Arab nationalists
Palestinian Arab nationalists,Palestinians,Palestinian nationalists,Towns and villages depopulated during the 1947–1949 Palestine war,Palestinian militants,Arab people in Mandatory Palestine,Palestinian politicians,Guerrillas,Palestinian Muslims,Regional Command of the Arab Socialist Ba'ath Party – Iraq Region,Palestine Liberation Organization members
European white nationalists,White nationalist organizations,American white nationalists,Russian nationalists,Nationalist organizations,Nationalist parties,European cuisines,White House,Betty White filmography,White Collar episodes,White Collar characters
Lebanese Arab nationalists,People of the Lebanese Civil War,Lebanese writers,Nationalist organizations,Nationalist parties,Lebanese people,Lebanese politicians,Lebanese Shia Muslims,Assassinated Lebanese politicians,Lebanese Maronites,Arab nationalists
Libyan Arab nationalists,Arab nationalists,Libyans,Airports in Libya,Nationalist organizations,Nationalist parties,White nationalist organizations,Arab flags,Arab newspapers,Figures in nationalism,Arabs
Nationalists from Ponce,"People from Ponce, Puerto Rico",Figures in nationalism,Nationalist organizations,Nationalist parties,White nationalist organizations,"Barrios of Ponce, Puerto Rico",Newspapers in Puerto Rico,"Beaches in Ponce, Puerto Rico",Puerto Ricans,Puerto Rican independence activists
Nationalists’ Party politicians,Nationalist parties,Nationalist Movement Party politicians,Nazis,Nationalist organizations,White nationalist organizations,Russian nationalists,Figures in nationalism,Third-party and independent members of the United States Congress,Nigerian nationalists,Ukrainian nationalists
Egyptian Arab nationalists,Egyptians,Egyptian Muslims,Nationalist organizations,Nationalist parties,White nationalist organizations,Arab flags,Egyptian deities,Cairo University alumni,Egyptian journalists,Egyptian dissidents
Iraqi Arab nationalists,Prime ministers of Iraq,Iraqi Sunni Muslims,Regional Command of the Arab Socialist Ba'ath Party – Iraq Region,Political leaders who held active military ranks in office,Foreign ministers of Iraq,Arabs from the Ottoman Empire,Field marshals,Government ministers of Iraq,Ambassadors of Iran to Iraq,Presidents of Iraq
Swiss Nazis,Nazi Party leaders and officials,Swiss collaborators with Nazi Germany,Fictional Nazis,Films about Nazis,Nicknames and pseudonyms of Nazis,Nazi parties,Neo-Nazi organizations,Nazi propaganda films,Neo-Nazi bands,Nazi concentration camps
Swedish Nazis,Swedish collaborators with Nazi Germany,Nazis,Fictional Nazis,Films about Nazis,Nicknames and pseudonyms of Nazis,Nazi parties,Neo-Nazi organizations,Nazi propaganda films,Neo-Nazi bands,Nazi concentration camps
Assassinated Nazis,Nazi Party leaders and officials,Assassinated military personnel,Fictional Nazis,Films about Nazis,Nicknames and pseudonyms of Nazis,1944 deaths,1943 deaths,Nazi Party members,French collaborators with Nazi Germany,Last surviving Nazi war criminals
Austrian Nazis,SS personnel,Austro-Hungarian military personnel of World War I,Members of the Reichstag of Nazi Germany,Austrians,Nazi Party members,Austrian military personnel of World War II,Waffen-SS personnel,Sturmabteilung personnel,Last surviving Nazi war criminals,University of Vienna alumni
Hungarian Nazis,Executed Hungarian collaborators with Nazi Germany,Hungarian fascists,1946 deaths,People executed for war crimes,Hungarian people of World War II,Hungarian politicians,Nazi Party leaders and officials,Hungarian people convicted of war crimes,Austro-Hungarian military personnel of World War I,Prime ministers of Hungary
Neo-Nazis,American neo-Nazis,Russian neo-Nazis,Neo-Nazi organizations,Neo-Nazi bands,Films about neo-Nazis,Neos destinations,Neo Geo games,Neo-Western films,Fictional Nazis,Nicknames and pseudonyms of Nazis
Fictional Nazis,Nazis,Fictional detectives,Fictional criminals,Nazi Party leaders and officials,Films about Nazis,Nicknames and pseudonyms of Nazis,Nazi parties,Neo-Nazi organizations,Nazi propaganda films,Neo-Nazi bands
Czech criminals,Australian criminals,War criminals,Fictional criminals,Chinese criminal organizations,Criminal Minds episodes,American criminals,Computer criminals,Brazilian criminals,Russian criminals,Convicted war criminals
Chilean criminals,Chilean anti-communists,Chileans,Fictional criminals,Chilean regions,Chilean flags,Chinese criminal organizations,Chilean films,Companies of Chile,Australian criminals,War criminals
Dominica criminals,Heads of government of Dominica,People from Dominica,Fictional criminals,Chinese criminal organizations,Towns and villages in Dominica,Criminal Minds episodes,Australian criminals,War criminals,American criminals,Computer criminals
Colombian criminals,Colombians,Australian criminals,Colombian telenovelas,Fictional criminals,Newspapers in Colombia,Colombian flags,Colombian films,Airlines of Colombia,Chinese criminal organizations,War criminals
Suspected criminals,Black Dahlia suspects,Jack the Ripper suspects,Fictional criminals,Chinese criminal organizations,Criminal Minds episodes,Australian criminals,War criminals,American criminals,Computer criminals,Brazilian criminals
Swiss criminals,Swiss people,Australian criminals,Fictional criminals,Chinese criminal organizations,Criminal Minds episodes,War criminals,American criminals,Computer criminals,Brazilian criminals,Russian criminals
Thai criminals,Thai male actors,Australian criminals,Thai Airways International destinations,Thai films,Thai flags,Fictional criminals,Thai dishes,War criminals,American criminals,Thai male Muay Thai practitioners
Surinamese criminals,Surinamese people,Surinamese drug traffickers,Newspapers in Suriname,Fictional criminals,Chinese criminal organizations,Criminal Minds episodes,Australian criminals,War criminals,American criminals,Computer criminals
Swedish criminals,Computer criminals,Swedish rappers,Fictional criminals,Chinese criminal organizations,Murdered criminals,Swedish serial killers,Swedish crime fiction writers,Australian criminals,War criminals,21st-century criminals
Tunisian criminals,Tunisian politicians,Australian criminals,Fictional criminals,Tunisian films,Airports in Tunisia,Terrorist incidents in Tunisia,Chinese criminal organizations,Political parties in Tunisia,War criminals,American criminals
Syrian criminals,Syrians,Syrian businesspeople,Fictional criminals,Syrian films,Political parties in Syria,Chinese criminal organizations,Australian criminals,War criminals,American criminals,Computer criminals
Taiwanese criminals,Sportspeople convicted of crimes,Taiwanese people,Fictional criminals,Taiwanese flags,Chinese criminal organizations,Australian criminals,War criminals,American criminals,Computer criminals,Brazilian criminals
Serbian criminals,People from Serbia,20th-century criminals,Fictional criminals,Serbian films,Political parties in Serbia,Equipment of the Serbian Armed Forces,Serbian gangsters,Serbian football champions,Male criminals,Serbian film directors
Senegalese criminals,Senegalese,Australian criminals,Senegalese films,Fictional criminals,Political parties in Senegal,Chinese criminal organizations,Criminal Minds episodes,War criminals,American criminals,Senegalese writers
Singaporean criminals,Singaporeans,Kidnappings,Singaporean films,Equipment of the Singapore Army,Singaporean flags,Fictional criminals,Chinese criminal organizations,Islands of Singapore,Singaporean dissidents,Australian criminals
Russian criminals,Russian serial killers,Russian nationalists,Fictional criminals,Chinese criminal organizations,Soviet criminals,Russian rappers,Russian businesspeople,Russian bards,20th-century criminals,Australian criminals
Rwandan criminals,Convicted war criminals,Rwandans,Films about the Rwandan genocide,Fictional criminals,Chinese criminal organizations,Criminal Minds episodes,Diplomatic missions of Rwanda,Australian criminals,War criminals,American criminals
Somalian criminals,Presidents of Somalia,Australian criminals,Fictional criminals,Chinese criminal organizations,Criminal Minds episodes,War criminals,American criminals,Computer criminals,Brazilian criminals,Russian criminals
Slovenian criminals,Serbian criminals,Australian criminals,Fictional criminals,Slovenian films,Companies of Slovenia,Chinese criminal organizations,War criminals,20th-century criminals,American criminals,Computer criminals
Samoan criminals,Samoans,Australian criminals,Fictional criminals,Chinese criminal organizations,Criminal Minds episodes,War criminals,American criminals,Computer criminals,Brazilian criminals,Russian criminals
Romanian criminals,Computer criminals,Romanian businesspeople,Fictional criminals,Chinese criminal organizations,Australian criminals,War criminals,American criminals,Brazilian criminals,Romanians,Russian criminals
Slovak criminals,Slovak Jews,Slovaks,Fictional criminals,Chinese criminal organizations,Australian criminals,War criminals,American criminals,Computer criminals,Brazilian criminals,Slovak Americans
Japanese criminals,Common Japanese surnames,Japanese-language surnames,Australian criminals,War criminals,Fictional criminals,Chinese criminal organizations,Criminal Minds episodes,American criminals,Computer criminals,Brazilian criminals
Jersey criminals,People from Jersey,Australian criminals,Fictional criminals,Chinese criminal organizations,Criminal Minds episodes,War criminals,American criminals,Computer criminals,Brazilian criminals,Russian criminals
German criminals,Australian criminals,War criminals,Fictional criminals,Chinese criminal organizations,Criminal Minds episodes,American criminals,Computer criminals,Brazilian criminals,Russian criminals,Convicted war criminals
Irish criminals,Australian criminals,War criminals,Fictional criminals,Chinese criminal organizations,Criminal Minds episodes,American criminals,Computer criminals,Brazilian criminals,Russian criminals,Convicted war criminals
Indonesian criminals,Indonesian people of Chinese descent,Indonesians,Indonesian films,Indonesian monarchies,Fictional criminals,Islands of Indonesia,Active Indonesian Navy ships,Indonesian Muslims,Indonesian Christians,Indonesian male actors
French criminals,Computer criminals,French people,Fictional criminals,Chinese criminal organizations,French male actors,Australian criminals,French Open champions,French anarchists,War criminals,American criminals
Italian criminals,Italian female models,Australian criminals,Fictional criminals,Chinese criminal organizations,Criminal Minds episodes,War criminals,American criminals,Computer criminals,Brazilian criminals,Russian criminals
Filipino criminals,Filipino Roman Catholics,21st-century criminals,Fictional criminals,20th-century criminals,Senators of the Philippines,Filipino actresses,Filipino generals,Filipino female models,Filipino exiles,People named in the Panama Papers
Fictional criminals,Fictional African-American people,Fictional businesspeople,Fictional antiheroes,Fictional writers,Fictional thieves,Fictional characters from Chicago,Fictional orphans,Fictional murderers,Fictional doctors,Female characters in television
Fijian criminals,Fijians,Islands of Fiji,Fijian politicians,Fictional criminals,Chinese criminal organizations,Criminal Minds episodes,Political parties in Fiji,Australian criminals,War criminals,American criminals
Soviet criminals,Male serial killers,Soviet serial killers,Fictional criminals,Chinese criminal organizations,Criminal Minds episodes,Russian serial killers,Russian criminals,Soviet rapists,20th-century criminals,Australian criminals
Turkish criminals,Turkish Islamists,Turkish revolutionaries,Fictional criminals,Chinese criminal organizations,Turkish rappers,Turkish nationalists,Turkish scientists,Turkish businesspeople,Turkish philosophers,Turkish serial killers
Ukrainian criminals,Computer criminals,Ukrainian collaborators with Russia,Fictional criminals,People from Ukraine,Ukrainian journalists,Ukrainian Americans,Ukrainian Jews,Ukrainian politicians,Ukrainian nationalists,Ukrainian billionaires
Abkhazian criminals,Abkhazian people,Australian criminals,Political parties in Abkhazia,Fictional criminals,Chinese criminal organizations,Criminal Minds episodes,War criminals,Abkhazian writers,American criminals,Computer criminals
Argentine criminals,Argentine Primera División players,Australian criminals,Fictional criminals,Chinese criminal organizations,Criminal Minds episodes,Boca Juniors footballers,War criminals,American criminals,Computer criminals,Brazilian criminals
Armenian criminals,20th-century criminals,Syrian Armenians,Fictional criminals,Armenian flags,Armenian businesspeople,Australian criminals,War criminals,American criminals,Computer criminals,Brazilian criminals
Afghan criminals,Afghan Americans,Afghans,Fictional criminals,Afghan films,Army equipment of Afghanistan,Airlines of Afghanistan,Military ranks of Afghanistan,Afghan proverbs,Chinese criminal organizations,Australian criminals
American criminals,American male criminals,American female criminals,Chinese Americans,Fictional criminals,Albanian Americans,American prisoners and detainees,Sicilian Americans,19th-century American criminals,Australian criminals,People from Chicago
Albanian criminals,Albanian Americans,Australian criminals,Albanian name,Albanian flags,Fictional criminals,Chinese criminal organizations,War criminals,American criminals,Computer criminals,Brazilian criminals
Algerian criminals,French people of Algerian descent,Algerians,Political parties in Algeria,Algerian films,Fictional criminals,Equipment of the Algerian Land Forces,20th-century criminals,Australian criminals,War criminals,American criminals
Bangladeshi criminals,Australian criminals,War criminals,Bangladeshi films,Bangladeshi flags,Fictional criminals,Chinese criminal organizations,Bangladeshi people,American criminals,Computer criminals,Brazilian criminals
Azerbaijani criminals,Azerbaijani businesspeople,Azerbaijanis,Fictional criminals,Azerbaijani flags,Newspapers in Azerbaijan,Chinese criminal organizations,Australian criminals,War criminals,American criminals,Computer criminals
Bahamian criminals,Australian criminals,Bahamian musicians,Fictional criminals,Chinese criminal organizations,Criminal Minds episodes,War criminals,American criminals,Computer criminals,Brazilian criminals,Russian criminals
Austrian criminals,Austrian Nazis,Australian criminals,Fictional criminals,Austrian Airlines destinations,Chinese criminal organizations,War criminals,American criminals,Computer criminals,Brazilian criminals,Russian criminals
Bermudian criminals,Premiers of Bermuda,Australian criminals,Fictional criminals,Chinese criminal organizations,Criminal Minds episodes,War criminals,American criminals,Computer criminals,Brazilian criminals,Russian criminals
Belgian criminals,Australian criminals,War criminals,Fictional criminals,Banks in Belgium,Chinese criminal organizations,Airports in Belgium,Criminal Minds episodes,Newspapers in Belgium,American criminals,Computer criminals
Cambodian criminals,Cambodians,Cambodian flags,Australian criminals,Fictional criminals,Chinese criminal organizations,War criminals,Cambodian Americans,American criminals,Computer criminals,Brazilian criminals
Canadian criminals,Computer criminals,21st-century Canadian criminals,Fictional criminals,Chinese criminal organizations,Criminal Minds episodes,Australian criminals,War criminals,American criminals,Brazilian criminals,Russian criminals
British criminals,British female criminals,Australian criminals,Fictional criminals,Chinese criminal organizations,Criminal Minds episodes,War criminals,American criminals,Computer criminals,Brazilian criminals,Russian criminals
Burmese criminals,Burmese monarchs,Burmese flags,Burmese films,Burmese writers,Anglo-Burmese Wars,Fictional criminals,Chinese criminal organizations,Australian criminals,War criminals,American criminals
Bulgarian criminals,Computer criminals,Australian criminals,Vehicle registration plates of Bulgaria,Bulgarian name,Fictional criminals,Chinese criminal organizations,War criminals,American criminals,Brazilian criminals,Russian criminals
Brazilian criminals,Brazilian businesspeople,Brazilians,Fictional criminals,Football clubs in Brazil,Chinese criminal organizations,Brazilian people of German descent,Murdered criminals,Brazilian television presenters,Brazilian politicians,Australian criminals
Bolivian criminals,Australian criminals,Political parties in Bolivia,War criminals,Fictional criminals,Bolivian films,Chinese criminal organizations,21st-century criminals,American criminals,Computer criminals,Brazilian criminals
Icelandic criminals,Australian criminals,War criminals,Icelandic films,Fictional criminals,Icelandic flags,Chinese criminal organizations,Criminal Minds episodes,Icelanders,American criminals,Computer criminals
Nigerian criminals,English criminals,Nigerians,Fictional criminals,Universities in Nigeria,Chinese criminal organizations,20th-century criminals,Australian criminals,War criminals,American criminals,Computer criminals
Panamanian criminals,Panamanians,Australian criminals,Fictional criminals,Political parties in Panama,Chinese criminal organizations,War criminals,American criminals,Computer criminals,Brazilian criminals,Russian criminals
