Nazi concentration camp personnel,Nazi concentration camp commandants,Nazi concentration camps,Executed Nazi concentration camp personnel,Subcamps of Natzweiler-Struthof,Nazi concentration camp survivors,Nazis convicted of war crimes,Auschwitz concentration camp personnel,Mauthausen concentration camp personnel,Buchenwald concentration camp personnel,Prisoners of Nazi concentration camps
Executed Nazi concentration camp personnel,Auschwitz concentration camp personnel,Ravensbrück concentration camp personnel,Nazi concentration camps,Subcamps of Natzweiler-Struthof,SS personnel,Dachau concentration camp personnel,Waffen-SS personnel,Majdanek concentration camp personnel,Nazi concentration camp personnel,Buchenwald concentration camp personnel
Theresienstadt concentration camp personnel,Ravensbrück concentration camp personnel,SS personnel,Works about Theresienstadt Ghetto,Subcamps of Natzweiler-Struthof,Nazi concentration camps,Auschwitz concentration camp personnel,Gestapo personnel,Nazi concentration camp personnel,Dachau concentration camp personnel,Mauthausen concentration camp personnel
Stutthof concentration camp personnel,Ravensbrück concentration camp personnel,Auschwitz concentration camp personnel,Subcamps of Natzweiler-Struthof,Nazi concentration camps,Sachsenhausen concentration camp personnel,Stutthof concentration camp survivors,Majdanek concentration camp personnel,Nazi concentration camp personnel,Neuengamme concentration camp personnel,Dachau concentration camp personnel
Soldau concentration camp personnel,Auschwitz concentration camp personnel,Nazi concentration camp personnel,Subcamps of Natzweiler-Struthof,Nazi concentration camps,Dachau concentration camp personnel,Mauthausen concentration camp personnel,Buchenwald concentration camp personnel,Stutthof concentration camp personnel,Majdanek concentration camp personnel,Executed Nazi concentration camp personnel
Sachsenhausen concentration camp personnel,Waffen-SS personnel,SS personnel,Subcamps of Natzweiler-Struthof,Nazi concentration camp commandants,Buchenwald concentration camp personnel,Auschwitz concentration camp personnel,Mauthausen concentration camp personnel,Flossenbürg concentration camp personnel,Nazis convicted of war crimes,Sachsenhausen concentration camp prisoners
Auschwitz concentration camp personnel,Waffen-SS personnel,Holocaust perpetrators in Poland,SS personnel,Ravensbrück concentration camp personnel,Sachsenhausen concentration camp personnel,Polish Righteous Among the Nations,Executed Nazi concentration camp personnel,Female guards in Nazi concentration camps,Flossenbürg concentration camp personnel,1945 deaths
Buchenwald concentration camp personnel,Waffen-SS personnel,Sachsenhausen concentration camp personnel,Subcamps of Natzweiler-Struthof,Nazi concentration camps,SS personnel,Dachau concentration camp personnel,Nazi concentration camp commandants,Flossenbürg concentration camp personnel,Mauthausen concentration camp personnel,Auschwitz concentration camp personnel
Bredtvedt concentration camp personnel,Auschwitz concentration camp personnel,Nazi concentration camp personnel,Subcamps of Natzweiler-Struthof,Nazi concentration camps,Dachau concentration camp personnel,Mauthausen concentration camp personnel,Buchenwald concentration camp personnel,Stutthof concentration camp personnel,Majdanek concentration camp personnel,Executed Nazi concentration camp personnel
Flossenbürg concentration camp personnel,Sachsenhausen concentration camp personnel,Nazi concentration camp commandants,Subcamps of Natzweiler-Struthof,Nazi concentration camps,Auschwitz concentration camp personnel,Dachau concentration camp personnel,SS personnel,Majdanek concentration camp personnel,Waffen-SS personnel,Executed Nazi concentration camp personnel
Grini concentration camp personnel,Buchenwald concentration camp personnel,Nazi concentration camp commandants,Subcamps of Natzweiler-Struthof,Nazi concentration camps,Auschwitz concentration camp personnel,Nazi concentration camp personnel,Mauthausen concentration camp personnel,Flossenbürg concentration camp personnel,Stutthof concentration camp personnel,Executed Nazi concentration camp personnel
Hinzert concentration camp personnel,Auschwitz concentration camp personnel,Dachau concentration camp personnel,Subcamps of Natzweiler-Struthof,Nazi concentration camps,Buchenwald concentration camp personnel,Majdanek concentration camp personnel,Executed Nazi concentration camp personnel,Nazi concentration camp personnel,Neuengamme concentration camp personnel,Mauthausen concentration camp personnel
Ravensbrück concentration camp personnel,Female guards in Nazi concentration camps,Auschwitz concentration camp personnel,Subcamps of Natzweiler-Struthof,Nazi concentration camps,Holocaust perpetrators in Poland,Dachau concentration camp personnel,Majdanek concentration camp personnel,SS personnel,Flossenbürg concentration camp personnel,Executed Nazi concentration camp personnel
Dachau concentration camp personnel,SS personnel,Waffen-SS personnel,Nazi concentration camp commandants,Physicians in the Nazi Party,Buchenwald concentration camp personnel,Ravensbrück concentration camp personnel,People from the Kingdom of Bavaria,Majdanek concentration camp personnel,1946 deaths,Mittelbau-Dora concentration camp personnel
Espeland concentration camp personnel,Auschwitz concentration camp personnel,Nazi concentration camp personnel,Subcamps of Natzweiler-Struthof,Nazi concentration camps,Dachau concentration camp personnel,Mauthausen concentration camp personnel,Buchenwald concentration camp personnel,Stutthof concentration camp personnel,Majdanek concentration camp personnel,Executed Nazi concentration camp personnel
Lichtenburg concentration camp personnel,Dachau concentration camp personnel,Nazi concentration camp commandants,Subcamps of Natzweiler-Struthof,Nazi concentration camps,Ravensbrück concentration camp personnel,SS personnel,Sachsenhausen concentration camp personnel,Majdanek concentration camp personnel,Nazi concentration camp personnel,Mauthausen concentration camp personnel
Majdanek concentration camp personnel,Ravensbrück concentration camp personnel,SS personnel,Subcamps of Natzweiler-Struthof,Nazi concentration camps,Waffen-SS personnel,Dachau concentration camp personnel,Neuengamme concentration camp personnel,Sachsenhausen concentration camp personnel,Flossenbürg concentration camp personnel,Executed Nazi concentration camp personnel
Mauthausen concentration camp personnel,Sachsenhausen concentration camp personnel,Nazi concentration camp commandants,Subcamps of Natzweiler-Struthof,Nazi concentration camps,Auschwitz concentration camp personnel,SS personnel,Waffen-SS personnel,Mauthausen concentration camp survivors,Female guards in Nazi concentration camps,Kraków-Płaszów concentration camp personnel
Neuengamme concentration camp personnel,Waffen-SS personnel,SS personnel,Subcamps of Natzweiler-Struthof,Nazi concentration camps,Auschwitz concentration camp medical personnel,Majdanek concentration camp personnel,Auschwitz concentration camp personnel,Nazi concentration camp commandants,Buchenwald concentration camp personnel,Mittelbau-Dora concentration camp personnel
Kaiserwald concentration camp personnel,Sachsenhausen concentration camp personnel,Nazi concentration camp commandants,Subcamps of Natzweiler-Struthof,Nazi concentration camps,Auschwitz concentration camp personnel,Mauthausen concentration camp personnel,Nazi concentration camp personnel,Dachau concentration camp personnel,Stutthof concentration camp personnel,Majdanek concentration camp personnel
Ustaše concentration camp personnel,Holocaust perpetrators in Yugoslavia,Auschwitz concentration camp personnel,Subcamps of Natzweiler-Struthof,Nazi concentration camps,Nazi concentration camp personnel,Dachau concentration camp personnel,Mauthausen concentration camp personnel,Buchenwald concentration camp personnel,Stutthof concentration camp personnel,Majdanek concentration camp personnel
Warsaw concentration camp personnel,Mauthausen concentration camp personnel,Dachau concentration camp personnel,Subcamps of Natzweiler-Struthof,Nazi concentration camps,Nazi concentration camp commandants,Auschwitz concentration camp personnel,Nazi concentration camp personnel,Buchenwald concentration camp personnel,Stutthof concentration camp personnel,Majdanek concentration camp personnel
Military personnel who died in Nazi concentration camps,Resistance members who died in Nazi concentration camps,People who died in Flossenbürg concentration camp,Nazi concentration camps,1945 deaths,People who died in Sachsenhausen concentration camp,1944 deaths,Victims of Nazism,Polish people who died in Auschwitz concentration camp,Executed military leaders,People who died in Nazi concentration camps
Auschwitz concentration camp medical personnel,Physicians in the Nazi Party,Waffen-SS personnel,Subcamps of Natzweiler-Struthof,Nazi concentration camps,Holocaust perpetrators in Poland,Neuengamme concentration camp personnel,SS personnel,Dachau concentration camp personnel,Auschwitz concentration camp survivors,Auschwitz concentration camp prisoners
Bergen-Belsen concentration camp personnel,Bergen-Belsen concentration camp survivors,Dachau concentration camp personnel,Subcamps of Natzweiler-Struthof,Nazi concentration camps,Auschwitz concentration camp personnel,Buchenwald concentration camp personnel,Majdanek concentration camp personnel,Nazi concentration camp personnel,Mittelbau-Dora concentration camp personnel,People who died in Bergen-Belsen concentration camp
Mittelbau-Dora concentration camp personnel,Dachau concentration camp personnel,Waffen-SS personnel,Subcamps of Natzweiler-Struthof,Nazi concentration camps,Auschwitz concentration camp personnel,Neuengamme concentration camp personnel,Mittelbau-Dora concentration camp survivors,Sachsenhausen concentration camp personnel,SS personnel,Bergen-Belsen concentration camp personnel
Gross-Rosen concentration camp personnel,Waffen-SS personnel,SS personnel,Subcamps of Natzweiler-Struthof,Nazi concentration camps,Dachau concentration camp personnel,Gross-Rosen concentration camp survivors,Majdanek concentration camp personnel,Auschwitz concentration camp personnel,Auschwitz concentration camp medical personnel,Sachsenhausen concentration camp personnel
Kraków-Płaszów concentration camp personnel,Ravensbrück concentration camp personnel,Auschwitz concentration camp personnel,Subcamps of Natzweiler-Struthof,Nazi concentration camps,Mauthausen concentration camp personnel,Buchenwald concentration camp personnel,Majdanek concentration camp personnel,Neuengamme concentration camp personnel,Kraków-Płaszów concentration camp survivors,Nazi concentration camp personnel
Natzweiler-Struthof concentration camp personnel,Auschwitz concentration camp personnel,Sachsenhausen concentration camp personnel,Subcamps of Natzweiler-Struthof,Nazi concentration camps,Mauthausen concentration camp personnel,Waffen-SS personnel,SS personnel,Majdanek concentration camp personnel,Nazi concentration camp personnel,Natzweiler-Struthof concentration camp survivors
SS personnel,Nazi Party leaders and officials,Convicted war criminals,Nazi ideologues,Waffen-SS personnel,Germans,Register of SS leaders in general's rank,Atomwaffen Division members in the United States who faced criminal charges,20th-century Freikorps personnel,Nazi Party politicians,Figures in nationalism
Waffen-SS personnel,SS personnel,Register of SS leaders in general's rank,Polish Righteous Among the Nations,Recipients of the Gold German Cross,Nazi Party leaders and officials,20th-century Freikorps personnel,Physicians in the Nazi Party,Holocaust perpetrators in Poland,German people convicted of crimes against humanity,People from the Kingdom of Bavaria
Last surviving Nazi war criminals,SS personnel,Nazis in South America,Denaturalized former citizens of the United States,Nazis convicted of war crimes,Convicted war criminals,Nazi Party leaders and officials,1921 births,Waffen-SS personnel,Nazi concentration camp commandants,Ukrainian collaborators with Nazi Germany
Czechoslovak fascists,Italian fascists,American fascists,Czechoslovak films,Films about fascists,Presidents of the Czech Republic,Christian fascists,Anti-fascists,Russian fascists,Italian anti-fascists,French fascists
Christian fascists,Nazi Party leaders and officials,Catholicism and far-right politics,Nazi ideologues,SS personnel,Members of the Reichstag of Nazi Germany,American fascists,People who were executed,Romanian fascists,1946 deaths,World War II political leaders
Dutch fascists,Christian fascists,Dutch collaborators with Nazi Germany,Films about fascists,Football clubs in the Netherlands,Islands of the Netherlands,English words of Dutch origin,Dutch cheeses,Italian fascists,1903 births,American fascists
Swiss fascists,Italian fascists,American fascists,Films about fascists,Swiss cheeses,Swiss films,Companies of Switzerland,Newspapers in Switzerland,Wars involving Switzerland,Christian fascists,Anti-fascists
Swedish fascists,Italian fascists,American fascists,Films about fascists,Wars involving Sweden,Companies of Sweden,Swedish-language newspapers,Political parties in Sweden,Christian fascists,Anti-fascists,Russian fascists
Spanish fascists,Nazi Party leaders and officials,Spanish people of the Spanish Civil War (National faction),20th-century Spanish poets,Catholic authors,Spanish anti-communists,Spaniards,Spanish Roman Catholics,Christian fascists,498 Spanish Martyrs,Italian fascists
Serbian fascists,People from Serbia,Serbian journalists,Serbian films,Political parties in Serbia,Films about fascists,Equipment of the Serbian Armed Forces,Serbian mass murderers,Christian fascists,Serbian people convicted of war crimes,Serbian painters
Russian fascists,Russian anti-communists,Russian nationalists,Films about fascists,Modern Russian small arms and light weapons,White Russian emigrants to Germany,Russian monarchists,Italian fascists,American fascists,Nazi Party leaders and officials,Russian liberals
Romanian fascists,Romanian essayists,Romanians,20th-century essayists,Romanian politicians,Christian fascists,Romanian journalists,Members of the Romanian Academy,Members of the Iron Guard,Romanian people of World War II,Romanian people convicted of war crimes
Italian fascists,Italian military personnel of World War I,Italian journalists,20th-century Italian journalists,Nazi Party leaders and officials,People from Italy,20th-century Italian male writers,20th-century Italian politicians,Italian military personnel of World War II,Italian Social Movement politicians,Italian generals
German fascists,Nazi Party leaders and officials,German nationalists,Films about fascists,German anti-communists,Germans,German Roman Catholics,Antisemitism in Germany,British fascists,20th-century German philosophers,Italian fascists
Irish fascists,Irish anti-communists,Members of the Irish Republican Army,Films about fascists,Christian fascists,Irish republicans,Nazi Party leaders and officials,Members of the 2nd Dáil,MPs elected in the 1918 United Kingdom general election,Irish far-right politicians,Italian fascists
Hungarian fascists,Hungarian Nazis,1946 deaths,Hungarian people of World War II,People executed for war crimes,Austro-Hungarian military personnel of World War I,Prime ministers of Hungary,Hungarian politicians,Convicted war criminals,Hungarian people convicted of war crimes,Executed Hungarian collaborators with Nazi Germany
Japanese fascists,Imperial Japanese Army officers,Graduates of the Japanese Imperial Military Academies,Japanese activists,Executions in Japan,Christian fascists,Japanese anti-communists,Japanese military attachés in foreign service,Government ministers of Japan,Japanese writers,Italian fascists
Croatian fascists,Holocaust perpetrators in Yugoslavia,Croatian soldiers,Films about fascists,Newspapers in Croatia,Croatian flags,Croatian people convicted of war crimes,Executed mass murderers,Croatian collaborators with Nazi Germany,Croats of Bosnia and Herzegovina,Christian fascists
Anti-fascists,Anti-revisionists,American anti-fascists,20th-century atheists,Italian anti-fascists,Romanian anti-communists,20th-century translators,1945 deaths,1938 deaths,German anti-fascists,Romanians
Argentine fascists,Christian fascists,Argentine writers,Films about fascists,Argentine male writers,Argentine anti-communists,Nazi Party leaders and officials,Burials at La Recoleta Cemetery,French Argentines,Argentines,Italian fascists
Albanian fascists,Albanian collaborators with Fascist Italy,Government ministers of Albania,Albanian name,Albanian flags,Films about fascists,Albanian anti-communists,Albanian Fascist Party politicians,Kosovo Albanians,Italian fascists,Albanian military personnel
American fascists,American anti-communists,American conspiracy theorists,People convicted of treason,American collaborators with Nazi Germany,American expatriates in Germany,American male journalists,American white supremacists,Prisoners and detainees of the United States federal government,American prisoners and detainees,Christian fascists
Austrian fascists,Christian fascists,Italian fascists,Films about fascists,Austrian Airlines destinations,Newspapers in Austria,Political parties in Austria,Austrian flags,Equipment of the Austrian Armed Forces,Austrian Nazis,American fascists
British fascists,British Army personnel of World War I,British Union of Fascists politicians,British anti-communists,Nazi Party leaders and officials,People detained under Defence Regulation 18B,1878 births,American fascists,"Graduates of the Royal Military College, Sandhurst",Royal Air Force officers,1956 deaths
Bulgarian fascists,Italian fascists,American fascists,Vehicle registration plates of Bulgaria,Bulgarian name,Films about fascists,Bulgarian constituencies,Bulgarian generals,Christian fascists,Anti-fascists,Russian fascists
Brazilian fascists,Christian fascists,Italian fascists,Films about fascists,Football clubs in Brazil,Brazilian Academy Award winners and nominees,Political parties in Brazil,Mammals of Brazil,Brazilian telenovelas,Birds of Brazil,American fascists
Canadian fascists,British fascists,Italian fascists,Films about fascists,Canadian flags,Canadian electoral districts,American fascists,Christian fascists,Anti-fascists,Russian fascists,Italian anti-fascists
French fascists,20th-century French male writers,French collaborators with Nazi Germany,20th-century French journalists,French anti-communists,French male non-fiction writers,Nazi Party leaders and officials,French military personnel of World War I,French Popular Party politicians,SS personnel,Nazi ideologues
Proto-fascists,Nazi Party leaders and officials,Proto-languages,Italian anti-fascists,Films about fascists,Films about Fascist Italy,Italian fascists,American fascists,Christian fascists,Anti-fascists,Russian fascists
Portuguese fascists,Italian fascists,American fascists,Films about fascists,Portuguese flags,Countries and territories where Portuguese is an official language,Football clubs in Portugal,Glossary of Japanese words of Portuguese origin,Ships of the Portuguese Navy,Political parties in Portugal,Portuguese journalists
English fascists,British Union of Fascists politicians,British Army personnel of World War I,British Army personnel of World War II,EngvarB from August 2014,Members of the British Free Corps,Knights Bachelor,Nazi Party leaders and officials,People detained under Defence Regulation 18B,English Roman Catholics,Italian fascists
Indian fascists,Italian fascists,American fascists,Films about fascists,Indian spices,Indian dishes,Indian revolutionaries,Christian fascists,Indian independence activists,Anti-fascists,Russian fascists
Norwegian fascists,Norwegians,Italian fascists,Films about fascists,The largest companies of Norway,Norwegian fjords,Flags of Norway,Newspapers in Norway,Norwegian Air Shuttle destinations,Royal Norwegian Navy ships,Football clubs in Norway
Scottish fascists,Italian fascists,American fascists,Films about fascists,Islands of Scotland,Newspapers in Scotland,Scottish clans,Scottish flags,Companies of Scotland,Christian fascists,MPs for constituencies in Scotland
Greek fascists,Greek anti-communists,Prime ministers of Greece,Films about fascists,Greek mythological figures,Nazi Party leaders and officials,Greek collaborators with Nazi Germany,Kings of Greece,Great Greeks,Heads of government who were later imprisoned,World War II political leaders
Yugoslav fascists,Christian fascists,Italian fascists,Yugoslav films,Yugoslav flags,Films about fascists,Languages of Yugoslavia,Ships of the Royal Yugoslav Navy,Yugoslav rock music groups,American fascists,Anti-fascists
Welsh fascists,Italian fascists,American fascists,Towns in Wales,Films about fascists,Welsh flags,Welsh films,Universities in Wales,Islands of Wales,Welsh people,Christian fascists
Danish fascists,Italian fascists,American fascists,Islands of Denmark,Films about fascists,Newspapers in Denmark,Active Royal Danish Navy ships,Danish flags,Christian fascists,Anti-fascists,Russian fascists
Gay Jews,LGBT Jews,"Gay, lesbian or bisexual people",21st-century American Jews,American gay writers,LGBT people from New York (state),Gay politicians,Jewish American male actors,American male television actors,Jewish American songwriters,Tony Award winners
Gay academics,"Gay, lesbian or bisexual people",American gay writers,American male non-fiction writers,20th-century American male writers,LGBT writers,American LGBT scientists,LGBT Jews,LGBT people from New York (state),Harvard University alumni,21st-century American male writers
Gay actors,"Gay, lesbian or bisexual people",Gay pornographic film actors,Gay villages,Gay-related films,Gay pornographic films,Fictional gay characters,"Gay, Russia",Gay pornography awards,Gay characters in television,Gay musicians
Gay artists,"Gay, lesbian or bisexual people",Gay writers,Gay villages,Gay-related films,Gay pornographic films,Fictional gay characters,"Gay, Russia",Gay pornography awards,Gay characters in television,Gay actors
Gay diplomats,LGBT ambassadors of the United States,"Gay, lesbian or bisexual people",Gay villages,Gay-related films,Gay pornographic films,Fictional gay characters,"Gay, Russia",Gay pornography awards,21st-century American diplomats,Gay politicians
Gay entertainers,Drag queens,"Gay, lesbian or bisexual people",RuPaul's Drag Race contestants,American LGBT entertainers,LGBT YouTubers,Reality television programs with LGBT cast members,LGBT people from California,American drag queens,American gay writers,LGBT people from New York (state)
Gay feminists,"Gay, lesbian or bisexual people",American gay writers,Gay villages,Gay-related films,Gay pornographic films,Male feminists,English feminists,American feminists,Gay academics,Gay politicians
Gay men,Fictional gay men,LGBT Jews,Documentary films about gay men,Gay villages,Gay-related films,Fictional gay characters,"Gay, Russia",Gay pornography awards,X-Men members,Violence against gay men
Gay models,"Gay, lesbian or bisexual people",American male models,American gay writers,Reality television programs with LGBT cast members,LGBT African Americans,Actors in gay pornographic films,Gay entertainers,LGBT fashion designers,Gay sportsmen,American male bloggers
Gay musicians,"Gay, lesbian or bisexual people",Gay actors,Gay villages,Gay-related films,Gay pornographic films,Fictional gay characters,"Gay, Russia",Gay pornography awards,Gay characters in television,Gay artists
Gay politicians,"Gay, lesbian or bisexual people",LGBT politicians in the United Kingdom,MPs elected in the 2019 United Kingdom general election,The first openly LGBT holders of political offices,First openly LGBT politicians in the United States,LGBT members of the Parliament of the United Kingdom,English LGBT politicians,MPs for constituencies in England,Gay Jews,United Kingdom MPs
Gay screenwriters,"Gay, lesbian or bisexual people",American gay writers,Film and television directors,American male screenwriters,Directors associated with art film,Canadian male screenwriters,Gay Jews,LGBT writers,21st-century Canadian screenwriters,Canadian directors
Gay sportsmen,LGBT sportspeople,"Gay, lesbian or bisexual people",American LGBT sportspeople,LGBT figure skaters,LGBT people from California,LGBT professional wrestlers,People on the cover of Attitude magazine,LGBT players of American football,HIV-positive people,LGBT African Americans
Gay writers,"Gay, lesbian or bisexual people",Gay artists,Gay villages,Gay-related films,Gay pornographic films,Fictional gay characters,"Gay, Russia",Gay pornography awards,Gay characters in television,Feature films with gay characters
GAIS managers,Swedish football managers,Allsvenskan players,Gay villages,Gay-related films,Gay pornographic films,Fictional gay characters,"Gay, Russia",Gay pornography awards,Gay characters in television,GAIS players
GAIS players,Allsvenskan players,Superettan players,Swedish men's footballers,IFK Göteborg players,Eliteserien players,IF Elfsborg players,Sweden men's youth international footballers,BK Häcken players,Sweden men's international footballers,Örgryte IS players
"Gay, Russia",Gay villages,Gay actors,Gay artists,Gay-related films,Gay pornographic films,Fictional gay characters,Gay pornography awards,Gay characters in television,"Ura, Russia",Feature films with gay characters
Gay villages,"Towns and cities with 100,000 or more inhabitants/country",March for Our Lives locations,2017 Women's March locations,S&P 500 companies,Sex worker organizations,Adjectivals and demonyms for cities,Twin towns and sister cities in China,African-American neighborhoods,City squares,The Beatles' live performances
