Latvian collaborators with Nazi Germany,Collaborators with Nazi Germany,French collaborators with Nazi Germany,Jewish collaborators with Nazi Germany,Ukrainian collaborators with Nazi Germany,Belgian collaborators with Nazi Germany,Dutch collaborators with Nazi Germany,American collaborators with Nazi Germany,Polish collaborators with Nazi Germany,Czech collaborators with Nazi Germany,Russian collaborators with Nazi Germany
Lithuanian collaborators with Nazi Germany,Collaborators with Nazi Germany,French collaborators with Nazi Germany,Jewish collaborators with Nazi Germany,Ukrainian collaborators with Nazi Germany,Belgian collaborators with Nazi Germany,Dutch collaborators with Nazi Germany,American collaborators with Nazi Germany,Polish collaborators with Nazi Germany,Czech collaborators with Nazi Germany,Russian collaborators with Nazi Germany
Mass media of Nazi Germany,Glossary of Nazi Germany,People of Nazi Germany,Officials of Nazi Germany,Mass media companies of Japan,German flags,Comparative ranks of Nazi Germany,Nazi concentration camps,Nazi Germany paramilitary ranks,Films about Nazi Germany,Films of Nazi Germany
Lawyers in the Nazi Party,SS personnel,Nazi Party politicians,Einsatzgruppen personnel,The Black Book,Gestapo personnel,Holocaust perpetrators in Poland,Nazis convicted of war crimes,Nazi Party officials,Nazi Party leaders and officials,Nazis who committed suicide in Germany
People killed by Nazi Germany,Resistance members killed by Nazi Germany,1944 deaths,Nazi Germany paramilitary ranks,Glossary of Nazi Germany,Films about Nazi Germany,Nazi concentration camps,German flags,Wars involving Germany,Comparative ranks of Nazi Germany,Video games about Nazi Germany
People murdered in Nazi Germany,Nazi ideologues,People of Nazi Germany,Nazi Germany paramilitary ranks,Glossary of Nazi Germany,Films about Nazi Germany,Nazi concentration camps,German flags,Wars involving Germany,Comparative ranks of Nazi Germany,Postage stamps in Nazi Germany
Polish collaborators with Nazi Germany,Jewish collaborators with Nazi Germany,Collaborators with Nazi Germany,French collaborators with Nazi Germany,Ukrainian collaborators with Nazi Germany,Belarusian collaborators with Nazi Germany,Belgian collaborators with Nazi Germany,Dutch collaborators with Nazi Germany,American collaborators with Nazi Germany,Czech collaborators with Nazi Germany,Russian collaborators with Nazi Germany
Physicians in the Nazi Party,Waffen-SS personnel,SS personnel,Convicted war criminals,Auschwitz concentration camp medical personnel,Nazi Party leaders and officials,1945 deaths,Aktion T4 personnel,Dachau concentration camp personnel,Nazis who committed suicide in Germany,German eugenicists
Greek collaborators with Nazi Germany,French collaborators with Nazi Germany,Collaborators with Nazi Germany,Prime ministers of Greece,Jewish collaborators with Nazi Germany,Ukrainian collaborators with Nazi Germany,Belgian collaborators with Nazi Germany,Dutch collaborators with Nazi Germany,American collaborators with Nazi Germany,Polish collaborators with Nazi Germany,Czech collaborators with Nazi Germany
Yugoslav collaborators with Nazi Germany,Collaborators with Nazi Germany,French collaborators with Nazi Germany,Jewish collaborators with Nazi Germany,Ukrainian collaborators with Nazi Germany,Belgian collaborators with Nazi Germany,Dutch collaborators with Nazi Germany,American collaborators with Nazi Germany,Polish collaborators with Nazi Germany,Czech collaborators with Nazi Germany,Russian collaborators with Nazi Germany
Comparative ranks of Nazi Germany,Ranks and insignia of the Waffen-SS,Nazi Germany paramilitary ranks,United States Army officer rank insignia,Glossary of Nazi Germany,People of Nazi Germany,Officials of Nazi Germany,German flags,Nazi concentration camps,Films about Nazi Germany,Films of Nazi Germany
Nazi Party leaders and officials,SS personnel,Convicted war criminals,Nazi ideologues,Germans,Nazi Party officials,Register of SS leaders in general's rank,People who were executed,Holocaust perpetrators in Poland,Atomwaffen Division members in the United States who faced criminal charges,Nazi Party politicians
Authors banned in Nazi Germany,German-language authors,20th-century writers,Philosophers,Non-fiction writers,Biography with signature,Germans,Catholic authors,German Jews,Avant-garde artists,Modernist poets
Postage stamps in Nazi Germany,Postage stamps,British postage stamps,Authors banned in Nazi Germany,Women in Nazi Germany,Nazi Germany paramilitary ranks,Glossary of Nazi Germany,Films about Nazi Germany,Nazi concentration camps,German flags,Wars involving Germany
People executed by Nazi Germany,Nazis executed by Nazi Germany,People executed by Nazi Germany by guillotine,Nazi Germany paramilitary ranks,Glossary of Nazi Germany,Films about Nazi Germany,Nazi concentration camps,German flags,Wars involving Germany,Comparative ranks of Nazi Germany,Executed collaborators with Nazi Germany
Nazis assassinated by Polish resistance,Assassinated Nazis,Nazi Party leaders and officials,Fictional Nazis,Films about Nazis,Nicknames and pseudonyms of Nazis,Greek Resistance organizations,Counties of Poland,Nazi parties,Austrian Nazis,Nazis
Nazis convicted of war crimes,SS personnel,Convicted war criminals,German people convicted of crimes against humanity,Waffen-SS personnel,Nazi Party leaders and officials,Register of SS leaders in general's rank,Reich Security Main Office personnel,20th-century Freikorps personnel,Prisoners and detainees of Germany,The Black Book
Nicknames and pseudonyms of Nazis,Pseudonyms,Nazis,Collective pseudonyms,Anonymity pseudonyms,Nicknames of Chicago,NFL nicknames,U.S. state and territory nicknames,Regional nicknames,Fictional Nazis,Military awards and decorations of Nazi Germany
Lambda Literary Award for Gay Fiction winners,LGBT writers,American gay writers,"Lambda Literary Award for Science Fiction, Fantasy and Horror",Literary awards,Fictional gay characters,Science fiction and fantasy literary awards,Gay pornography awards,British literary awards,American male novelists,American LGBT novelists
People self-identified as ex-ex-gay,People self-identified as ex-gay,"Gay, lesbian or bisexual people",Crazy Ex-Girlfriend characters,Kamen Rider Ex-Aid characters,Christian denominations,The Saint episodes,Gay villages,The King of Fighters video games,Gay-related films,American gay writers
Gay novels prior to the Stonewall riots,Pre–Stonewall riots American television episodes with LGBT themes,Ethnic riots,Food riots,Memorials to Stonewall Jackson,Gay villages,Gay actors,Gay artists,Mass racial violence in the United States,Gay-related films,Films shot on digital video prior to 2012
Politicians of Hindu nationalist political parties,Indian Hindus,Libertarian political parties,Frivolous political parties,Green political parties,Banned political parties,Islamic political parties,Political parties in Iran,Political parties in India,Palestinian political parties,Political parties in Australia
Indigenous Nationalist Party of Twipra politicians,Nationalist parties,Nationalist Movement Party politicians,Indigenous Australian politicians,Frivolous political parties,Nationalist organizations,White nationalist organizations,Massacres of Indigenous Australians,Indigenous peoples of Brazil,Indigenous peoples of Taiwan,Indigenous peoples of South America
Nationalist Congress Party politicians from Maharashtra,Marathi politicians,Bharatiya Janata Party politicians from Maharashtra,Nationalist parties,Frivolous political parties,Lok Sabha members from Maharashtra,21st-century Indian women politicians,Indian National Congress politicians from Maharashtra,United Progressive Alliance candidates in the 2014 Indian general election,Rajya Sabha members from Maharashtra,Shiv Sena politicians
Nationalist Party of Greater Vietnam politicians,Nationalist parties,Nationalist Movement Party politicians,Frivolous political parties,Secretariat of the Communist Party of Vietnam,Nationalist organizations,Public holidays in Vietnam,White nationalist organizations,Districts of Vietnam,Flags of Vietnam,Rivers of Vietnam
21st-century South African criminals,South African serial killers,Male serial killers,BBC's 100 Greatest Films of the 21st Century,20th Century Boys chapters,Canadian tornadoes and tornado outbreaks (since 2001),South African films,South African flags,Solar eclipses in the 21st century,South African people convicted of murder,South Africans
Criminals from Georgia (U.S. state),American people convicted of murder,20th-century American criminals,Municipalities in Georgia (U.S. state),Mountains in Georgia (U.S. state),Birds of Georgia (U.S. state),Hospitals in Georgia (U.S. state),Airports in Georgia (U.S. state),Plantations in Georgia (U.S. state),Schools in Georgia (U.S. state),Rivers of Georgia (U.S. state)
Criminals from New South Wales,20th-century Australian criminals,Australian criminals,Rivers of New South Wales,Local government areas of New South Wales,Power stations in New South Wales,Airports in New South Wales,Floods in New South Wales,Newspapers in New South Wales,Wind farms in New South Wales,Highways in New South Wales
Criminals from New York City,American male criminals,People from New York City,21st-century American criminals,20th-century American criminals,American people convicted of murder,People from Brooklyn,People convicted of murder by New York (state),Italian-American mobsters,American prisoners and detainees,American confidence tricksters
Criminals from the Russian Empire,Revolutionaries from the Russian Empire,Russian scientists,Russian flags,Governorates of the Russian Empire,Viceroyalties of the Russian Empire,Russian criminals,Jews born in the Russian Empire and the Soviet Union,Russian Empire,Historians from the Russian Empire,Physicians from the Russian Empire
Naval Criminal Investigative Service people,Aircraft of the Royal Naval Air Service,People indicted in the International Criminal Court,Investigative journalists,Chinese criminal organizations,Naval battles,Criminal Minds episodes,Criminal Minds characters,Criminal proceedings in the January 6 United States Capitol attack,TGV services,Wire services
Criminal Minds: Beyond Borders characters,Criminal Minds characters,Criminal Minds: Beyond Borders episodes,Batman Beyond characters,Criminal duos,Chinese criminal organizations,Philosophers of mind,Border conflicts,International river borders,Criminal gangs in Los Angeles,Orbits
Criminal Minds: Beyond Borders episodes,Criminal Minds episodes,Criminal Minds: Beyond Borders characters,Batman Beyond episodes,Criminal organizations in DC Comics,Batman Beyond characters,Criminal duos,Chinese criminal organizations,Philosophers of mind,Mind Your Language episodes,Law & Order: Criminal Intent episodes
Law & Order: Criminal Intent characters,Law & Order: Special Victims Unit characters,Law & Order characters,Law & Order: Criminal Intent episodes,Law & Order: LA characters,Law & Order episodes,Scholars of criminal law,Criminal duos,Chinese criminal organizations,Fictional police detectives,Female detective characters
Law & Order: Criminal Intent episodes,Law & Order: Criminal Intent characters,Law & Order episodes,Law & Order: Special Victims Unit episodes (season 20–present),Law & Order characters,Scholars of criminal law,Criminal duos,Law & Order: Special Victims Unit characters,Chinese criminal organizations,Awards and nominations received by Law & Order,Criminal gangs in Los Angeles
Criminal gangs in Los Angeles,California street gangs,Gangs in the Philippines,Chinese criminal organizations,Districts and neighborhoods in Los Angeles,Tallest buildings in Los Angeles,People from Los Angeles,Airports in the Los Angeles area,Los Angeles Angels managers,Los Angeles Angels seasons,Museums in Los Angeles
Criminal organizations in DC Comics,Teams and organizations in DC Comics,DC Comics characters,Criminal organizations in comics,Films based on DC Comics publications,DC Comics imprints,Chinese criminal organizations,DC Animated Universe (comics),Video games based on DC Comics,DC Universe locations,Criminal Minds episodes
Rally of Congolese Democrats and Nationalists politicians,People from the Democratic Republic of the Congo,Democrats of the Left politicians,Nationalist organizations,Rally cars,Nationalist parties,White nationalist organizations,World Rally Championship video games,Fictional United States Democrats,National Rally (France) politicians,Russian nationalists
Swiss people executed by Nazi Germany,People executed by Nazi Germany by guillotine,Nazis executed by Nazi Germany,Nazi Germany paramilitary ranks,Glossary of Nazi Germany,Films about Nazi Germany,Nazi concentration camps,German flags,Wars involving Germany,Comparative ranks of Nazi Germany,People executed by Nazi Germany
South African collaborators with Nazi Germany,Collaborators with Nazi Germany,French collaborators with Nazi Germany,Jewish collaborators with Nazi Germany,Ukrainian collaborators with Nazi Germany,Belgian collaborators with Nazi Germany,Dutch collaborators with Nazi Germany,American collaborators with Nazi Germany,Polish collaborators with Nazi Germany,Czech collaborators with Nazi Germany,Russian collaborators with Nazi Germany
Jewish ghettos established by Nazi Germany,Jewish ghettos in Nazi-occupied Belarus,Jewish collaborators with Nazi Germany,Jewish emigrants from Nazi Germany,Nazi Germany paramilitary ranks,Glossary of Nazi Germany,Films about Nazi Germany,Nazi concentration camps,German flags,Wars involving Germany,Comparative ranks of Nazi Germany
Jewish ghettos in Nazi-occupied Belarus,Jewish ghettos established by Nazi Germany,Belarusian Jews,Jews born in the Russian Empire and the Soviet Union,Under-occupied developments in China,Cities and largest towns in Belarus,Airports in Belarus,Castles in Belarus,Banks in Belarus,Occupy movement protest locations,Universities in Belarus
French people executed by Nazi Germany,Resistance members killed by Nazi Germany,1944 deaths,Paris Métro stations,French Resistance members,Communist members of the French Resistance,French civilians killed in World War II,Victims of Nazism,People executed by Nazi Germany by guillotine,1942 deaths,1941 deaths
Hungarian people executed by Nazi Germany,Resistance members killed by Nazi Germany,Nazis executed by Nazi Germany,Nazi Germany paramilitary ranks,Glossary of Nazi Germany,Films about Nazi Germany,Nazi concentration camps,German flags,Wars involving Germany,Comparative ranks of Nazi Germany,People executed by Nazi Germany
American people executed by Nazi Germany,Nazis executed by Nazi Germany,People executed by Nazi Germany,Nazi Germany paramilitary ranks,Glossary of Nazi Germany,Films about Nazi Germany,Nazi concentration camps,German flags,Wars involving Germany,Comparative ranks of Nazi Germany,People executed by Nazi Germany by guillotine
Austrian people executed by Nazi Germany,People executed by Nazi Germany by guillotine,Austrian resistance members,Nazi Germany paramilitary ranks,Glossary of Nazi Germany,Films about Nazi Germany,1943 deaths,People from Vienna,Austrian military personnel of World War II,1944 deaths,Executed Austrian Nazis
Belgian people executed by Nazi Germany,People executed by Nazi Germany by guillotine,Belgians,Nazi Germany paramilitary ranks,Glossary of Nazi Germany,Films about Nazi Germany,Nazi concentration camps,German flags,Wars involving Germany,Nazis executed by Nazi Germany,People executed by Nazi Germany
Bosnian Muslim collaborators with Nazi Germany,Executed Yugoslav collaborators with Nazi Germany,Collaborators with Nazi Germany,French collaborators with Nazi Germany,Jewish collaborators with Nazi Germany,Ukrainian collaborators with Nazi Germany,Belgian collaborators with Nazi Germany,Dutch collaborators with Nazi Germany,Croatian collaborators with Nazi Germany,American collaborators with Nazi Germany,Polish collaborators with Nazi Germany
German people executed by Nazi Germany,People executed by Nazi Germany by guillotine,Nazis executed by Nazi Germany,Nazi concentration camps,German flags,Wars involving Germany,German films of 1933–1945,People who were executed,Executed German people,Germans,People executed by Germany by decapitation
People executed in Nazi concentration camps,Nazi concentration camps,Executed Nazi concentration camp personnel,Nazi concentration camp personnel,Francoist concentration camps,Nazi concentration camp commandants,Nazi concentration camp survivors,Female guards in Nazi concentration camps,People who died in Nazi concentration camps,Prisoners of Nazi concentration camps,Children who died in Nazi concentration camps
Research and development in Nazi Germany,Nazi ideologues,Federally funded research and development centers,Aerospace engineers,Video games developed in Germany,Nazi Germany paramilitary ranks,Glossary of Nazi Germany,Films about Nazi Germany,Nazi concentration camps,Military awards and decorations of Nazi Germany,German flags
Resistance members killed by Nazi Germany,1944 deaths,1943 deaths,French Resistance members,1942 deaths,Female resistance members of World War II,1945 deaths,Dutch resistance members,Yugoslav Partisans members,French people executed by Nazi Germany,1906 births
Executed Belgian collaborators with Nazi Germany,Belgian collaborators with Nazi Germany,Executed collaborators with Nazi Germany,Collaborators with Nazi Germany,Executed Dutch collaborators with Nazi Germany,French collaborators with Nazi Germany,Jewish collaborators with Nazi Germany,Executed British collaborators with Nazi Germany,Ukrainian collaborators with Nazi Germany,Executed Soviet collaborators with Nazi Germany,Dutch collaborators with Nazi Germany
Executed British collaborators with Nazi Germany,Executed collaborators with Nazi Germany,British collaborators with Nazi Germany,Collaborators with Nazi Germany,Executed Dutch collaborators with Nazi Germany,French collaborators with Nazi Germany,Jewish collaborators with Nazi Germany,Ukrainian collaborators with Nazi Germany,Belgian collaborators with Nazi Germany,Executed Soviet collaborators with Nazi Germany,Executed Belgian collaborators with Nazi Germany
Executed Czechoslovak collaborators with Nazi Germany,Slovak collaborators with Nazi Germany,Executed collaborators with Nazi Germany,Czech collaborators with Nazi Germany,Collaborators with Nazi Germany,Executed Dutch collaborators with Nazi Germany,French collaborators with Nazi Germany,Jewish collaborators with Nazi Germany,Executed British collaborators with Nazi Germany,Ukrainian collaborators with Nazi Germany,Belgian collaborators with Nazi Germany
Executed Danish collaborators with Nazi Germany,Executed collaborators with Nazi Germany,Danish collaborators with Nazi Germany,Collaborators with Nazi Germany,Executed Dutch collaborators with Nazi Germany,French collaborators with Nazi Germany,Jewish collaborators with Nazi Germany,Executed British collaborators with Nazi Germany,Ukrainian collaborators with Nazi Germany,Belgian collaborators with Nazi Germany,Executed Soviet collaborators with Nazi Germany
Executed Dutch collaborators with Nazi Germany,Dutch collaborators with Nazi Germany,Executed collaborators with Nazi Germany,Collaborators with Nazi Germany,French collaborators with Nazi Germany,Jewish collaborators with Nazi Germany,Executed British collaborators with Nazi Germany,Ukrainian collaborators with Nazi Germany,Belgian collaborators with Nazi Germany,Executed Soviet collaborators with Nazi Germany,Executed Belgian collaborators with Nazi Germany
Executed Hungarian collaborators with Nazi Germany,1946 deaths,Hungarian Nazis,People executed for war crimes,Hungarian people of World War II,Hungarian people convicted of war crimes,Executed collaborators with Nazi Germany,Convicted war criminals,Collaborators with Nazi Germany,Executed Dutch collaborators with Nazi Germany,Hungarian collaborators with Nazi Germany
Executed Lithuanian collaborators with Nazi Germany,Executed collaborators with Nazi Germany,Lithuanian collaborators with Nazi Germany,Collaborators with Nazi Germany,Executed Dutch collaborators with Nazi Germany,French collaborators with Nazi Germany,Jewish collaborators with Nazi Germany,Executed British collaborators with Nazi Germany,Ukrainian collaborators with Nazi Germany,Belgian collaborators with Nazi Germany,Executed Soviet collaborators with Nazi Germany
Executed Luxembourgian collaborators with Nazi Germany,Executed collaborators with Nazi Germany,Collaborators with Nazi Germany,Executed Dutch collaborators with Nazi Germany,French collaborators with Nazi Germany,Jewish collaborators with Nazi Germany,Executed British collaborators with Nazi Germany,Ukrainian collaborators with Nazi Germany,Belgian collaborators with Nazi Germany,Executed Soviet collaborators with Nazi Germany,Executed Belgian collaborators with Nazi Germany
Executed Norwegian collaborators with Nazi Germany,Members of Nasjonal Samling,Executed collaborators with Nazi Germany,Collaborators with Nazi Germany,Executed Dutch collaborators with Nazi Germany,French collaborators with Nazi Germany,Jewish collaborators with Nazi Germany,Executed British collaborators with Nazi Germany,Ukrainian collaborators with Nazi Germany,Belgian collaborators with Nazi Germany,Executed Soviet collaborators with Nazi Germany
Executed Romanian collaborators with Nazi Germany,Executed collaborators with Nazi Germany,Collaborators with Nazi Germany,Executed Dutch collaborators with Nazi Germany,French collaborators with Nazi Germany,Jewish collaborators with Nazi Germany,Executed British collaborators with Nazi Germany,Ukrainian collaborators with Nazi Germany,Belgian collaborators with Nazi Germany,Executed Soviet collaborators with Nazi Germany,Executed Belgian collaborators with Nazi Germany
Executed Soviet collaborators with Nazi Germany,Executed collaborators with Nazi Germany,Collaborators with Nazi Germany,Soviet collaborators with Nazi Germany,Executed Dutch collaborators with Nazi Germany,French collaborators with Nazi Germany,Jewish collaborators with Nazi Germany,Belarusian collaborators with Nazi Germany,Executed British collaborators with Nazi Germany,Ukrainian collaborators with Nazi Germany,Belgian collaborators with Nazi Germany
Executed Yugoslav collaborators with Nazi Germany,1945 deaths,Executed collaborators with Nazi Germany,Bosnian Muslim collaborators with Nazi Germany,Collaborators with Nazi Germany,Executed Dutch collaborators with Nazi Germany,French collaborators with Nazi Germany,Jewish collaborators with Nazi Germany,Executed British collaborators with Nazi Germany,Yugoslav collaborators with Nazi Germany,Ukrainian collaborators with Nazi Germany
Female guards in Nazi concentration camps,Ravensbrück concentration camp personnel,Executed German women,Nazi concentration camps,Francoist concentration camps,Holocaust perpetrators in Poland,Auschwitz concentration camp personnel,Pages using infobox criminal with motive parameter,Majdanek concentration camp personnel,Executed Nazi concentration camp personnel,Polish Righteous Among the Nations
LGBT people in the Nazi Party,Nazi Party leaders and officials,Nazi Party politicians,Nazi parties,Nazi Germany paramilitary ranks,Nazi Party organizations,German flags,Acts of violence against LGBT people,20th-century Freikorps personnel,Nazi Party members,"Gay, lesbian or bisexual people"
New Zealand collaborators with Nazi Germany,Collaborators with Nazi Germany,French collaborators with Nazi Germany,Jewish collaborators with Nazi Germany,Ukrainian collaborators with Nazi Germany,Belgian collaborators with Nazi Germany,Dutch collaborators with Nazi Germany,American collaborators with Nazi Germany,Polish collaborators with Nazi Germany,Czech collaborators with Nazi Germany,Russian collaborators with Nazi Germany
Nazi persecution of the Catholic Church,Roman Catholics in the German Resistance,Christian martyrs,Catholic Marian church buildings,Anglo-Catholic churches,Films critical of the Catholic Church,Glossary of Nazi Germany,Index of Catholic Church articles,Critics of the Catholic Church,Popes,Catholic musicians
Austrian Nazis convicted of war crimes,Convicted war criminals,Nazis convicted of war crimes,War crimes,Nazi Party leaders and officials,Austro-Hungarian military personnel of World War I,American federal politicians convicted of crimes,Austrian people convicted of crimes against humanity,Professional sportspeople convicted of crimes,Last surviving Nazi war criminals,Austrian Nazis
Nazis executed in the Soviet Union,"Orders, decorations, and medals of the Soviet Union",Russian artists,Tallest structures built in the Soviet Union,Russian ballet dancers,Massacres in the Soviet Union,Films set in the Soviet Union,Magazines published in the Soviet Union,Wars involving the Soviet Union,Russian mathematicians,Heroes of the Soviet Union
Nazis sentenced to death in absentia,SS personnel,Last surviving Nazi war criminals,Nazis convicted of war crimes,French collaborators with Nazi Germany,Nazi Party leaders and officials,People sentenced to death in absentia,Belgian collaborators with Nazi Germany,Former heads of regimes who were sentenced to death,Nazi propagandists,Nazi Party officials
Nazis who committed suicide in Austria,1945 deaths,SS personnel,Nazis who committed suicide,Register of SS leaders in general's rank,Nazis who committed suicide in Germany,Suicides,American politicians who committed suicide,Nazi Party leaders and officials,British politicians who committed suicide,Physicians in the Nazi Party
Nazis who committed suicide in Germany,1945 deaths,SS personnel,Nazi Party leaders and officials,Members of the Reichstag of Nazi Germany,Suicides,Holocaust perpetrators in Germany,Waffen-SS personnel,Nazi Party politicians,German military personnel who committed suicide,Joint suicides by Nazis
