Nationalist Congress Party politicians,Nationalist Congress Party politicians from Maharashtra,Marathi politicians,Nationalist parties,Frivolous political parties,Nationalist organizations,White nationalist organizations,Indian National Congress politicians,Bharatiya Janata Party politicians from Maharashtra,Shiv Sena politicians,Nationalist Movement Party politicians
Nationalist Democracy Party politicians,Nationalist Movement Party politicians,Nationalist parties,Frivolous political parties,Motherland Party (Turkey) politicians,Nationalist organizations,White nationalist organizations,Wars between democracies,Christian Democracy (Italy) politicians,Nazis,Bangladesh Nationalist Party politicians
Nationalist Democratic Action politicians,Nationalist organizations,Democratic Action (Venezuela) politicians,Nationalist parties,White nationalist organizations,Russian nationalists,Action hero,Action films,Action games,American action films,Action-adventure games
Nationalist Liberal Party politicians,Presidents of Nicaragua,Nationalist parties,Nationalist Movement Party politicians,Frivolous political parties,Nationalist organizations,White nationalist organizations,Liberal arts colleges in the United States,Liberal Democratic Party (Japan) politicians,Liberal Democratic Party of Russia politicians,Nicaraguans
Nationalist Liberation Alliance politicians,Nationalist organizations,Nationalist parties,Democratic Left Alliance politicians,White nationalist organizations,National Alliance (Italy) politicians,Military alliances,People's Liberation Army Navy Submarine Force,Richest American politicians,Equipment of the People's Liberation Army Ground Force,Ships of the People's Liberation Army Navy
Nationalist Movement Party politicians,Turkish nationalists,Members of the 25th Parliament of Turkey,Nationalist parties,Political parties in Serbia,Frivolous political parties,Nationalist organizations,White nationalist organizations,Members of the 23rd Parliament of Turkey,21st-century Turkish politicians,Deniers of the Armenian genocide
Nationalist Party (Australia) politicians,Australian knights and dames,Nationalist parties,Nationalist Movement Party politicians,Frivolous political parties,Nationalist organizations,Political parties in Australia,White nationalist organizations,Nazis,Bangladesh Nationalist Party politicians,Third-party and independent members of the United States Congress
Nationalist Party (Malta) MEPs,Members of the European Parliament for Malta,University of Malta alumni,Nationalist parties,Frivolous political parties,Political parties in Malta,Nationalist organizations,White nationalist organizations,Cities in Malta,Public holidays in Malta,Flags of Malta
Nationalist Party (Malta) politicians,Members of the House of Representatives of Malta,Maltese people,Nationalist parties,Frivolous political parties,Political parties in Malta,Nationalist organizations,White nationalist organizations,University of Malta alumni,Mayors of places in Malta,People from Valletta
Nationalist People's Coalition politicians,Members of the 15th Congress of the Philippines,Liberal Party (Philippines) politicians,Lakas–CMD politicians,20th-century Filipino lawyers,Ateneo de Manila University alumni,Filipino Roman Catholics,Mayors in Metro Manila,Filipino male actors,Current Philippine provincial governors,PDP–Laban politicians
Nationalist Republican Alliance politicians,Salvadorans,Presidents of El Salvador,Nationalist organizations,Nationalist parties,White nationalist organizations,Military alliances,2008 Republican Party vice presidential candidate selection,Films featuring the Irish Republican Army,Salvadoran politicians,Democratic Left Alliance politicians
Peruvian Nationalist Party politicians,Members of the Congress of the Republic of Peru,Congresspeople of Peru,Nationalist parties,Political parties in Peru,Frivolous political parties,Nationalist organizations,White nationalist organizations,Football clubs in Peru,Union for Peru politicians,Peruvian politicians
Zanzibar Nationalist Party politicians,Nationalist parties,Nationalist Movement Party politicians,Frivolous political parties,Nationalist organizations,Nazis,White nationalist organizations,Airports in Tanzania,Sultans of Zanzibar,Bangladesh Nationalist Party politicians,Third-party and independent members of the United States Congress
Nationalist Party MPs (Ireland),Parliamentary constituencies in Northern Ireland,MPs elected in the 1918 United Kingdom general election,Nationalist parties,Frivolous political parties,Nationalist organizations,White nationalist organizations,Political parties in Northern Ireland,MPs elected in the December 1910 United Kingdom general election in Ireland,Irish Parliamentary Party MPs,Scottish National Party MPs
Serbian collaborators with Fascist Italy,Chetnik personnel of World War II,Collaborators with Fascist Italy,Films about Fascist Italy,Serbian collaborators with Nazi Germany,American collaborators with Fascist Italy,Albanian collaborators with Fascist Italy,Ukrainian collaborators with Russia,French collaborators with Nazi Germany,Collaborators with Nazi Germany,Jewish collaborators with Nazi Germany
Slovenian collaborators with Fascist Italy,Collaborators with Fascist Italy,American collaborators with Fascist Italy,Films about Fascist Italy,Albanian collaborators with Fascist Italy,Ukrainian collaborators with Russia,Nazi ideologues,French collaborators with Nazi Germany,Collaborators with Nazi Germany,Jewish collaborators with Nazi Germany,Ukrainian collaborators with Nazi Germany
Croatian collaborators with Fascist Italy,Croatian collaborators with Nazi Germany,Leaders of Independent State of Croatia,Films about Fascist Italy,1945 deaths,Croatian soldiers,Collaborators with Fascist Italy,Nazi ideologues,Holocaust perpetrators in Yugoslavia,American collaborators with Fascist Italy,People from Croatia
American collaborators with Fascist Italy,American fascists,Collaborators with Fascist Italy,Films about Fascist Italy,Songwriter collaborations,American collaborators with Nazi Germany,Albanian collaborators with Fascist Italy,Italian fascists,Ukrainian collaborators with Russia,French collaborators with Nazi Germany,Collaborators with Nazi Germany
Albanian collaborators with Fascist Italy,Albanian collaborators with Nazi Germany,Government ministers of Albania,Films about Fascist Italy,Albanian fascists,Albanian anti-communists,1945 deaths,Collaborators with Fascist Italy,Nazi ideologues,Biography with signature,20th-century Albanian politicians
American criminal snipers,Snipers,American male criminals,Sniper rifles,Films about snipers,Chinese criminal organizations,Criminal Minds episodes,Criminal Minds characters,American people convicted of murder,20th-century American criminals,American assassins
Criminal (band) albums,Criminal duos,2009 albums,Chinese criminal organizations,Criminal Minds episodes,Criminal Minds characters,Australian criminals,2011 albums,Law & Order: Criminal Intent episodes,Criminal gangs in Los Angeles,Fictional criminals
Criminal Nation albums,Criminal duos,Roc Nation albums discography,Chinese criminal organizations,Criminal Minds episodes,Kid Nation participants,Criminal Minds characters,1992 albums,Law & Order: Criminal Intent episodes,Criminal gangs in Los Angeles,Fictional criminals
Criminal defense lawyers,20th-century American lawyers,21st-century American lawyers,Chinese criminal organizations,Criminal Minds episodes,New York (state) lawyers,California lawyers,American legal scholars,American lawyers,Jewish American attorneys,21st-century American Jews
Chinese criminal organizations,Cities in China,Cities by GDP,Criminal gangs in Los Angeles,Sex worker organizations,Chinese administrative divisions by GDP,Chicago criminal organizations and crime bosses,Criminal organizations in DC Comics,Chinese criminals,Chinese prefecture-level cities by GDP per capita,Criminal organizations in comics
Criminal Minds characters,Criminal Minds: Beyond Borders characters,Criminal Minds episodes,Male detective characters,Criminal duos,Chinese criminal organizations,Philosophers of mind,Mind Your Language episodes,Criminal gangs in Los Angeles,Criminal organizations in DC Comics,States parties to the Rome Statute of the International Criminal Court
Criminal Minds episodes,Criminal Minds: Beyond Borders episodes,Criminal Minds characters,Criminal organizations in DC Comics,Criminal duos,Chinese criminal organizations,Philosophers of mind,Criminal gangs in Los Angeles,Fictional criminals,Mind Your Language episodes,Law & Order: Criminal Intent episodes
Directors of gay pornographic films,American pornographic film directors,Actors in gay pornographic films,Gay pornographic films,Producers of gay pornographic films,American actors in gay pornographic films,"Gay, lesbian or bisexual people",American male pornographic film actors,French pornographic film directors,American film directors,LGBT pornographic film actors
Documentary films about gay men,LGBT-related films,Documentary films,Gay men,Fictional gay men,Gay-related films,Documentary films about HIV/AIDS,2015 films,2021 films,American documentary films,LGBT-related films of 2021
Films about gay male pornography,Films about pornography,LGBT-related films,Gay pornography awards,Actors in gay pornographic films,Pornographic magazines,Gay male prostitutes,Gay villages,Gay-related films,Documentary films about pornography,Documentary films about gay male pornography
Films directed by Cesc Gay,Spanish comedy films,LGBT-related films,Gay pornographic film actors,Gay villages,Gay actors,Feature films with gay characters,Fictional gay characters,"Gay, Russia",Gay pornography awards,Gay-related films
Albums produced by Gay Woods,John Leckie production discography,Woods,Gay villages,Gay actors,Gay artists,Career achievements by Tiger Woods,Programs produced by ABC Signature,Gay-related films,Gay pornographic films,Works produced by Hanna-Barbera Productions
Gay for Johnny Depp albums,Johnny Depp filmography,Films produced by Johnny Depp,Gay villages,Gay actors,Gay artists,Johnny Cash albums discography,2007 albums,Fictional gay characters,"Gay, Russia",Gay pornography awards
Producers of gay pornographic films,Directors of gay pornographic films,American pornographic film directors,Gay pornographic films,Pornographic film studios,Pornographic magazines,Gay-related films,Actors in gay pornographic films,Gay pornographic film actors,"Gay, lesbian or bisexual people",French pornographic film directors
Actors in gay pornographic films,American actors in gay pornographic films,American male pornographic film actors,Animals displaying homosexual behavior,"Gay, lesbian or bisexual people",Gay pornographic film actors,20th-century American male actors,Directors of gay pornographic films,American pornographic film directors,HIV-positive people,Pornographic actors who appeared in mainstream films
Feature films with gay characters,Films featuring gay bathhouses,Fictional gay characters,Feature film series with nine entries,Gay characters in television,Feature film series with three entries,Gay pornographic film actors,Gay villages,LGBT-related films,Gay characters in animation,Gay characters in anime
Mayors of Ku-ring-gai,Ring roads,Ring characters,Ring of Honor personnel,Electoral results for the district of Ku-ring-gai,Ring galaxies,Gay villages,Gay actors,Ku Klux Klan organizations,Gay-related films,Gay pornographic films
"Gay, lesbian or bisexual people",LGBT Jews,American television actresses,LGBT-related films,Comedians,American male television actors,Bisexual people,Singer-songwriters,LGBT sportspeople,Bisexual actresses,LGBT writers
Congress of Ukrainian Nationalists politicians,Ukrainian nationalists,Ukrainian politicians,Nationalist organizations,Nationalist parties,Active Ukrainian Navy ships,Armoured fighting vehicles of Ukraine,White nationalist organizations,Companies of Ukraine,Diplomatic missions of Ukraine,Vehicle registration plates of Ukraine
United Alignment of Nationalists politicians,Prime ministers of Greece,Government ministers of Greece,Nationalist organizations,Nationalist parties,White nationalist organizations,Richest American politicians,National and Kapodistrian University of Athens alumni,Russian nationalists,Figures in nationalism,Nigerian nationalists
Nationalists of North American nations,American nationalists,American white nationalists,Sovereign states and dependent territories in North America,Nationalist organizations,Birds of North America,Cities in North America,Mammals of North America,Extreme points of North America,Rivers of the Americas,Nationalist parties
Collaborators with Nazi Germany,French collaborators with Nazi Germany,Jewish collaborators with Nazi Germany,Ukrainian collaborators with Nazi Germany,Belgian collaborators with Nazi Germany,Dutch collaborators with Nazi Germany,American collaborators with Nazi Germany,Polish collaborators with Nazi Germany,Czech collaborators with Nazi Germany,Russian collaborators with Nazi Germany,British collaborators with Nazi Germany
Films of Nazi Germany,German black-and-white films,UFA GmbH films,Nazi propaganda films,German drama films,Films shot at Babelsberg Studios,Tobis Film films,1937 films,German films of 1942,1942 films,Films based on actual events (before 2000)
Films about Nazi Germany,Films set in Germany,Films set in Berlin,West German films,Holocaust films,German drama films,German black-and-white films,War films and TV specials set between 1914 and 1945,Films set in the 1940s,Films based on actual events (before 2000),World War II spy films
Films about Nazi fugitives,Films about Nazi hunters,Holocaust films,Nazi fugitives,Fugitives,Video games about Nazi Germany,Films about Nazis,Films about neo-Nazis,Films about Nazi fugitives in South America,Films about Nazi Germany,Films about cannibalism
Films about Nazi hunters,Holocaust films,Films about Nazi fugitives,Nazi hunters,Hunter × Hunter characters,Hunter × Hunter chapters,Films about Nazis,Films about hunters,Films about Nazi fugitives in South America,American films about revenge,Films about the Mossad
Exiles from Nazi Germany,Communist Party of Germany politicians,Social Democratic Party of Germany members,Nazi Germany paramilitary ranks,Glossary of Nazi Germany,Films about Nazi Germany,Nazi concentration camps,German flags,Wars involving Germany,Social Democratic Party of Germany politicians,Socialist Unity Party of Germany members
Officials of Nazi Germany,Nazi Party leaders and officials,1945 deaths,Glossary of Nazi Germany,German flags,Comparative ranks of Nazi Germany,Nazi concentration camps,Nazi Germany paramilitary ranks,Films about Nazi Germany,Films of Nazi Germany,Wars involving Germany
Emigrants from Nazi Germany,Jewish art collectors,German emigrants to the United States,Nazi Germany paramilitary ranks,Glossary of Nazi Germany,Films about Nazi Germany,Nazi concentration camps,German flags,Wars involving Germany,Comparative ranks of Nazi Germany,Video games about Nazi Germany
Law of Nazi Germany,Glossary of Nazi Germany,People of Nazi Germany,Officials of Nazi Germany,German flags,Comparative ranks of Nazi Germany,Nazi concentration camps,Nazi Germany paramilitary ranks,Films about Nazi Germany,Films of Nazi Germany,Wars involving Germany
Nazi-era ghetto inmates,Auschwitz concentration camp survivors,Łódź Ghetto inmates,Jewish ghettos established by Nazi Germany,Prisoner characters – inmates,Japanese era name,1928 births,Victims and survivors of Auschwitz,Warsaw Ghetto inmates,Hungarian Jews,Kraków Ghetto inmates
Nazi Germany and Catholicism,Nazi Germany paramilitary ranks,Glossary of Nazi Germany,Nazi Germany ministers,Films about Nazi Germany,Nazi concentration camps,Military awards and decorations of Nazi Germany,People of Nazi Germany,German flags,"Orders, decorations, and medals of Nazi Germany",Wars involving Germany
Nazi Germany and Protestantism,Nazi Germany paramilitary ranks,Glossary of Nazi Germany,Nazi Germany ministers,Films about Nazi Germany,Nazi concentration camps,Military awards and decorations of Nazi Germany,People of Nazi Germany,German flags,"Orders, decorations, and medals of Nazi Germany",Wars involving Germany
Nazi concentration camp commandants,SS personnel,Sachsenhausen concentration camp personnel,Nazi concentration camps,Holocaust perpetrators in Poland,Dachau concentration camp personnel,Waffen-SS personnel,Nazis convicted of war crimes,1945 deaths,Flossenbürg concentration camp personnel,Holocaust perpetrators in Germany
Nazi concentration camp survivors,Auschwitz concentration camp survivors,Buchenwald concentration camp survivors,Nazi concentration camps,Subcamps of Natzweiler-Struthof,Sachsenhausen concentration camp survivors,Mauthausen concentration camp survivors,Dachau concentration camp survivors,Nazi concentration camp personnel,Nazi concentration camp commandants,Jewish concentration camp survivors
Nazi war crimes trials,Nazis convicted of war crimes,War crimes,Last surviving Nazi war criminals,Glossary of Nazi Germany,Neo-Nazi organizations,World War II military operations,Films about war crimes,Trial films,Nazi Germany paramilitary ranks,Nazi parties
People of Nazi Germany,Nazi Party leaders and officials,Nazi Party members,Glossary of Nazi Germany,German flags,Comparative ranks of Nazi Germany,Nazi concentration camps,Nazi Germany paramilitary ranks,Films about Nazi Germany,Films of Nazi Germany,Wars involving Germany
Women in Nazi Germany,Nazi propagandists,Nazi Party members,Nazi Germany paramilitary ranks,Glossary of Nazi Germany,Films about Nazi Germany,Nazi concentration camps,German flags,Wars involving Germany,Comparative ranks of Nazi Germany,Postage stamps in Nazi Germany
Glossary of Nazi Germany,Comparative ranks of Nazi Germany,Political ideologies,Glossary of German military terms,Films of Nazi Germany,Films about Nazi Germany,Neo-Nazi organizations,Military awards and decorations of Nazi Germany,People of Nazi Germany,Glossary of rhetorical terms,Officials of Nazi Germany
Nazi Germany paramilitary ranks,Comparative ranks of Nazi Germany,Glossary of Nazi Germany,Nazi Germany ministers,Films about Nazi Germany,Nazi concentration camps,People of Nazi Germany,German flags,Academic ranks,Wars involving Germany,Video games about Nazi Germany
Documentary films about Nazis,Documentary films about World War II,American documentary films,Nazis,Holocaust films,Documentary films about the Holocaust,Films about Nazis,Documentary films,Environmental films,Documentary films about China,Documentary films about Nazi Germany
Films about neo-Nazis,Racism-related films,Neo-Nazis,American neo-Nazis,American independent films,Neo-Nazi organizations,Neo-Nazi bands,Russian neo-Nazis,Films about terrorism,Films about Nazis,American action comedy films
Joint suicides by Nazis,1945 deaths,Nazis who committed suicide in Germany,Suicides in fiction,Fictional Nazis,Films about Nazis,Nazi Party leaders and officials,Suicides,Joint suicides,Nazi Party members,Austrian Nazis
Nazis convicted in absentia,Nazis convicted of war crimes,Polish collaborators with Nazi Germany,Fictional Nazis,Films about Nazis,Nicknames and pseudonyms of Nazis,People convicted of treason,Nazi propagandists,Austrian Nazis convicted of war crimes,French collaborators with Nazi Germany,Nazis
Nazis convicted of crimes,Nazi Party leaders and officials,Prisoners and detainees of Germany,Members of the Reichstag of Nazi Germany,SS personnel,Nazi propagandists,Gauleiters,Nazi Party members,Sturmabteilung personnel,Waffen-SS personnel,20th-century Freikorps personnel
Nazis executed in Czechoslovakia,Nazi Party leaders and officials,Executed Austrian Nazis,Fictional Nazis,Films about Nazis,Nicknames and pseudonyms of Nazis,Nazi parties,Neo-Nazi organizations,Nazis,Nazis executed in the Soviet Union,Nazis convicted of war crimes
Nazis executed in Norway,Gestapo personnel,Executed Austrian Nazis,Fictional Nazis,Films about Nazis,Airports in Norway,Towns and cities in Norway,Universities in Norway,Nicknames and pseudonyms of Nazis,Banks in Norway,Newspapers in Norway
Nazis executed in Yugoslavia,Executed Austrian Nazis,Nazis,Fictional Nazis,Films about Nazis,Nicknames and pseudonyms of Nazis,Yugoslav flags,Mass executions and massacres in Yugoslavia during World War II,Nazi parties,Nazis executed in the Soviet Union,Nazi Party members
Nazis from outside Germany,Nazi Party leaders and officials,Nazi Germany ministers,Glossary of Nazi Germany,Films about Nazi Germany,Nazi Germany paramilitary ranks,Comparative ranks of Nazi Germany,Outsiders members,Video games about Nazi Germany,Films of Nazi Germany,Nazi propagandists
Nazis in South America,Last surviving Nazi war criminals,SS personnel,Cities in South America,Conflicts in South America,Sovereign states and dependent territories in South America,Films about Nazi fugitives in South America,Rivers of the Americas,Tallest buildings in South America,Films set in South America,Glaciers in South America
Nazis who committed suicide,German military personnel who committed suicide,1945 deaths,Suicides,SS personnel,Nazis who committed suicide in Germany,American politicians who committed suicide,British politicians who committed suicide,Waffen-SS personnel,Japanese politicians who committed suicide,American military personnel who committed suicide
Documentary films about criminals,Documentary films,Environmental films,Documentary films about China,Documentary films about World War II,Films about the Japanese American internment,Biographical films about criminals,Documentary films about prostitution,Documentary films about lesbians,Documentary films about sexuality,Documentary films about pornography
Central African Republic criminals,Heads of state of the Central African Republic,Heads of government of the Central African Republic,Conflicts in Africa,Cities in the Central African Republic,Public holidays in the Central African Republic,Diplomatic missions of the Central African Republic,Political parties in the Central African Republic,Airports in the Central African Republic,Rivers of the Central African Republic,Airlines of the Central African Republic
Trinidad and Tobago criminals,Heads of state of Trinidad and Tobago,Public holidays in Trinidad and Tobago,Cities and towns in Trinidad and Tobago,Political parties in Trinidad and Tobago,Colleges and universities in Trinidad and Tobago,Dams and reservoirs in Trinidad and Tobago,Birds of Trinidad and Tobago,Islands of Trinidad and Tobago,Schools in Trinidad and Tobago,Trinidad and Tobago scientists
Scottish white-collar criminals,White-collar criminals,American white-collar criminals,White Collar episodes,White Collar characters,Fictional white-collar criminals,Chinese criminal organizations,Pakistani white-collar criminals,British white-collar criminals,Norwegian white-collar criminals,Scottish criminals
Russian white-collar criminals,White-collar criminals,American white-collar criminals,White Collar episodes,White Collar characters,Fictional white-collar criminals,Russian black-and-white films,Pakistani white-collar criminals,Russian criminals,British white-collar criminals,Norwegian white-collar criminals
Romanian white-collar criminals,Romanian businesspeople,White-collar criminals,White Collar episodes,White Collar characters,Fictional white-collar criminals,Romanian politicians convicted of crimes,Romanian politicians,American white-collar criminals,Romanian prisoners and detainees,Pakistani white-collar criminals
French white-collar criminals,White-collar criminals,American white-collar criminals,White Collar episodes,White Collar characters,Fictional white-collar criminals,French black-and-white films,Chinese criminal organizations,Pakistani white-collar criminals,French criminals,British white-collar criminals
Italian white-collar criminals,White-collar criminals,American white-collar criminals,White Collar episodes,White Collar characters,Fictional white-collar criminals,Italian black-and-white films,Pakistani white-collar criminals,Italian criminals,British white-collar criminals,Norwegian white-collar criminals
German white-collar criminals,White-collar criminals,American white-collar criminals,White Collar episodes,White Collar characters,Fictional white-collar criminals,German black-and-white films,Pakistani white-collar criminals,German criminals,British white-collar criminals,Norwegian white-collar criminals
17th-century Dutch criminals,17th-century Dutch women,Dutch criminals,17th-century paintings,17th-century Dutch painters,17th-century Dutch philosophers,17th-century Dutch people,17th-century criminals,17th-century philosophers,17th-century births,Dutch people
17th-century English criminals,English criminals,17th-century English women,English Roman Catholics,17th-century pirates,Executed English people,17th-century English nobility,17th-century births,17th-century English writers,17th-century English poets,17th-century English composers
Fictional white-collar criminals,White-collar criminals,White Collar characters,Fictional socialites,American white-collar criminals,Forbes Fictional 15,White Collar episodes,Fictional murdered people,Fictional businesspeople,Fictional business executives,Fictional criminals
"Criminals from Washington, D.C.","People from Washington, D.C.","Tallest buildings in Washington, D.C.","Mayors of Washington, D.C.","Tornadoes in Washington, D.C.","Museums in Washington, D.C.","Newspapers in Washington, D.C.","Hospitals in Washington, D.C.","Diplomatic missions in Washington, D.C.","Rivers of Washington, D.C.",Washington Metro stations
