,,,,,,,,,,,,,,,,,,
,,0,"209,95213",Aircraft (Br–Bz),2944,Q27664430,aircraft,37315,2259,"0,7626","0,7753",475,541,"0,47",2,0,FALSE,"474: concorde, brewsterf3acorsair, breguet1210jaguar, baemcdonnell-douglasharrier, baehawk, baect-155hawk, bsasc-47-67rtpturbodakota, bsasc-47-67ftpturbodakota, bsasc-47-65artpturbodakota, bae146"
,,1,"209,87234",University of Minnesota people,14033,Q6603156,human,30555,908,"0,9161","0,9303",2676,392,"0,87",99,"0,04",TRUE,"2237: bobdylan, brocklesnar, rondarousey, henryfonda, ronperlman, ricflair, jessicalange, johnastin, jameshong, miltonfriedman"
,,1,"209,6085",University of Virginia people,11344,Q6603241,human,224090,8812,"0,9151","0,9306",497,576,"0,46",73,"0,15",TRUE,"492: edgarallanpoe, georgewbush, richardnixon, jodiefoster, srinivasaramanujan, geraldford, thomasjefferson, simonbolivar, arthurmiller, robertfkennedy"
,,1,"209,57819",Toledo Mud Hens players,12901,Q15206019,human,12027,1233,"0,89","0,9311",1612,5,1,119,"0,07",FALSE,"1607: justinverlander, billybeane, maxscherzer, jimthorpe, gabekapler, traycethompson, nickcastellanos, kirbypuckett, philnevin, jdmartinez"
,,1,"209,3543",People from Indianapolis,9604,Q11796224,human,146798,4430,"0,9193","0,9307",456,127,"0,78",45,"0,1",TRUE,"428: brendanfraser, franklindroosevelt, stevemcqueen, adamlambert, johndillinger, mikepence, kurtvonnegut, ryanmurphy, jaredfogle, davidletterman"
,,1,"208,71413",Harvard College alumni,7586,Q55928064,human,55052,1899,"0,9196","0,9306",3427,24,"0,99",217,"0,06",FALSE,"3408: susanwojcicki, johnfkennedy, markzuckerberg, franklindroosevelt, billgates, jrobertoppenheimer, henrykissinger, theodoreroosevelt, tedkaczynski, robertfkennedy"
,,1,"208,60782",Philadelphia Phillies players,7974,Q8969749,human,15666,1332,"0,8978","0,9311",2081,5,1,177,"0,08",FALSE,"2071: bryceharper, peterose, kyleschwarber, noahsyndergaard, treaturner, pedromartínez, royhalladay, nickcastellanos, tugmcgraw, bobuecker"
,,,jeezy,,,,,,,,,,,,,,,
,,,score,name,rank,wikidata,type,members rank mean,members rank median,members system interesting score mean,members system interesting score median,valid members count,invalid members count,valid members ratio,nonavailable members count,nonavailable members ratio,is merged,names
,,0,"214,10405",Jeezy songs,495,Q7211334,song,2468,2465,"0,9339","0,9342",5,63,"0,07",6,1,FALSE,"5: rip, diamonds, actright, holdon, majordistribution"
,,5,"212,46494",Hip hop musicians,240292,Q1863553,human,267866,39948,"0,8978","0,9264",3407,48,"0,99",2112,"0,63",TRUE,"3366: xxxtentacion, rihanna, willsmith, jenniferlopez, kanyewest, eminem, tupacshakur, petedavidson, shaquilleo’neal, markwahlberg"
,,3,"212,41597",Stage names,185597,Q11811782,human,327392,69664,"0,9038","0,9313",4541,490,"0,9",1044,"0,23",FALSE,"4525: xxxtentacion, freddiemercury, shakira, winonaryder, ladygaga, nicolascage, oliviawilde, tupacshakur, brucelee, davidbowie"
,,2,"212,20082",Artists who reached number one in the United States,114354,Q1845766,human,1859354,662830,"0,9107","0,9315",508,550,"0,48",324,"0,64",FALSE,"506: elvispresley, michaeljackson, xxxtentacion, harrystyles, rihanna, shakira, willsmith, jenniferlopez, taylorswift, kanyewest"
,,1,"211,96458",Universal Music Group artists,45172,Q13644296,human,1010189,267133,"0,889","0,931",955,581,"0,62",556,"0,62",TRUE,"899: michaeljackson, rihanna, dwaynejohnson, jenniferlopez, taylorswift, kanyewest, olivianewton-john, jenniferconnelly, zendaya, eminem"
,,4,"211,92184",African-American male rappers,35698,Q15309182,human,314066,36341,"0,8984","0,9306",1156,24,"0,98",698,"0,61",FALSE,"1142: xxxtentacion, willsmith, kanyewest, muhammadali, tupacshakur, shaquilleo’neal, snoopdogg, coolio, takeoff, asaprocky"
,,3,"211,72797",Rappers from Atlanta,31152,Q8634751,human,334030,43988,"0,9083","0,9309",139,26,"0,85",96,"0,69",FALSE,"138: kanyewest, lilnasx, youngthug, future, akon, lilbaby, 21savage, lisalopes, ludacris, playboicarti"
,,3,"211,66583",Hip hop musicians from Atlanta,29849,Q16155103,human,470975,66320,"0,9022","0,9308",145,60,"0,71",105,"0,73",FALSE,"143: kanyewest, takeoff, janellemonáe, childishgambino, lilnasx, offset, quavo, youngthug, future, usher"
,,4,"211,4364",21st-century American rappers,20275,Q46111985,human,228699,19091,"0,9043","0,9307",2248,31,"0,99",1201,"0,54",FALSE,"2228: xxxtentacion, willsmith, kanyewest, eminem, aaroncarter, shaquilleo’neal, markwahlberg, snoopdogg, johncena, coolio"
,,4,"211,22081",Def Jam Recordings artists,4627,Q6568669,human,956893,142395,"0,9048","0,9311",232,248,"0,48",137,"0,73",TRUE,"187: rihanna, taylorswift, kanyewest, eminem, ladygaga, justinbieber, snoopdogg, paulmccartney, mariahcarey, theweeknd"
,,,vitalik,,,,,,,,,,,,,,,
,,,score,name,rank,wikidata,type,members rank mean,members rank median,members system interesting score mean,members system interesting score median,valid members count,invalid members count,valid members ratio,nonavailable members count,nonavailable members ratio,is merged,names
,,4,"213,39812",Philanthropists,193618,Q16149293,human,2247542,175084,"0,8939","0,9307",218,349,"0,39",98,"0,44",TRUE,"218: cristianoronaldo, lionelmessi, elonmusk, andrewtate, michaeljackson, shakira, angelinajolie, madonna, ladygaga, markzuckerberg"
,,1,"209,82088",People in blockchain technology,6651,Q30676587,human,268430,53864,"0,8824","0,9268",40,194,"0,17",36,"0,88",FALSE,"40: satoshinakamoto, changpengzhao, vitalikbuterin, rossulbricht, rujaignatova, cameronwinklevoss, tylerwinklevoss, halfinney, gavinwood, brianarmstrong"
,,1,"204,15181",Naturalized citizens of Canada,2173,Q7114169,human,115277,3316,"0,8813","0,9228",704,4,1,72,"0,1",FALSE,"704: keanureeves, brendanfraser, ahnhyo-seop, ninadobrev, brocklesnar, alphonsodavies, kimbalmusk, kimcattrall, lennoxlewis, kriswu"
,,3,"202,00603",People associated with cryptocurrency,1734,Q55939204,human,688575,60901,"0,8996","0,9308",71,4,"0,96",57,"0,79",FALSE,"71: mattdamon, reesewitherspoon, sambankman-fried, jackdorsey, loganpaul, johnmcafee, markcuban, satoshinakamoto, peterthiel, changpengzhao"
,,4,"187,62984",University of Waterloo alumni,661,Q9683277,human,15396,952,"0,9092","0,9303",346,5,"0,99",34,"0,1",FALSE,"346: vitalikbuterin, kevino’leary, chamathpalihapitiya, rupikaur, apoorvamehta, chriswilliams, disguisedtoast, rasmuslerdorf, stevesmith, erikdemaine"
,,3,"185,11475",Canadian computer programmers,577,Q7139499,human,2078662,3584,"0,927","0,9305",25,1,1,8,"0,28",FALSE,"25: elonmusk, vitalikbuterin, jamesgosling, briankernighan, dennisetaylor, piotrszulczewski, trevorblackwell, minhle, ryannorth, herbsutter"
,,4,"159,15282",People from Kolomna,193,Q7917069,human,59779,2474,"0,9206","0,9185",30,1,1,3,"0,07",FALSE,"30: vitalikbuterin, gennadygudkov, julian, eduardmalofeyev, edwardfrenkel, ivanlazhechnikov, mikhailmustygin, pavelkulizhnikov, yekaterinalobysheva, yuriymolchanov"
,,0,"149,32697",Canadian transhumanists,130,Q25031976,human,309058,15002,"0,9279","0,9307",4,1,1,2,"0,25",FALSE,"4: vitalikbuterin, stevemann, georgedvorsky, markalanwalker"
,,1,"132,3547",Canadian magazine writers,54,Q15311210,human,52206,963,"0,9102","0,931",24,2,"0,96",2,"0,04",FALSE,"24: vitalikbuterin, monaawad, richpriske, jbmackinnon, douglasgibson, scottsymons, shellysanders, lindsaynixon, jurgengothe, matthewhays"
,,,example registration,,,,,,,,,,,,,,,
,,,score,name,rank,wikidata,type,members rank mean,members rank median,members system interesting score mean,members system interesting score median,valid members count,invalid members count,valid members ratio,nonavailable members count,nonavailable members ratio,is merged,names
,,0,"237,29938",Examples of groups,8476,Q5419318,mathematical group,192576,174006,"0,8831","0,9318",22,48,"0,32",4,"0,14",FALSE,"22: euclideanspace, field, abeliangroup, finitefield, liegroup, symmetricgroup, dihedralgroup, normalsubgroup, listofthe230crystallographic3dspacegroups, specialorthogonalgroup"
,,0,"223,2879",Vehicle registration plates of Bulgaria,378178,Q584676,vehicle registration plate,193022,110310,"0,2713","0,2612",59,142,"0,29",2,"0,02",FALSE,"59: vehicleregistrationplatesofukraine, vehicleregistrationplatesofgermany, vehicleregistrationplatesofturkey, vehicleregistrationplatesoftheeuropeanunion, vehicleregistrationplatesofeurope, vehicleregistrationplatesofpoland, vehicleregistrationplatesofrussia, vehicleregistrationplatesoffrance, vehicleregistrationplatesoftheunitedkingdom, vehicleregistrationplatesofitaly"
,,0,"223,12395",Vehicle registration plates of Poland,518299,Q1503941,vehicle registration plate,198781,115580,"0,2823","0,2612",60,569,"0,1",2,"0,02",FALSE,"60: vehicleregistrationplatesofukraine, vehicleregistrationplatesofgermany, vehicleregistrationplatesofturkey, europeanlicenseplates, vehicleregistrationplatesoftheeuropeanunion, vehicleregistrationplatesofeurope, vehicleregistrationplatesofrussia, vehicleregistrationplatesofbulgaria, vehicleregistrationplatesoffrance, vehicleregistrationplatesoftheunitedkingdom"
,,0,"223,0895",Vehicle registration plates of Germany,877393,Q254262,vehicle registration plate,181928,108715,"0,2708","0,2612",60,1005,"0,06",2,"0,02",FALSE,"60: vehicleregistrationplatesofukraine, vehicleregistrationplatesofturkey, vehicleregistrationplatesoftheeuropeanunion, vehicleregistrationplatesofeurope, vehicleregistrationplatesofpoland, vehicleregistrationplatesofrussia, vehicleregistrationplatesofbulgaria, vehicleregistrationplatesoffrance, vehicleregistrationplatesoftheunitedkingdom, vehicleregistrationplatesofitaly"
,,0,"222,51523",Vehicle registration plates of California,98595,Q7918467,vehicle registration plate,51375,33564,"0,3217","0,2612",11,477,"0,02",2,"0,09",FALSE,"11: vehicleregistrationplatesoftheunitedstates, vehicleregistrationplatesofgreenland, vehicleregistrationplatesofcanada, vehicleregistrationplatesofmexico, vanityplate, vehicleregistrationplatesofohio, vehicleregistrationplatesofalabama, vehicleregistrationplatesofarizona, vehicleregistrationplatesofalaska, vehicleregistrationplatesofarkansas"
,,0,"222,30392",Vehicle registration plates of Massachusetts,46781,Q7918525,vehicle registration plate,55310,42134,"0,3165","0,2612",12,356,"0,03",2,"0,08",FALSE,"12: vehicleregistrationplatesoftheunitedstates, vehicleregistrationplatesofgreenland, vehicleregistrationplatesofcalifornia, vehicleregistrationplatesofcanada, vehicleregistrationplatesofmexico, vanityplate, vehicleregistrationplatesofohio, vehicleregistrationplatesofalabama, vehicleregistrationplatesofarizona, vehicleregistrationplatesofalaska"
,,0,"221,96765",Vehicle registration plates of Florida,28101,Q7918479,vehicle registration plate,55310,42134,"0,3165","0,2612",12,577,"0,02",2,"0,08",FALSE,"12: vehicleregistrationplatesoftheunitedstates, vehicleregistrationplatesofgreenland, vehicleregistrationplatesofcalifornia, vehicleregistrationplatesofcanada, vehicleregistrationplatesofmexico, vanityplate, vehicleregistrationplatesofohio, vehicleregistrationplatesofalabama, vehicleregistrationplatesofarizona, vehicleregistrationplatesofalaska"
,,0,"221,93875",Vehicle registration plates of Pennsylvania,27054,Q7918557,vehicle registration plate,55310,42134,"0,3165","0,2612",12,517,"0,02",2,"0,08",FALSE,"12: vehicleregistrationplatesoftheunitedstates, vehicleregistrationplatesofgreenland, vehicleregistrationplatesofcalifornia, vehicleregistrationplatesofcanada, vehicleregistrationplatesofmexico, vanityplate, vehicleregistrationplatesofohio, vehicleregistrationplatesofalabama, vehicleregistrationplatesofarizona, vehicleregistrationplatesofalaska"
,,0,"221,77078",Vehicle registration plates of Illinois,22498,Q7918497,vehicle registration plate,55310,42134,"0,3165","0,2612",12,523,"0,02",2,"0,08",FALSE,"12: vehicleregistrationplatesoftheunitedstates, vehicleregistrationplatesofgreenland, vehicleregistrationplatesofcalifornia, vehicleregistrationplatesofcanada, vehicleregistrationplatesofmexico, vanityplate, vehicleregistrationplatesofohio, vehicleregistrationplatesofalabama, vehicleregistrationplatesofarizona, vehicleregistrationplatesofalaska"
,,0,"221,71368",Vehicle registration plates of Michigan,23046,Q7918529,vehicle registration plate,55154,25384,"0,3443","0,2612",8,294,"0,03",2,"0,12",FALSE,"8: vehicleregistrationplatesoftheunitedstates, vehicleregistrationplatesofcalifornia, vanityplate, vehicleregistrationplatesofohio, vehicleregistrationplatesofalabama, vehicleregistrationplatesofarizona, vehicleregistrationplatesofalaska, vehicleregistrationplatesofarkansas"
,,,py me,,,,,,,,,,,,,,,
,,,score,name,rank,wikidata,type,members rank mean,members rank median,members system interesting score mean,members system interesting score median,valid members count,invalid members count,valid members ratio,nonavailable members count,nonavailable members ratio,is merged,names
,,1,"227,64297",Dead Like Me characters,14556,Q6568636,fictional character,12075629,12075629,"0,9359","0,9359",1,127,"0,01",2,1,FALSE,1: jesus
,,1,"220,80354",Accolades received by Call Me by Your Name,18736,Q45026688,award,181618,6354,"0,4602","0,2579",156,247,"0,39",4,"0,02",FALSE,"156: academyawards, academyawardforbestpicture, academyawardforbestactor, grammyaward, goldenglobeawards, goldenglobeaward, academyawardforbestoriginalsong, britishacademyfilmawards, britishacademyfilmaward, screenactorsguildawards"
,,1,"220,54846",1969 albums,9593,Q7166259,album,16536,2641,"0,8213","0,9311",719,16,"0,98",181,"0,25",FALSE,"713: abbeyroad, yellowsubmarine, ledzeppelinii, ummagumma, letitbleed, tommy, davidbowie, more, greenriver, willyandthepoorboys"
,,0,"219,16632",Mr. Pickles and Momma Named Me Sheriff characters,9838,Q48976713,fictional character,1513480,1513480,"0,9345","0,9345",2,39,"0,05",3,1,FALSE,"2: devil, protagonist"
,,1,"218,19096",I'm a Celebrity...Get Me Out of Here! (British TV series) contestants,177329,Q6573707,human,376084,162407,"0,9125","0,9312",259,54,"0,83",53,"0,2",FALSE,"259: margaretthatcher, caitlynjenner, boygeorge, jamievardy, johnlydon, alexbest, georgebest, jillscott, martinanavratilova, miketindall"
,,1,"215,06323",Sanat Mes Kerman F.C. players,1646,Q7747538,human,11368,3031,"0,8889","0,9199",127,1,1,4,"0,02",FALSE,"127: saeidsadeghi, shojaekhalilzadeh, mehdirahmati, mehrdadpooladi, rezaenayati, kamalkamyabinia, noorsabri, amirhosseinsadeghi, adelkolahkaj, edinho"
,,1,"214,98746",French film directors,63800,Q6571256,human,93469,11074,"0,7599","0,9192",1332,245,"0,85",37,"0,03",TRUE,"1094: romanpolanski, jean-lucgodard, sophiemarceau, lucbesson, sergegainsbourg, jean-louistrintignant, mélanielaurent, guillaumecanet, michelhouellebecq, louisgarrel"
,,1,"214,3553",Awards and nominations received by Just Shoot Me!,2779,Q6606702,award,291111,81824,"0,5296","0,2468",24,29,"0,46",4,"0,12",FALSE,"24: goldenglobeawards, goldenglobeaward, emmyawards, primetimeemmyaward, teenchoiceaward, teenchoiceawards, primetimeemmyawardforoutstandingsupportingactressinacomedyseries, satelliteawards, satelliteaward, primetimeemmyawardforoutstandingsupportingactorinacomedyseries"
,,1,"214,06848",Communes of the Marne department,27109,Q651572,commune of France,13499,1208,"0,7364","0,7056",620,175,"0,78",24,"0,04",FALSE,"620: strasbourg, metz, reims, colmar, nancyfrance, troyes, charleville-mézières, châlons-en-champagne, épinal, épernay"
,,1,"213,94034",V-me affiliates,963,Q17332326,television station,95047,6157,"0,8737","0,9257",53,171,"0,24",8,"0,13",FALSE,"53: foxbroadcastingcompany, americanbroadcastingcompany, cbs, newsmaxtv, kcet, wttw, kqet, kqeh, hopechannel, wipm-tv"
,,,avalanche,,,,,,,,,,,,,,,
,,,score,name,rank,wikidata,type,members rank mean,members rank median,members system interesting score mean,members system interesting score median,valid members count,invalid members count,valid members ratio,nonavailable members count,nonavailable members ratio,is merged,names
,,5,"236,63698",Colorado Avalanche players,22858,Q1111244,"human, ice hockey player",33708,9080,"0,8549","0,9307",372,520,"0,42",44,"0,12",TRUE,"372: calemakar, nazemkadri, nathanmackinnon, joesakic, patrickroy, peterforsberg, ryano’reilly, teemuselänne, gabriellandeskog, darcykuemper"
,,5,"232,84462",Colorado Avalanche head coaches,18534,Q6377980,human,150822,97880,"0,904","0,9312",46,121,"0,28",11,"0,22",FALSE,"46: stankroenke, joesakic, patrickroy, darrylsutter, annwaltonkroenke, johntortorella, martinstlouis, ricktocchet, joncooper, gabriellandeskog"
,,4,"231,50732",Colorado Avalanche draft picks,9072,Q6379578,"human, athlete",23832,4520,"0,8552","0,9304",143,284,"0,34",21,"0,14",TRUE,"143: calemakar, nathanmackinnon, ryano’reilly, gabriellandeskog, mikkorantanen, bradrichardson, goaltender, mattduchene, bowenbyram, paulstastny"
,,2,"212,72362",American disaster films,51364,Q8245039,film,338283,52413,"0,8905","0,9316",306,6,"0,98",127,"0,42",FALSE,"297: titanic, interstellar, jurassicworldfallenkingdom, moonfall, transformersthelastknight, armageddon, themist, independenceday, 2012, 10cloverfieldlane"
,,2,"212,70358",Roger Corman filmography,79314,Q7358023,film,100829,17046,"0,8872","0,9313",184,70,"0,73",50,"0,27",FALSE,"179: thesilenceofthelambs, thegodfatherpartii, philadelphia, apollo13, scream3, deathrace, looneytunesbackinaction, thelittleshopofhorrors, deathrace2000, thehowling"
,,1,"212,69019",Video game developers,207739,Q3253626,"human, video game developer",114541,36116,"0,9113","0,9314",711,2180,"0,25",276,"0,39",TRUE,"710: epicgames, fromsoftware, riotgames, valvecorporation, ubisoft, sega, squareenix, blizzardentertainment, avalanchesoftware, activision"
,,1,"212,60844",Video games developed in the United States,55766,Q6849913,video game,45178,5715,"0,8194","0,9305",8178,248,"0,97",1760,"0,22",FALSE,"8032: roblox, thelastofus, hogwartslegacy, godofwarragnarök, wordle, thelastofuspartii, leagueoflegends, godofwar, fortnite, reddeadredemption2"
,,2,"211,87022",Disasters in Canada,26414,Q6616809,disaster,341864,12338,"0,8145","0,921",111,453,"0,2",23,"0,2",FALSE,"110: earthquake, tsunami, sinkingofthermstitanic, naturaldisaster, tornado, flood, tropicalcyclone, pandemic, drought, typesofvolcaniceruptions"
,,1,"211,83809",Multiplayer and single-player video games,18706,Q18218452,video game,53621,11449,"0,8222","0,9303",7243,103,"0,99",1251,"0,18",FALSE,"7130: thelastofus, minecraft, eldenring, grandtheftautov, grandtheftautosanandreas, reddeadredemption2, callofdutymodernwarfare2, callofdutymodernwarfare, ghostoftsushima, gothamknights"
,,2,"211,0272",Snowboarding video games,14218,Q85780815,video game,50706,7078,"0,7995","0,9228",60,119,"0,34",11,"0,17",FALSE,"60: finalfantasyviisnowboarding, actiongame, strategyvideogame, sportsgame, snowboardingvideogames, snowboardingvideogame, ridersrepublic, ssxtricky, 1080°snowboarding, ssx3"
,,,messy,,,,,,,,,,,,,,,
,,,score,name,rank,wikidata,type,members rank mean,members rank median,members system interesting score mean,members system interesting score median,valid members count,invalid members count,valid members ratio,nonavailable members count,nonavailable members ratio,is merged,names
,,1,"214,4916",21st-century American rappers,20275,Q46111985,human,228699,19091,"0,9043","0,9307",2248,31,"0,99",1201,"0,54",FALSE,"2228: xxxtentacion, willsmith, kanyewest, eminem, aaroncarter, shaquilleo’neal, markwahlberg, snoopdogg, johncena, coolio"
,,1,"212,0972",Hip hop musicians,240292,Q1863553,human,267866,39948,"0,8978","0,9264",3407,48,"0,99",2112,"0,63",TRUE,"3366: xxxtentacion, rihanna, willsmith, jenniferlopez, kanyewest, eminem, tupacshakur, petedavidson, shaquilleo’neal, markwahlberg"
,,1,"211,85901",Stanley Cup champions,2031912,Q1783598,human,35955,6439,"0,8907","0,9311",1832,737,"0,71",147,"0,09",TRUE,"1622: waynegretzky, alexanderovechkin, sidneycrosby, stankroenke, jaromírjágr, guylafleur, calemakar, gordiehowe, bobbyhull, mikebossy"
,,1,"211,79846",Paraphilias,1116508,Q2654782,paraphilia,482543,150449,"0,9184","0,9306",75,119,"0,39",8,"0,09",FALSE,"75: necrophilia, pedophilia, infantophilia, zoophilia, coprophilia, sexualfetishism, voyeurism, footfetishism, podophilia, exhibitionism"
,,1,"211,62195",2007 films,52130,Q7141686,film,59195,7272,"0,8649","0,9311",2743,64,"0,98",779,"0,29",FALSE,"2722: 2girls1cup, nocountryforoldmen, ratatouille, transformers, piratesofthecaribbeanatworld’send, spider-man3, therewillbeblood, iamlegend, themist, zodiac"
,,1,"211,59375",Programmes broadcast by CBeebies,191014,Q6565364,television program,88725,20236,"0,8586","0,9309",178,581,"0,23",47,"0,26",FALSE,"178: teletubbies, bluey, lazytown, thepingushow, pingu, blippi, spideyandhisamazingfriends, bobthebuilder, arthur, firemansam"
,,1,"211,31436",Deaths in 2010,58764,Q1558647,human,15397,1074,"0,8635","0,9299",8943,562,"0,94",315,"0,04",TRUE,"8927: tonycurtis, leslienielsen, coreyhaim, dennishopper, ronniejamesdio, alexandermcqueen, garycoleman, manutebol, jdsalinger, malcolmmclaren"
,,1,"211,22873",Programs broadcast by Qubo,65896,Q6635307,television program,65745,33179,"0,826","0,9308",105,537,"0,16",28,"0,26",FALSE,"104: bobthebuilder, firemansam, inspectorgadget, themagicschoolbus, he-manandthemastersoftheuniverse, veggietales, postmanpat, franklin, she-raprincessofpower, babar"
,,1,"211,15732",1945 deaths,36734,Q7020602,human,26011,977,"0,8463","0,9228",4870,37,"0,99",107,"0,02",FALSE,"4867: adolfhitler, benitomussolini, franklindroosevelt, annefrank, heinrichhimmler, subhaschandrabose, simongascoigneeden, georgespatton, martinbormann, irmagrese"
,,1,"211,14227",West Coast hip hop artists,23841,Q6603958,human,490858,44416,"0,8939","0,9305",287,124,"0,7",187,"0,65",FALSE,"285: kanyewest, 2pac, snoopdogg, coolio, katyperry, kendricklamar, dojacat, nickcannon, jadensmith, drdre"
,,,messi,,,,,,,,,,,,,,,
,,,score,name,rank,wikidata,type,members rank mean,members rank median,members system interesting score mean,members system interesting score median,valid members count,invalid members count,valid members ratio,nonavailable members count,nonavailable members ratio,is merged,names
,,,"213,4374",2017 films,52760,Q9756138,film,94905,13434,"0,8755","0,9311",3048,41,"0,99",868,"0,29",FALSE,"3026: xxxreturnofxandercage, bladerunner2049, getout, spider-manhomecoming, piratesofthecaribbeandeadmentellnotales, callmebyyourname, thorragnarok, murderontheorientexpress, coco, justiceleague"
,,,"213,35925",Argentine footballers,96980,Q6998155,human,49922,2471,"0,6849","0,9177",5858,18,1,92,"0,02",FALSE,"5719: lionelmessi, diegomaradona, ángeldimaría, paulodybala, alexismacallister, emilianomartínez, lionelscaloni, sergioagüero, juliánálvarez, enzofernández"
,,,"212,72333",Kerala Blasters FC players,24579,Q19881259,human,49813,7873,"0,8557","0,9199",327,71,"0,82",13,"0,07",TRUE,"180: midfielder, dimitarberbatov, goalkeeper, davidjames, wesbrown, carlosmarchena, garyhooper, bartholomewogbeche, adriánluna, álvarovázquez"
,,,"211,01689",Cameroonian footballers,13285,Q7078735,human,24979,1150,"0,7936","0,9192",886,8,"0,99",4,0,FALSE,"886: samueleto’o, vincentaboubakar, ericmaximchoupo-moting, andréonana, rigobertsong, joëlmatip, rogermilla, andré-frankzamboanguissa, alexsong, marc-vivienfoé"
,,,"210,90878",Men's footballers with 100 or more international caps,746061,Q945035,"human, association football player",551657,34658,"0,8037","0,9206",1659,256,"0,87",154,"0,14",TRUE,"1060: cristianoronaldo, lionelmessi, neymar, zlatanibrahimović, robertlewandowski, gerardpiqué, zinedinezidane, lukamodrić, davidbeckham, luissuárez"
,,,"210,90402",FIFA World Cup winning players,2186412,Q19820229,human,991072,156906,"0,7704","0,9221",492,159,"0,76",144,"0,29",FALSE,"491: lionelmessi, kylianmbappé, pelé, diegomaradona, ronaldo, ronaldinho, gerardpiqué, zinedinezidane, oliviergiroud, ángeldimaría"
,,,"210,88681",FC Barcelona players,579239,Q132309,human,561544,19786,"0,7063","0,9192",834,171,"0,83",117,"0,17",TRUE,"694: lionelmessi, neymar, diegomaradona, zlatanibrahimović, robertlewandowski, ronaldo, ronaldinho, gerardpiqué, luissuárez, pepguardiola"
,,,"210,7309",People named in the Panama Papers,190947,Q23705689,human,994369,80749,"0,8323","0,9228",648,438,"0,6",116,"0,27",TRUE,"421: lionelmessi, vladimirputin, princessdiana, xijinping, princeandrewdukeofyork, margaretthatcher, emmawatson, ronaldreagan, pablopicasso, maozedong"
,,,"210,72925",UNICEF Goodwill Ambassadors,135776,Q969375,"human, officer",1010691,105928,"0,8188","0,9228",494,197,"0,72",125,"0,3",TRUE,"419: lionelmessi, milliebobbybrown, shakira, robertlewandowski, serenawilliams, novakdjokovic, selenagomez, rogerfederer, davidbeckham, nicolekidman"
,,,"210,71173",Forbes Celebrity 100,437924,Q5467229,human,8667351,6813283,"0,91","0,9315",85,64,"0,57",79,"0,94",FALSE,"83: cristianoronaldo, lionelmessi, johnnydepp, tomcruise, neymar, brucewillis, rihanna, leonardodicaprio, dwaynejohnson, bradpitt"
,,,king messi,,,,,,,,,,,,,,,
,,,score,name,rank,wikidata,type,members rank mean,members rank median,members system interesting score mean,members system interesting score median,valid members count,invalid members count,valid members ratio,nonavailable members count,nonavailable members ratio,is merged,names
,,,"228,85466",Kings,21129,Q54059,human,6591845,885595,"0,858","0,9317",3,4,"0,5",3,"0,67",FALSE,"3: kingofclay, king, king-emperor"
,,,"227,33337",King of Nepal,136374,Q60107,human,110792,2477,"0,9254","0,9301",96,223,"0,3",3,"0,02",TRUE,"81: gautamabuddha, gyanendraofnepal, dipendraofnepal, kingbirendra, birendraofnepal, bidyadevibhandari, pushpakamaldahal, maya, prithvinarayanshah, mahendraofnepal"
,,,"227,19553",Shaman King characters,348545,Q2334111,fictional character,1333061,1006569,"0,9313","0,9332",23,329,"0,07",20,"0,9",TRUE,"21: lucifer, michael, archangel, gabriel, azazel, santamuerte, faust, metatron, raphael, uriel"
