,,,,,,,,,,,,,,,,,,
,,0,"227,49",Dreamcast light guns,12675,Q5306540,light gun,28644,28644,"0,932","0,932",2,81,"0,02",2,"0,5",FALSE,"2: guncon, menacer"
,,0,"226,39",Haruhi Suzumiya light novels,57031,Q4434309,novel,796249,796249,"0,9253","0,9253",2,42,"0,05",3,1,FALSE,"2: lightnovel, haruhisuzumiya"
,,1,"226,14",Friday Night Lights characters,165394,Q6571450,fictional character,65317,59214,"0,9304","0,9315",9,125,"0,07",2,"0,11",FALSE,"9: recurringcharacter, timriggins, jasonstreet, mattsaracen, erictaylor, tyracollette, lylagarrity, smashwilliams, tamitaylor"
,,1,"225,41",Oreimo light novels,4773,Q107128548,novel,568116,487869,"0,928","0,9308",4,7,"0,4",2,"0,25",FALSE,"4: lightnovels, listoforeimocharacters, oreimo, eromangasensei"
,,,josiah adams,,,,,,,,,,,,,,,
,,,score,name,rank,wikidata,type,members rank mean,members rank median,members system interesting score mean,members system interesting score median,valid members count,invalid members count,valid members ratio,nonavailable members count,nonavailable members ratio,is merged,names
,,1,"232,47",Amy Adams performances,393948,Q16246470,"film, television series, musical, video clip, discography",955243,477440,"0,8659","0,9319",64,86,"0,43",35,"0,55",FALSE,"62: theoffice, zacksnyder’sjusticeleague, catchmeifyoucan, justiceleague, that’70sshow, batmanvsupermandawnofjustice, arrival, saturdaynightlive, disenchanted, manofsteel"
,,1,"229,56",Bryan Adams songs,9932,Q8317026,song,39790,15298,"0,8842","0,9322",12,49,"0,2",6,"0,42",FALSE,"12: summerof’69, allforlove, pleaseforgiveme, runtoyou, tearsarenotenough, straightfromtheheart, sohappyithurts, kickass, star, insideout"
,,1,"229,39",Adam Sandler filmography,750986,Q4679724,film,429555,298937,"0,8719","0,9315",77,41,"0,66",39,"0,49",FALSE,"77: hustle, uncutgems, hoteltransylvania, grownups, murdermystery, justgowithit, thelongestyard, 50firstdates, grownups2, that’smyboy"
,,1,"228,80",Generations of Adam,65184,Q5532615,human,617978,185690,"0,9018","0,9326",61,204,"0,23",41,"0,73",FALSE,"55: abraham, adam, noah, jacob, david, cain, isaac, ishmael, enoch, methuselah"
,,1,"225,56",Bryan Adams backing band members,26507,Q6565110,human,221550,10570,"0,9297","0,9315",10,105,"0,09",4,"0,3",FALSE,"10: bryanadams, keithscott, philthornalley, mickeycurry, tommymandel, patsteward, davetaylor, solomonwalker, garybreit, normfisher"
,,1,"223,34",Coleco Adam games,4049,Q17042460,video game,60499,16516,"0,9036","0,9312",22,271,"0,08",12,"0,5",FALSE,"22: donkeykong, qbert, dragon’slair, donkeykongjr, burgertime, riverraid, zaxxon, superzaxxon, tapper, choplifter"
,,1,"222,82",Awards and nominations received by Amy Adams,116139,Q16155336,award,337241,28290,"0,4987","0,2583",95,180,"0,35",7,"0,06",FALSE,"95: academyaward, academyawards, academyawardforbestactress, goldenglobeawards, goldenglobeaward, goldenraspberryawards, hollywoodwalkoffame, academyawardforbestsupportingactress, primetimeemmyaward, primetimeemmyawards"
,,1,"220,06",Harvard University alumni,45944,Q7234382,human,19443,1437,"0,9083","0,9304",8520,34,1,304,"0,04",FALSE,"8502: natalieportman, mattdamon, mehmetoz, elisabethshue, eduardosaverin, kwasikwarteng, mirasorvino, damienchazelle, michaelrockefeller, rahulgandhi"
,,1,"219,96",Scott Adams Adventure video games,3205,Q60519230,video game,70870,2674,"0,9321","0,9317",10,13,"0,45",5,"0,4",FALSE,"10: graphicadventuregames, textadventure, adventureland, pirateadventure, thecount, pyramidofdoom, voodoocastle, ghosttown, mysteryfunhouse, strangeodyssey"
,,1,"219,70",Films produced by Adam Sandler,4455,Q20704581,film,550625,306470,"0,8455","0,931",33,1,1,14,"0,39",FALSE,"33: hustle, grownups, murdermystery, justgowithit, grownups2, that’smyboy, pixels, click, blended, hubiehalloween"
,,,k wrobel,,,,,,,,,,,,,,,
,,,score,name,rank,wikidata,type,members rank mean,members rank median,members system interesting score mean,members system interesting score median,valid members count,invalid members count,valid members ratio,nonavailable members count,nonavailable members ratio,is merged,names
,,1,"228,34",K-pop artists,521443,Q372283,human,269257,89346,"0,8153","0,71",810,177,"0,82",284,"0,36",FALSE,"791: jungkook, lisa, chaeun-woo, jennie, kimse-jeong, kimseok-jin, jisoo, jacksonwang, suga, rosé"
,,1,"227,93",K-1 champions,139239,Q6575554,human,82493,15482,"0,8815","0,9221",246,475,"0,34",25,"0,1",FALSE,"246: alistairovereem, mirkocrocop, mirkofilipović, badrhari, takerusegawa, bobsapp, buakawbanchamek, buakawporpramuk, renhiramoto, rukiyaanpo"
,,1,"227,81",K. Balachander filmography,123794,Q6323160,film,24907,15117,"0,9188","0,9199",99,26,"0,8",5,"0,04",FALSE,"95: uthamavillain, ekduujekeliye, apoorvaraagangal, kuselan, kadhalvirus, duet, marocharitra, paarthaleparavasam, azhagan, rudraveena"
,,1,"227,42",K-pop singers,22886,Q7042724,human,255094,84287,"0,8046","0,7078",382,10,"0,98",122,"0,33",FALSE,"372: lisa, chaeun-woo, jennie, kimseok-jin, jisoo, jacksonwang, rosé, kimjong-hyun, baesuzy, parkhyung-sik"
,,1,"226,73",K-On! characters,80599,Q1046150,fictional character,355543,355543,"0,9313","0,9313",1,355,0,2,1,FALSE,1: romeomontague
,,0,"226,35",Aircraft (K),4744,Q6605092,aircraft,51957,3325,"0,7236","0,7071",447,679,"0,4",6,"0,01",FALSE,"445: kamovka-50, kamovka-52, kamovka-136, kait-50goldeneagle, kamovka-28, kamovka-27, kamovka-29, kamovka-32, kawasakic-2, wide-bodyaircraft"
,,1,"225,98",K-1 events,34960,Q5110843,sporting event,3876,4318,"0,5987","0,6955",11,296,"0,04",2,"0,09",FALSE,"11: k-1premium2003dynamite, k-1worldgrandprix2010final, k-1worldgrandprix2012final, oktagon, k-1worldgrandprix2008final, k-1worldgrandprix2001final, k-1worldgrandprix2002final, k-1worldgrandprix2006intokyofinal, k-1worldgrandprix2005intokyofinal, k-1worldgrandprix2003final"
,,1,"225,83",Diseases (K),4031,Q6616874,disease,211567,61458,"0,7607","0,917",59,90,"0,4",3,"0,03",FALSE,"59: klinefelter’ssyndrome, kuru, kawasakisyndrome, kaposisarcoma, korsakoff’ssyndrome, kwashiorkor, keloids, keratoconusposticuscircumscriptus, keratoconus, kyphosis"
,,1,"225,59",J. K. Simmons performances,362394,Q20684223,film,663152,193157,"0,8785","0,9318",110,192,"0,37",53,"0,48",FALSE,"108: spider-mannowayhome, spider-manfarfromhome, spider-man, ghostbustersafterlife, whiplash, justiceleague, venomlettherebecarnage, lalaland, zootopia, chip’ndalerescuerangers"
,,0,"225,34","Death metal bands, !–K",53033,Q16154691,musical group,53048,7424,"0,9247","0,9316",328,36,"0,9",155,"0,47",FALSE,"328: archenemy, inflames, cannibalcorpse, death, gojira, behemoth, amonamarth, cradleoffilth, theblackdahliamurder, childrenofbodom"
,,,krzysztof wrobel,,,,,,,,,,,,,,,
,,,score,name,rank,wikidata,type,members rank mean,members rank median,members system interesting score mean,members system interesting score median,valid members count,invalid members count,valid members ratio,nonavailable members count,nonavailable members ratio,is merged,names
,1,1,"233,19",Compositions by Krzysztof Penderecki,12609,Q2743899,musical work/composition,4434,1351,"0,8563","0,9295",57,26,"0,7",6,"0,15",TRUE,"33: threnodytothevictimsofhiroshima, thedevilsofloudun, stlukepassion, polishrequiem, polymorphia, symphonyno7, symphonyno3, utrenja, thedreamofjacob, anaklasis"
,1,1,"229,32",Films directed by Krzysztof Zanussi,8192,Q8455267,film,7841,6360,"0,8488","0,9327",15,1,1,8,"0,47",FALSE,"15: lifeasafatalsexuallytransmitteddisease, camouflage, ayearofthequietsun, theillumination, atfullgallop, theconstantfactor, thestructureofcrystals, blacksun, spiral, familylife"
,1,1,"228,15",Films directed by Krzysztof Kieślowski,4946,Q7237123,film,49536,13159,"0,9069","0,931",28,3,"0,93",7,"0,21",FALSE,"28: threecoloursblue, threecoloursred, thedoublelifeofveronique, threecolourswhite, ashortfilmaboutkilling, ashortfilmaboutlove, blindchance, dekalogone, camerabuff, dekalogtwo"
,,1,"221,60",Polish Americans,42134,Q6594359,human,313590,12349,"0,9036","0,9214",2211,623,"0,78",238,"0,13",TRUE,"1791: johnwaynegacy, angelinajolie, jenniferconnelly, susanwojcicki, eminem, scarlettjohansson, williamshakespeare, nicolascage, tombrady, natalieportman"
,,0,"214,26",Polish people,43880,Q3279368,human,161187,14292,"0,7131","0,917",2321,573,"0,8",71,"0,03",TRUE,"2316: marilynmonroe, napoleon, robertlewandowski, clinteastwood, jimmycarter, mariaskłodowskacurie, mariecurie, mariaskłodowska-curie, robertpattinson, suleimanthemagnificent"
,,3,"213,67",Poland international footballers,58352,Q727152,human,43355,2726,"0,6714","0,9163",1919,237,"0,89",7,"0,01",TRUE,"975: robertlewandowski, wojciechszczęsny, mattycash, arkadiuszmilik, nicolazalewski, grzegorzkrychowiak, krzysztofpiątek, piotrzieliński, jakubkiwior, kamilglik"
,,5,"213,17",Polish footballers,40715,Q6549716,human,19204,1202,"0,674","0,9163",2681,5,1,8,0,FALSE,"2665: robertlewandowski, miroslavklose, wojciechszczęsny, mattycash, arkadiuszmilik, nicolazalewski, grzegorzkrychowiak, krzysztofpiątek, piotrzieliński, jakubkiwior"
,,4,"212,33",Ambassadors of Poland,42703,Q6615201,human,35826,1999,"0,6432","0,9141",99,433,"0,19",2,"0,01",TRUE,"99: andrzejduda, mateuszmorawiecki, zbigniewrau, elżbietawitek, marekmagierowski, tomaszgrodzki, konstantyradziwiłł, juliaprzyłębska, leszekwłodzimierzbiały, annamariaanders"
,,4,"212,28",Polish painters,52613,Q839198,human,19217,2138,"0,7209","0,9163",332,131,"0,72",5,"0,01",TRUE,"320: zdzisławbeksiński, kazimirmalevich, tamaradelempicka, magdalenagessler, stanisławignacywitkiewicz, janmatejko, stanisławwyspiański, brunoschulz, stanislavszukalski, janzamoyski"
,,0,"211,72","Gay, lesbian or bisexual people",230269,Q1269105,human,226590,18668,"0,8774","0,9306",4624,2131,"0,68",583,"0,13",TRUE,"4576: jeffreydahmer, amberheard, anneheche, donaldtrump, freddiemercury, leonardodavinci, aaroncarter, ezramiller, mileycyrus, juliuscaesar"
,,,pikachu,,,,,,,,,,,,,,,
,,,score,name,rank,wikidata,type,members rank mean,members rank median,members system interesting score mean,members system interesting score median,valid members count,invalid members count,valid members ratio,nonavailable members count,nonavailable members ratio,is merged,names
,,3,"213,12",Video games developed in Japan,56750,Q6849936,video game,46601,13111,"0,8088","0,9301",7258,460,"0,94",962,"0,13",FALSE,"7143: eldenring, deathstranding, thelegendofzeldabreathofthewild, nierautomata, residentevilvillage, persona5, supermariobros, fatestaynight, bloodborne, residentevil4"
,,4,"212,89",Pokémon video games,631107,Q99485876,video game,124059,53234,"0,433","0,347",84,343,"0,2",22,"0,29",TRUE,"73: role-playingvideogame, pokémonlegendsarceus, actionrole-playinggame, pokémongo, wolfenstein3d, fightinggame, puzzlevideogame, downloadablecontent, pokémonemerald, pokémonplatinum"
,,5,"212,73",Pokémon films,1148234,Q5352741,film,146384,78121,"0,3425","0,3391",64,296,"0,18",3,"0,06",TRUE,"35: detectivepikachu, pokémondetectivepikachu, pokémonthefirstmovie, pokémonthemoviesecretsofthejungle, pokémonheroes, pokémonthemovieichooseyou, pokémon3themovie, pokémonlucarioandthemysteryofmew, pokémonthemoviethepowerofus, pokémontheriseofdarkrai"
,,1,"211,56",Detective video games,11338,Q7715000,video game,62456,9412,"0,7471","0,9301",323,27,"0,93",63,"0,2",FALSE,"316: detroitbecomehuman, discoelysium, batmanarkhamknight, heavyrain, persona4, batmanarkhamcity, theevilwithin, batmanarkhamasylum, judgment, batmanarkhamorigins"
,,1,"210,70",Films released in IMAX,211515,Q10859479,film,1949673,1031092,"0,8454","0,931",691,86,"0,89",365,"0,53",FALSE,"684: avatarthewayofwater, topgunmaverick, xxxreturnofxandercage, doctorstrangeinthemultiverseofmadness, thebatman, avatar, avatarspecialedition, thorloveandthunder, topgun, blackpantherwakandaforever"
,,4,"210,66",Pokémon manga,30631,Q25384724,manga,75124,26870,"0,3664","0,342",11,298,"0,04",2,"0,09",FALSE,"11: weeklyshōnensunday, pokémonadventures, pokémonevolutions, pocketmonsters, pokémonpocketmonsters, pokémontheelectrictaleofpikachu, magicalpokémonjourney, pocketmonstersréburst, pokémondiamondandpearladventure, pokémonmysterydungeonginji’srescueteam"
,,3,"210,66",Nintendo Switch games,441330,Q27486373,video game,112689,29550,"0,8338","0,9305",2213,396,"0,85",513,"0,23",TRUE,"2204: minecraft, hogwartslegacy, genshinimpact, fortnite, amongus, thelegendofzeldabreathofthewild, nierautomata, residentevilvillage, grandtheftautovicecity, theelderscrollsvskyrim"
,,3,"210,61",3D films (2005–present),119687,Q1040119,film,982234,238944,"0,8381","0,9307",820,108,"0,88",310,"0,38",TRUE,"809: avatarthewayofwater, xxxreturnofxandercage, doctorstrangeinthemultiverseofmadness, avatar, thorloveandthunder, topgun, blackpantherwakandaforever, rrr, spider-mannowayhome, jurassicworlddominion"
,,2,"210,58",IMAX films,99375,Q4437584,film,1869498,919841,"0,855","0,931",639,53,"0,92",303,"0,51",TRUE,"589: avatarthewayofwater, topgunmaverick, xxxreturnofxandercage, doctorstrangeinthemultiverseofmadness, thebatman, avatar, thorloveandthunder, topgun, blackpantherwakandaforever, rrr"
,,3,"210,54",Highest-grossing films in Japan,871372,Q11267773,film,1653555,975850,"0,7533","0,9301",218,324,"0,4",74,"0,34",FALSE,"212: topgunmaverick, avatar, spider-mannowayhome, morbius, titanic, fantasticbeastsandwheretofindthem, blackpanther, eternals, jurassicpark, fantasticbeaststhecrimesofgrindelwald"
,,,mickey,,,,,,,,,,,,,,,
,,,score,name,rank,wikidata,type,members rank mean,members rank median,members system interesting score mean,members system interesting score median,valid members count,invalid members count,valid members ratio,nonavailable members count,nonavailable members ratio,is merged,names
,,2,"235,11",Mickey Rourke filmography,235521,Q6838777,film,256353,95241,"0,8991","0,9321",88,157,"0,36",51,"0,57",FALSE,"87: therewillbeblood, ironman2, manonfire, theexpendables, sincity, killbillvolume2, immortals, thewrestler, therainmaker, 91⁄2weeks"
,,1,"235,07",Mickey Rooney filmography,94428,Q18924378,film,72159,5486,"0,7936","0,931",187,95,"0,67",40,"0,21",FALSE,"187: callmebyyourname, breakfastattiffany’s, nightatthemuseum, thefoxandthehound, nightatthemuseumsecretofthetomb, nightatthemuseumbattleofthesmithsonian, it’samadmadmadmadworld, timebandits, themuppets, babepiginthecity"
,,1,"229,21",Mickey Mouse films and appearances,98003,Q2261846,film,147313,16537,"0,7847","0,9311",230,170,"0,58",34,"0,15",FALSE,"227: frozen, toystory, zootopia, thelittlemermaid, whoframedrogerrabbit, thetreasureplanet, toystory2, fantasia, ralphbreakstheinternet, agoofymovie"
,,2,"227,91",Mickey Mouse video games,5460,Q8625071,video game,43670,9309,"0,709","0,9302",54,6,"0,92",5,"0,08",FALSE,"53: kingdomheartsiii, kingdomheartsii, kingdomheartschainofmemories, kingdomheartsbirthbysleep, epicmickey, kingdomhearts3582days, kingdomhearts3ddreamdropdistance, disneyinfinity, disneyinfinity30, kingdomheartscoded"
,,2,"227,29",Mickey Mouse short films,4541,Q6426282,film,60024,9313,"0,7455","0,9311",118,4,"0,98",11,"0,08",FALSE,"118: steamboatwillie, thebarnyardolympics, mickeystepsout, themaddog, mickey’spalpluto, thesteeplechase, two-gunmickey, mickeyplayspapa, themailpilot, puppylove"
,,5,"226,09",Mickey Mouse films,2314,Q7455579,film,224568,80924,"0,6526","0,8538",16,4,"0,84",4,"0,19",FALSE,"16: whoframedrogerrabbit, fantasia, fantasia2000, funandfancyfree, mickey’sonceuponachristmas, mickeydonaldgoofythethreemusketeers, mickey’shouseofvillains, mickey’stwiceuponachristmas, mickey’smagicalchristmassnowedinatthehouseofmouse, mickey’sphilharmagic"
,,2,"212,98",20th-century American male actors,120873,Q14914736,human,323590,28793,"0,9189","0,9313",9069,28,1,1176,"0,13",FALSE,"9041: elvispresley, johnnydepp, tomcruise, valkilmer, brucewillis, leonardodicaprio, dwaynejohnson, willsmith, bradpitt, ryanreynolds"
,,3,"212,57",Walt Disney Animation Studios short films,205129,Q3650416,film,252337,14278,"0,8165","0,9312",686,297,"0,7",155,"0,23",TRUE,"678: turningred, lightyear, encanto, thelionking, frozen, coco, cars, toystory, moana, ratatouille"
,,1,"212,24",21st-century American Jews,47282,Q108731569,human,121289,8291,"0,9224","0,9308",7639,25,1,774,"0,1",FALSE,"7613: jenniferconnelly, susanwojcicki, winonaryder, ezramiller, stevenspielberg, milakunis, timothéechalamet, robertdowneyjr, adamsandler, jakegyllenhaal"
,,1,"212,20",American male television actors,38137,Q8246554,human,350835,59899,"0,9163","0,9312",9785,39,1,1527,"0,16",FALSE,"9765: johnnydepp, valkilmer, brucewillis, leonardodicaprio, dwaynejohnson, willsmith, bradpitt, lebronjames, ryanreynolds, rayliotta"
,,,adore your eyes,,,,,,,,,,,,,,,
,,,score,name,rank,wikidata,type,members rank mean,members rank median,members system interesting score mean,members system interesting score median,valid members count,invalid members count,valid members ratio,nonavailable members count,nonavailable members ratio,is merged,names
,,1,"236,77",Eye diseases,64531,Q7215443,disease,55065,9520,"0,7873","0,9199",180,16,"0,92",4,"0,02",FALSE,"180: heterochromiairidum, cataract, nystagmus, horner’ssyndrome, keratoconus, visualimpairment, trachoma, anisocoria, giantcellarteritis, dermoidcyst"
,,1,"230,11",Curb Your Enthusiasm episodes,503092,Q6568190,television series episode,30691,30691,"0,9328","0,9328",2,541,0,2,"0,5",FALSE,"2: seinfeld, seinfeldvision"
,,1,"229,75",Mind Your Language episodes,55671,Q4437832,television series episode,27728,27728,"0,9326","0,9326",2,92,"0,02",3,1,FALSE,"2: seasonfinale, seasonpremiere"
,,1,"227,85",1998 singles,11369,Q7233259,single,17243,4230,"0,8389","0,9316",873,325,"0,73",351,"0,41",FALSE,"862: ladymarmalade, anotheronebitesthedust, idon’twanttomissathing, it’srainingmen, bakerstreet, iris, underthebridge, pumpupthejam, hijodelaluna, ithinkwe’realonenow"
,,1,"227,71",2016 albums,30848,Q20735643,album,10862,2594,"0,8744","0,9316",2441,1526,"0,62",681,"0,37",TRUE,"1832: lemonade, thelifeofpablo, cultfollowing, anti, blackstar, hardwiredtoself-destruct, blonde, starboy, views, compilationalbum"
,,1,"227,46",British black-and-white films,9306,Q22029192,film,7119,750,"0,8768","0,9313",4156,11,1,742,"0,19",FALSE,"3939: belfast, drstrangelove, lolita, theelephantman, thethirdman, zorbathegreek, following, passing, goodnightandgoodluck, the39steps"
,,1,"227,43",Curb Your Enthusiasm recurring roles,57145,Q6568192,fictional character,465972,465972,"0,9313","0,9313",2,96,"0,02",3,1,FALSE,"2: cosmokramer, georgecostanza"
,,1,"227,34",2013 singles,11589,Q7470652,single,11078,2519,"0,8712","0,9318",1529,262,"0,85",698,"0,47",FALSE,"1483: happy, blurredlines, wakemeup, getlucky, thefox, wagonwheel, anotherlove, wreckingball, rapgod, papaoutai"
,,1,"227,17",Choose Your Own Adventure books,36755,Q6567146,book,90516,90516,"0,9324","0,9324",2,31,"0,06",2,"0,5",FALSE,"2: gamebook, gradedreader"
,,1,"227,04",2000 singles,13441,Q7217096,single,16692,4647,"0,8345","0,9316",873,271,"0,76",332,"0,39",FALSE,"858: stan, lovedon’tcostathing, dancinginthemoonlight, therealslimshady, yellow, thankyou, smooth, biginjapan, wholetthedogsout, adam’ssong"
,,,face,,,,,,,,,,,,,,,
,,,score,name,rank,wikidata,type,members rank mean,members rank median,members system interesting score mean,members system interesting score median,valid members count,invalid members count,valid members ratio,nonavailable members count,nonavailable members ratio,is merged,names
,,1,"231,44",Squid-faced humanoids,4811,Q6640449,fictional character,434232,193768,"0,9098","0,9309",11,51,"0,18",8,"0,64",FALSE,"11: cthulhu, aquaman, davyjones, cthulhumythosdeities, daleks, quintessons, illithid, zoidberg, dweller-in-darkness, ood"
,,0,"229,53",Songs recorded by Faces,9051,Q16838569,song,48331,23433,"0,7382","0,9318",3,73,"0,04",2,"0,33",FALSE,"3: maybei’mamazed, loveinvain, angel"
,,1,"220,17",Atomwaffen Division members in the United States who faced criminal charges,48854,Q86754653,"human, criminal",635759,51707,"0,8929","0,9307",238,641,"0,27",39,"0,16",FALSE,"236: vladimirputin, donaldtrump, kanyewest, charlesmanson, charliemanson, tedkaczynski, aleksandrdugin, georgesoros, alexjones, nickfuentes"
,,1,"212,98",Films set in New York City,74769,Q6620067,film,278213,43465,"0,8757","0,9315",4294,62,"0,99",1096,"0,37",TRUE,"2962: xxxreturnofxandercage, doctorstrangeinthemultiverseofmadness, spider-mannowayhome, fantasticbeaststhesecretsofdumbledore, morbius, titanic, thegodfather, fantasticbeastsandwheretofindthem, avengersendgame, uncharted"
,,1,"212,65",Plays adapted into feature films,40255,Q6634064,film,41378,3112,"0,8774","0,9314",3937,603,"0,87",847,"0,25",FALSE,"3402: westsidestory, grease, oneflewoverthecuckoo’snest, casablanca, meetjoeblack, thesoundofmusic, mammamia, therockyhorrorpictureshow, afewgoodmen, anastasia"
,,1,"212,54",Films set in London,27155,Q3243749,film,199250,9947,"0,8811","0,9314",2885,470,"0,86",733,"0,28",TRUE,"2580: xxxreturnofxandercage, fantasticbeaststhesecretsofdumbledore, notimetodie, fantasticbeastsandwheretofindthem, thegrayman, deathonthenile, blackpanther, sitaramam, eternals, fantasticbeaststhecrimesofgrindelwald"
,,1,"212,48",American drama films,36125,Q6836730,film,43936,4566,"0,8901","0,9316",4040,40,"0,99",1178,"0,3",FALSE,"3960: fall, djangounchained, whiplash, oneflewoverthecuckoo’snest, thepassionofthechrist, citizenkane, therewillbeblood, rainman, bridgetoterabithia, aftersun"
,,1,"212,47",American comedy films,63394,Q6561446,film,177777,17598,"0,86","0,9314",5074,260,"0,95",1469,"0,31",TRUE,"4700: knivesout, forrestgump, theaddamsfamily, thewolfofwallstreet, homealone, backtothefuture, shrek, encanto, thelionking, minions"
,,1,"212,46",United Artists films,71933,Q3249632,film,111998,13267,"0,8895","0,9314",2859,191,"0,94",522,"0,31",TRUE,"1679: notimetodie, houseofgucci, licoricepizza, apocalypsenow, bonesandall, oneflewoverthecuckoo’snest, thirteenlives, casinoroyale, rocky, strangeworld"
,,1,"212,37",Film noir titles,89127,Q2381160,film,38974,11706,"0,9027","0,9316",890,90,"0,91",250,"0,28",FALSE,"882: vertigo, gaslight, sunsetboulevard, thethirdman, kaiju, highnoon, rebecca, scarface, themaltesefalcon, strangersonatrain"
,,,the man,,,,,,,,,,,,,,,
,,,score,name,rank,wikidata,type,members rank mean,members rank median,members system interesting score mean,members system interesting score median,valid members count,invalid members count,valid members ratio,nonavailable members count,nonavailable members ratio,is merged,names
,,1,"230,53",The Spectacular Spider-Man characters,29524,Q6600020,fictional character,395982,96041,"0,9125","0,9319",243,249,"0,49",161,"0,77",FALSE,"208: moonknight, spider-man, batman, morbiusthelivingvampire, joker, ironman, doctorstrange, captainamerica, hulk, deadpool"
,,1,"229,69",The Spectacular Spider-Man episodes,97527,Q460681,television series episode,8591,2939,"0,9124","0,9337",11,179,"0,06",9,"0,73",FALSE,"11: x-menprydeofthex-men, survivalofthefittest, theuncertaintyprinciple, interactions, naturalselection, catalysts, theinvisiblehand, breakout, competition, marketforces"
,,1,"229,19",Spider-Man enemies,538037,Q2013424,fictional character,412203,112999,"0,9143","0,9319",272,337,"0,45",181,"0,8",FALSE,"226: moonknight, spider-man, batman, superman, morbiusthelivingvampire, joker, ironman, doctorstrange, captainamerica, hulk"
,,1,"228,73",Y: The Last Man characters,19524,Q6604513,fictional character,87647,87647,"0,7799","0,7799",1,81,"0,01",2,1,FALSE,1: agent355
,,1,"228,72",Iron Man enemies,48201,Q1660472,fictional character,421208,63436,"0,9134","0,9319",106,120,"0,47",78,"0,75",FALSE,"103: spider-man, kangtheconqueror, alternativeversionsofironman, ironman, tonystark, thanos, captainamerica, hulk, wolverine, ironheart"
,,1,"228,54",Spider-Man films,56313,Q7142195,film,2623072,2039580,"0,6391","0,6991",15,1,1,5,"0,31",FALSE,"13: spider-mannowayhome, spider-manhomecoming, spider-manfarfromhome, spider-man, spider-manintothespider-verse, spider-man3, theamazingspider-man, theamazingspider-man2, spider-man2, spider-manacrossthespider-verse"
,,1,"228,43",D.Gray-man characters,229432,Q611315,fictional character,585550,72199,"0,9309","0,9318",19,145,"0,12",7,"0,5",TRUE,"12: noah, psychokinesis, telepathy, golem, protagonist, allenwalker, lenaleelee, yukanda, lavi, millenniumearl"
,,1,"228,38",Method Man filmography,42877,Q6823684,film,174606,97931,"0,8892","0,9323",44,124,"0,26",27,"0,59",FALSE,"44: scarymovie3, bigdaddy, trainwreck, lastlooks, copland, peppermint, jayandsilentbobreboot, keanu, gardenstate, shaft"
,,1,"227,99",Mega Man characters,46872,Q845423,fictional character,380129,80871,"0,9328","0,9319",20,356,"0,05",12,"0,85",TRUE,"13: sonicthehedgehog, bobafett, superhero, lassie, recurringcharacter, megaman, zero, megamanx, drwily, doctorwily"
,,1,"227,42",D.Gray-man chapters,41770,Q2306460,book,682888,511996,"0,543","0,3514",3,35,"0,08",2,"0,33",FALSE,"3: weeklyshōnenjump, tankōbon, jumpsquare"
,,,goog,,,,,,,,,,,,,,,
,,,score,name,rank,wikidata,type,members rank mean,members rank median,members system interesting score mean,members system interesting score median,valid members count,invalid members count,valid members ratio,nonavailable members count,nonavailable members ratio,is merged,names
,,5,"215,45",Google products,411540,Q438342,product,919892,63573,"0,9136","0,9316",608,347,"0,64",286,"0,48",FALSE,"595: youtube, google, googletranslate, gmail, microsoftoffice, twitter, android, youtubemusic, ios, youtubepremium"
,,,billy corgan,,,,,,,,,,,,,,,
,,,score,name,rank,wikidata,type,members rank mean,members rank median,members system interesting score mean,members system interesting score median,valid members count,invalid members count,valid members ratio,nonavailable members count,nonavailable members ratio,is merged,names
