,,,,,,,,,,,,,,,,,,
,,0,"211,59",2000 births,131301,Q6648148,human,36245,2115,"0,8353","0,9206",8785,209,"0,98",645,"0,07",FALSE,"8772: erlinghaaland, roccoritchie, ellableutravolta, miathreapleton, millyalcock, viníciusjúnior, juliánálvarez, aurélientchouaméni, philfoden, antony"
,,,as df as df as df 3453212345,,,,,,,,,,,,,,,
,,,score,name,rank,wikidata,type,members rank mean,members rank median,members system interesting score mean,members system interesting score median,valid members count,invalid members count,valid members ratio,nonavailable members count,nonavailable members ratio,is merged,names
,,0,"315,64",Aircraft (Df-Dz),2288,Q60519306,aircraft,100992,9810,"0,7649","0,7771",518,547,"0,49",6,"0,01",FALSE,"518: dornierdo200, douglasa4dskyhawk, douglas640, douglasa-4skyhawk, douglasdc-10, douglasdc-3, douglasc-49, douglasc-48, douglasc-84, douglasnavytype0transport"
,,1,"284,43",Missiles,256848,Q3244242,missile,268208,76418,"0,7623","0,7107",873,598,"0,59",93,"0,11",FALSE,"856: 9k720iskander, mim-104patriot, fgm-148javelin, rs-28sarmat, ss-n-27sizzler, ss-n-27, p-900, 3m-54klub, 3m-54kalibr, neptune"
,,1,"271,52",Reptiles as pets,3258,Q7158061,taxon,186635,85002,"0,8492","0,927",42,6,"0,89",8,"0,17",FALSE,"42: reticulatedpython, boaconstrictor, greeniguana, ballpython, red-earedslider, leopardgecko, hermann’stortoise, burmesepython, pogona, centralbeardeddragon"
,,0,"270,20",Topics characterized as pseudoscience,395177,Q4437154,pseudoscience,1065346,326734,"0,9133","0,9317",85,967,"0,08",48,"0,55",FALSE,"85: covid-19pandemic, tuberculosis, covid-19, aids, pneumonia, lymedisease, astrological, astrology, homeopathy, homeopath"
,,1,"269,74",AS Monaco FC players,21773,Q8217883,human,216377,14726,"0,7455","0,9192",608,2,1,54,"0,09",FALSE,"606: kylianmbappé, thierryhenry, pierre-emerickaubameyang, georgeweah, jamesrodríguez, aurélientchouaméni, cescfàbregas, takumiminamino, lilianthuram, benjaminmendy"
,,0,"268,68",Diagnoses characterized as pseudoscience,20224,Q21068022,questionable disease,151865,101961,"0,834","0,9309",13,155,"0,08",2,"0,08",FALSE,"13: electromagnetichypersensitivity, femalehysteria, morgellons, chroniclymedisease, leakygutsyndrome, drapetomania, exciteddelirium, adrenalfatigue, vertebralsubluxation, ropeworms"
,,1,"268,25",AS Saint-Étienne players,9394,Q8217900,human,65209,9650,"0,7714","0,9192",533,2,1,24,"0,04",FALSE,"533: pierre-emerickaubameyang, michelplatini, williamsaliba, wesleyfofana, laurentblanc, dimitripayet, blaisematuidi, allansaint-maximin, rogermilla, bafétimbigomis"
,,0,"268,14",Queer as Folk characters,22780,Q899273,fictional character,18002,19492,"0,9317","0,9316",6,150,"0,04",2,"0,33",TRUE,"3: briankinney, justintaylor, tedschmidt"
,,1,"267,75",AS Cannes players,1995,Q7126227,human,56838,2544,"0,7508","0,9192",360,1,1,8,"0,02",FALSE,"360: zinedinezidane, hervérenard, patrickvieira, jankoller, djamelbelmadi, gaëlclichy, alenbokšić, luisfernandez, johanmicoud, ruudkrol"
,,0,"266,95",Mammals as pets,1963,Q8759613,taxon,1831156,2376332,"0,9328","0,9328",4,9,"0,33",3,"0,5",FALSE,"4: pig, redfoxaspets, donkey, domesticatedhedgehog"
,,,nine inch nails,,,,,,,,,,,,,,,
,,,score,name,rank,wikidata,type,members rank mean,members rank median,members system interesting score mean,members system interesting score median,valid members count,invalid members count,valid members ratio,nonavailable members count,nonavailable members ratio,is merged,names
,,0,"287,26",Nine Inch Nails band members,115697,Q3251694,human,557865,74805,"0,9202","0,9312",39,178,"0,18",12,"0,28",FALSE,"39: davidbowie, marilynmanson, puffdaddy, option30, trentreznor, joshfreese, atticusross, adrianbelew, petermurphy, richardpatrick"
,,4,"277,80",Songs recorded by Nine Inch Nails,12775,Q47090183,song,40221,21153,"0,9353","0,9353",9,215,"0,04",6,1,TRUE,"5: closer, onaroll, wish, burn, everything"
,,4,"244,27",Nine Inch Nails albums,213,Q8880931,album,113278,81969,"0,9092","0,932",11,1,1,7,"0,55",FALSE,"11: thedownwardspiral, prettyhatemachine, yearzero, thefragile, withteeth, ghostsi-iv, hesitationmarks, badwitch, theslip, ghostsvilocusts"
,,5,"243,85",Nine Inch Nails members,208,Q8680103,human,161084,74504,"0,9193","0,9311",22,2,"0,96",5,"0,18",FALSE,"22: trentreznor, joshfreese, atticusross, adrianbelew, richardpatrick, twiggyramirez, lisafischer, robinfinck, ericavery, ilanrubin"
,,2,"240,01",Brooklyn Nine-Nine episodes,724774,Q15944570,television series episode,10625,7773,"0,9169","0,9319",149,88,"0,63",73,"0,49",FALSE,"147: thelastday, thebox, thegoodones, adrianpimento, hitchcockscully, pontiacbandit, lightsout, thebighouse, dfw, renewal"
,,2,"239,33",Brooklyn Nine-Nine characters,367904,Q20657193,fictional character,121221,87552,"0,9317","0,9317",7,469,"0,01",5,"0,8",TRUE,"5: johnmcclane, recurringcharacter, jessicaday, rosadiaz, amysantiago"
,,1,"233,08",Nine-dart finish,207175,Q463236,human,108085,50027,"0,8969","0,9313",80,146,"0,36",12,"0,14",FALSE,"80: michaelvangerwen, michaelsmith, gerwynprice, andrewflintoff, philtaylor, peterwright, raymondvanbarneveld, fallonsherrock, garyanderson, dimitrivandenbergh"
,,3,"228,88",Industrial metal bands,33385,Q6624012,musical group,85386,14030,"0,9118","0,9315",345,81,"0,81",125,"0,39",TRUE,"316: rammstein, kingcrimson, nineinchnails, marilynmanson, queensrche, typeonegative, static-x, motionlessinwhite, danzig, kreator"
,,1,"227,02",WPA World Nine-ball champions,63817,Q6603679,human,22139,5004,"0,8862","0,9304",122,298,"0,29",14,"0,11",FALSE,"122: markselby, efrenreyes, jeanettelee, kellyfisher, shanevanboening, earlstrickland, williemosconi, allisonfisher, joshuafiller, panxiaoting"
,,1,"226,92",Programs broadcast by Nine Network,22159,Q6635291,television program,240680,36824,"0,8633","0,9313",1137,891,"0,56",454,"0,41",FALSE,"1118: manifest, thebigbangtheory, academyawards, friends, thesopranos, youngsheldon, spongebobsquarepants, gilmoregirls, sherlock, sexandthecity"
,,,krakow,,,,,,,,,,,,,,,
,,,score,name,rank,wikidata,type,members rank mean,members rank median,members system interesting score mean,members system interesting score median,valid members count,invalid members count,valid members ratio,nonavailable members count,nonavailable members ratio,is merged,names
,,1,"213,56",Bids for the Winter Olympics,11461,Q6607538,"city, bid for sporting event",693549,13910,"0,6736","0,7655",102,134,"0,43",41,"0,4",FALSE,"101: milan, munich, lviv, stockholm, beijing, montreal, vancouver, oslo, krakow, helsinki"
,,1,"212,23",Cities and towns in Germany,2116880,Q209208,city,89773,33368,"0,8197","0,925",2055,286,"0,88",465,"0,23",FALSE,"2044: berlin, gibraltar, munich, hamburg, frankfurtammain, cologne, dresden, leipzig, stuttgart, nuremberg"
,,0,"212,22",Juilliard School people,240787,Q6575474,human,266434,12037,"0,8987","0,9308",732,44,"0,94",76,"0,1",TRUE,"729: valkilmer, robinwilliams, kellymcgillis, mayahawke, oscarisaac, jessicachastain, williamhurt, kevinspacey, adamdriver, christopherreeve"
,,1,"212,20",Cities by GDP,828273,Q1079848,city,1615696,1012734,"0,9073","0,9337",400,326,"0,55",345,"0,86",FALSE,"400: singapore, london, moscow, paris, hongkong, saintpetersburg, istanbul, istanbulmetropolitanmunicipality, kyiv, rome"
,,1,"211,94",21st-century American actresses,53741,Q8206361,human,523527,116474,"0,9113","0,931",5544,37,"0,99",829,"0,15",FALSE,"5539: amberheard, jennaortega, anneheche, jenniferlopez, taylorswift, meghanduchessofsussex, angelinajolie, jenniferconnelly, zendaya, winonaryder"
,,2,"211,90",Most-visited art museums,285570,Q1771711,museum,244240,115185,"0,8032","0,9306",106,230,"0,32",49,"0,46",FALSE,"105: louvre, britishmuseum, statehermitagemuseum, muséed’orsay, metropolitanmuseumofart, uffizigallery, uffizi, museodelprado, guggenheimmuseumbilbao, centrepompidou"
,,1,"211,86",American television actresses,45957,Q6561621,human,407674,72257,"0,9133","0,9311",10540,50,1,830,"0,11",TRUE,"7747: amberheard, jennaortega, anneheche, priscillapresley, jenniferlopez, taylorswift, meghanduchessofsussex, angelinajolie, jenniferconnelly, kimkardashian"
,,1,"211,63",Juilliard School alumni,34278,Q7150472,human,153298,2335,"0,9011","0,9307",1255,11,"0,99",98,"0,08",FALSE,"1254: valkilmer, robinwilliams, kellymcgillis, mayahawke, oscarisaac, jessicachastain, williamhurt, kevinspacey, adamdriver, christopherreeve"
,,3,"211,58",Events in Kraków,1361,Q11711946,event,890628,10269,"0,5936","0,3478",13,17,"0,45",3,"0,15",TRUE,"13: easter, allsaints’day, corpuschristi, lajkonik, longnightofmuseums, juwenalia, wianki, jewishculturefestivalinkraków, equalitymarchinkraków, krakówequalitymarch"
,,1,"211,35",Cities in Mecklenburg-Vorpommern,31185,Q1852719,city,60415,23712,"0,7991","0,925",86,15,"0,86",18,"0,2",FALSE,"86: rostock, schwerin, greifswald, stralsund, wismar, neubrandenburg, neustrelitz, strelitz-alt, anklam, demmin"
,,,joe biden,,,,,,,,,,,,,,,
,,,score,name,rank,wikidata,type,members rank mean,members rank median,members system interesting score mean,members system interesting score median,valid members count,invalid members count,valid members ratio,nonavailable members count,nonavailable members ratio,is merged,names
,,2,"255,72",Executive actions by Joe Biden,63865,Q104922747,"presidential directive, United States executive order",32678,4610,"0,7987","0,772",19,356,"0,05",2,"0,06",FALSE,"18: executiveorder14067, executiveorder, executiveorder14032, presidentialproclamation, executiveorder13990, executiveorder13988, executiveorder14076, executiveorder13985, presidentialmemorandum, executiveorder13992"
,,3,"236,22",Biden administration personnel,2842,Q101428899,human,74635,7600,"0,905","0,9304",468,12,"0,98",30,"0,06",FALSE,"468: antonyblinken, jenpsaki, lloydaustin, petebuttigieg, johnkerry, merrickgarland, janetyellen, anthonyfauci, jeromepowell, sullysullenberger"
,,0,"223,90",Ashita no Joe characters,126270,Q97358737,fictional character,11234,11234,"0,9312","0,9312",1,97,"0,01",2,1,FALSE,1: gearlessjoe
,,1,"222,19",G.I. Joe video games,7943,Q6571544,video game,120827,11652,"0,8853","0,9159",13,202,"0,06",5,"0,33",FALSE,"12: fortnitebattleroyale, third-personshooter, brawlhalla, side-scrolling, gijoeoperationblackout, gijoetheriseofcobra, gijoe, gijoetheatlantisfactor, gijoearealamericanhero, gijoecobrastrike"
,,1,"221,40",Irish Americans,41814,Q6574515,human,605395,52730,"0,8945","0,9311",3841,452,"0,89",829,"0,23",TRUE,"3627: jeffreydahmer, johnnydepp, tomcruise, joebiden, valkilmer, dwaynejohnson, ryanreynolds, jenniferconnelly, kimkardashian, brendanfraser"
,,1,"221,08",Americans of English descent,28237,Q6561638,human,743703,52106,"0,9214","0,9311",4782,287,"0,94",978,"0,24",TRUE,"3997: elonmusk, elvispresley, johnnydepp, marilynmonroe, tomcruise, lisamariepresley, benjaminkeough, joebiden, valkilmer, donaldjtrump"
,,0,"220,61",Joe 90 episodes,3713,Q1880082,television series episode,1247,846,"0,9319","0,9312",3,71,"0,04",2,"0,33",FALSE,"3: theinvestigator, themostspecialagent, theunorthodoxshepherd"
,,0,"220,39",The Joe Schmo Show episodes,10766,Q6599734,television series episode,27728,27728,"0,9326","0,9326",2,10,"0,18",3,1,FALSE,"2: seasonfinale, seasonpremiere"
,,1,"220,00",G.I. Joe: Renegades characters,3963,Q42880564,fictional character,25104,6692,"0,9106","0,9333",100,152,"0,4",78,"0,77",FALSE,"100: snakeeyes, firefly, stormshadow, arashikage, cobracommander, baroness, scarlett, destro, duke, zartan"
,,0,"219,99",Children of presidents of the United States,69613,Q6609410,human,862204,96686,"0,9203","0,9307",440,174,"0,72",76,"0,22",TRUE,"346: joebiden, donaldtrump, barackobama, johnfkennedy, abrahamlincoln, jimmycarter, franklindroosevelt, ronaldreagan, ivanatrump, georgewbush"
,,,european union,,,,,,,,,,,,,,,
,,,score,name,rank,wikidata,type,members rank mean,members rank median,members system interesting score mean,members system interesting score median,valid members count,invalid members count,valid members ratio,nonavailable members count,nonavailable members ratio,is merged,names
,,2,"233,17",Companies of the European Union,13459,Q20715709,company,1158916,600966,"0,8187","0,9294",21,82,"0,21",22,1,FALSE,"21: paris, siemens, carrefour, basf, totalsa, bnpparibas, allianz, arcelormittal, santandergroup, eni"
,,3,"232,30",Urban areas in the European Union,161470,Q2809955,city,2013232,1620095,"0,8918","0,934",102,303,"0,25",93,"0,9",FALSE,"102: paris, rome, berlin, amsterdam, vienna, prague, venice, milan, madrid, budapest"
,,4,"231,97",Tallest buildings in the European Union,77694,Q1431703,building,94194,33025,"0,8569","0,9309",107,456,"0,19",19,"0,17",FALSE,"107: skyscraper, malmö, theshard, cathedral, palaceofcultureandsciencewarsaw, palaceofcultureandscience, tourmontparnasse, storey, turningtorso, towerblock"
,,1,"231,82",External border of the European Union,63067,Q551072,"state, European Union border",662120,85093,"0,7154","0,6999",29,43,"0,41",2,"0,03",FALSE,"29: cyprus, memberstateoftheeuropeanunion, poland-ukraineborder, finland-russiaborder, morocco-spainborder, poland-russiaborder, greece-turkeyborder, romania-ukraineborder, brazil-franceborder, belarus-polandborder"
,,5,"231,59",Member states of the European Union,23621,Q4366558,sovereign state,11883868,10765335,"0,9351","0,9353",27,3,"0,93",28,1,FALSE,"27: germany, france, italy, spain, poland, croatia, finland, portugal, sweden, belgium"
,,2,"229,46",European Boxing Union heavyweight champions,3671,Q6570323,human,75516,5869,"0,8811","0,9304",429,64,"0,87",25,"0,06",FALSE,"429: tysonfury, wladimirklitschko, vitaliklitschko, lennoxlewis, derekchisora, naseemhamed, joejoyce, roberthelenius, tonybellew, davidhaye"
,,0,"227,97",Cities in the European Union by Muslim population,104566,Q6609837,city,1866304,1347990,"0,9273","0,934",42,58,"0,42",33,"0,76",FALSE,"42: paris, berlin, amsterdam, vienna, hamburg, frankfurt, copenhagen, dublin, cologne, marseille"
,,2,"227,81",Presidents of the institutions of the European Union,42937,Q6634866,human,531431,75544,"0,7843","0,9235",125,108,"0,54",16,"0,12",TRUE,"125: margaretthatcher, ursulavonderleyen, tonyblair, johnmajor, angelamerkel, silvioberlusconi, nicolassarkozy, gerhardschröder, jacqueschirac, simoneveil"
,,3,"225,27",European cuisines,50293,Q17067317,European cuisine,154196,66133,"0,9163","0,9314",72,639,"0,1",5,"0,06",FALSE,"72: italiancuisine, tuscancuisine, frenchcuisine, spanishcuisine, germancuisine, polishcuisine, greekcuisine, hungariancuisine, dutchcuisine, portuguesecuisine"
,,1,"224,78",Intergovernmental organizations,230014,Q6624144,organization,1043983,93532,"0,6261","0,9221",325,61,"0,84",46,"0,14",FALSE,"325: russia, nato, northatlantictreatyorganization, europeanunion, switzerland, newyorkcity, unitednations, commonwealthofnations, cuba, g20"
,,,roger federer,,,,,,,,,,,,,,,
,,,score,name,rank,wikidata,type,members rank mean,members rank median,members system interesting score mean,members system interesting score median,valid members count,invalid members count,valid members ratio,nonavailable members count,nonavailable members ratio,is merged,names
,,1,"230,85",Roger Corman filmography,79314,Q7358023,film,100829,17046,"0,8872","0,9313",184,70,"0,73",50,"0,27",FALSE,"179: thesilenceofthelambs, thegodfatherpartii, philadelphia, apollo13, scream3, deathrace, looneytunesbackinaction, thelittleshopofhorrors, deathrace2000, thehowling"
,,1,"228,53",Ginger Rogers filmography,39434,Q27450225,film,33526,7900,"0,8929","0,9314",80,141,"0,36",24,"0,29",FALSE,"80: chicago, tophat, grandhotel, bellbookandcandle, easterparade, 42ndstreet, monkeybusiness, golddiggersof1933, thegaydivorcee, swingtime"
,,1,"226,20",Kenny Rogers songs,9608,Q8572139,song,24203,5570,"0,887","0,9317",13,73,"0,15",6,"0,38",FALSE,"13: lovemetender, loveisstrange, rubydon’ttakeyourlovetotown, forthegoodtimes, mylove, crazy, loveliftedme, sweetmusicman, thegreatest, thiswoman"
,,0,"225,41",Federal prince,29517,Q1839992,human,885595,885595,"0,9366","0,9366",1,34,"0,03",2,1,FALSE,1: king
,,2,"223,91",International sports federations,124912,Q1346006,international sport governing body,102708,15766,"0,5484","0,2626",156,586,"0,21",15,"0,09",FALSE,"155: fifa, internationalcricketcouncil, internationalolympiccommittee, fédérationinternationaledel’automobile, fide, fiba, fédérationinternationaledevolleyball, worldathletics, badmintonworldfederation, internationaltennisfederation"
,,1,"222,32",Roger Waters concert tours,4066,Q8672728,concert tour,32796,20224,"0,9317","0,9315",6,1,1,3,"0,33",FALSE,"6: thisisnotadrill, thewalllive, thedarksideofthemoonlive, intheflesh, radiokaos, usthemtour"
,,1,"221,42",Federal universities of Brazil,55156,Q6619383,university,15696,9365,"0,524","0,3391",211,39,"0,85",5,"0,02",FALSE,"211: universityofsãopaulo, federaluniversityofriodejaneiro, universidadefederaldoriodejaneiro, institutotecnológicodeaeronáutica, stateuniversityofcampinas, mackenziepresbyterianuniversity, universityofbrasília, universidadedebrasília, estáciodesáuniversities, fundaçãogetuliovargas"
,,1,"220,92",United States federal legislation,41263,Q6602828,legislation,82613,47827,"0,8964","0,9317",9,451,"0,02",2,"0,11",FALSE,"9: gunlawintheunitedstates, unitedstatescode, northwestordinance, actofcongress, publiclaw, landordinanceof1785, copyrightclause, helpamericavoteact, militiaactof1862"
,,1,"220,67",Songs written by Roger Waters,5410,Q7940279,song,31508,13356,"0,9315","0,9309",5,179,"0,03",3,"0,4",FALSE,"5: haveacigar, seamus, apillowofwinds, whatgodwantsparti, thebraveryofbeingoutofrange"
,,1,"220,20",Federal political parties in Canada,173882,Q6619376,political party,46227,6263,"0,7942","0,9306",94,232,"0,29",9,"0,09",TRUE,"89: conservativepartyofcanada, liberalpartyofcanada, newdemocraticparty, blocquébécois, revolutionarycommitteeofthechinesekuomintang, pirateparty, people’spartyofcanada, jiusansociety, greenpartyofcanada, progressiveconservativepartyofcanada"
,,,suzuki,,,,,,,,,,,,,,,
,,,score,name,rank,wikidata,type,members rank mean,members rank median,members system interesting score mean,members system interesting score median,valid members count,invalid members count,valid members ratio,nonavailable members count,nonavailable members ratio,is merged,names
,,5,"241,58",Suzuki vehicles,24537,Q6425262,automobile model,258880,118094,"0,8931","0,9262",70,8,"0,91",3,"0,03",FALSE,"68: suzukiacross, suzukisantana, suzukisierra, suzukisamurai, suzukilj80, suzukijimny, suzukiswift, suzukinomade, suzukisidekick, suzukigrandnomade"
,,4,"235,74",Seijun Suzuki filmography,13084,Q7446753,film,12566,2830,"0,8554","0,9309",39,48,"0,45",4,"0,08",FALSE,"39: brandedtokill, tokyodrifter, zigeunerweisen, gateofflesh, lupiniiilegendofthegoldofbabylon, legendofthegoldofbabylon, disciplesofhippocrates, yumeji, kagero-za, pistolopera"
,,3,"213,75",Japanese voice actresses,318878,Q6000846,human,187438,85872,"0,852","0,9221",1045,15,"0,99",42,"0,04",FALSE,"1043: saorihayami, atsumitanezaki, harukafukuhara, kanahanazawa, monekamishiraishi, ayanesakura, manaashida, suzuhirose, kasumiarimura, aoiyūki"
,,3,"213,69",Japanese footballers,42465,Q7040913,human,20736,3319,"0,9208","0,9306",4975,6,1,45,"0,01",FALSE,"4892: kaorumitoma, takumiminamino, keisukehonda, takefusakubo, kazuyoshimiura, ritsudōan, hajimemoriyasu, mayayoshida, yutonagatomo, shinjikagawa"
,,3,"213,56",Japanese actresses,323846,Q1862467,human,300166,174952,"0,8935","0,9228",963,37,"0,96",52,"0,06",TRUE,"859: wakanamatsumoto, hikarimitsushima, yuinakuroshima, harukafukuhara, sakuramiyawaki, taotsuchiya, sakuraando, akinanakamori, sairiito, harunakawaguchi"
,,3,"213,55",Japanese baseball players,276959,Q6575064,human,91757,44436,"0,8882","0,9304",1573,4,1,23,"0,02",TRUE,"1457: yudarvish, ichirosuzuki, rōkisasaki, hidekimatsui, hiromitsuochiai, masahirotanaka, sadaharuoh, chojimurata, tsuyoshishinjo, giantbaba"
,,3,"213,54",Japanese male voice actors,204110,Q9673355,human,214190,89859,"0,7983","0,9257",773,2,1,18,"0,02",FALSE,"773: takahirosakurai, kenjirotsuda, hiroyukiwatanabe, mamorumiyano, takuyakimura, kenwatanabe, nijirōmurakami, takuyaeguchi, hidetoshinishijima, yuichinakamura"
,,1,"213,54",2010s cars,28106,Q6278623,automobile model,185069,78844,"0,8472","0,9199",1081,186,"0,85",160,"0,15",FALSE,"1034: toyotasupra, toyotalandcruiser, nissangt-r, nissanskyline, bmwm3, toyotahilux, toyotarav4, toyotacrown, hondaaccord, ladariva"
,,1,"213,53",2000s cars,37453,Q6278620,automobile model,256934,148002,"0,872","0,9304",605,136,"0,82",118,"0,2",FALSE,"586: toyotasupra, volkswagenbeetle, toyotalandcruiser, bmw3series, mazdarx-7, bmwm3, toyotahilux, toyotarav4, toyotacrown, hondaaccord"
,,2,"213,31",Japan international footballers,165535,Q2314105,human,113493,15522,"0,9099","0,9306",1203,339,"0,78",18,"0,03",TRUE,"625: kaorumitoma, takumiminamino, keisukehonda, takefusakubo, kazuyoshimiura, ritsudoan, ritsudōan, hajimemoriyasu, mayayoshida, yutonagatomo"
,,,pirates,,,,,,,,,,,,,,,
,,,score,name,rank,wikidata,type,members rank mean,members rank median,members system interesting score mean,members system interesting score median,valid members count,invalid members count,valid members ratio,nonavailable members count,nonavailable members ratio,is merged,names
,,5,"235,09",Pirates,191794,Q2995372,"human, pirate",139692,38660,"0,8989","0,931",20,1182,"0,02",3,"0,1",TRUE,"20: barbarycorsairs, barbarypirate, barbarypirates, buccaneer, wokou, filibuster, jeannedeclisson, victualbrothers, ushkuyniks, cilicianpirates"
,,5,"230,78",Pirate films,24565,Q6833470,film,109973,9904,"0,8415","0,9308",177,6,"0,97",29,"0,16",FALSE,"173: thegoonies, castleinthesky, theseabeast, theprincessbride, captainphillips, shotgunwedding, sixdayssevennights, theadventuresoftintin, thepiratesthelastroyaltreasure, iceagecontinentaldrift"
,,0,"230,53",Fictional pirates,24441,Q16000160,fictional character,514747,211443,"0,9169","0,9314",66,784,"0,08",52,"0,78",FALSE,"65: batman, robinhood, monkeydluffy, popeye, popeyethesailor, jacksparrow, roronoazoro, princessleia, antihero, protagonist"
,,4,"229,20",Spanish pirates,10878,Q6299255,human,17526,2145,"0,8943","0,9307",17,1,1,2,"0,06",FALSE,"17: lopedeaguirre, amaropargo, benitodesoto, alonsodecontreras, cabezadeperro, pedrogilbert, diabolito, juangarcía, donbenito, manselalcantra"
,,4,"228,87",British pirates,7561,Q8315556,human,62661,2547,"0,9265","0,9315",69,2,"0,99",10,"0,13",FALSE,"69: stedebonnet, calicojack, maryread, benjaminhornigold, charlesvane, samuelbellamy, israelhands, edwardlow, thomastew, henryjennings"
,,4,"228,52",English pirates,6796,Q7598352,human,41283,938,"0,9274","0,9316",102,5,"0,96",13,"0,12",FALSE,"102: blackbeard, henryevery, hughdespensertheyounger, jackward, thomastew, petereaston, charlottedeberry, johntaylor, robertculliford, bartholomewsharp"
,,4,"228,45",French pirates,7350,Q8474280,human,27050,2616,"0,8496","0,9242",47,4,"0,94",2,"0,02",FALSE,"47: olivierlevasseur, jeanlafitte, jeannedeclisson, robertsurcouf, françoisl’olonnais, hippolytebouchard, eustacethemonk, annedieu-le-veut, emanuelwynn, louis-michelaury"
,,4,"227,82",Italian pirates,6655,Q6299259,human,20437,1987,"0,924","0,9221",8,1,1,2,"0,12",FALSE,"8: occhiali, rogerdeflor, vincenzogambi, khojazufar, andreamorisco, vincenzoalessandri, guglielmograsso, gabrieldaparma"
,,4,"227,77",Irish pirates,6203,Q7775552,human,23615,1931,"0,8953","0,9318",16,1,1,2,"0,06",FALSE,"16: graceo’malley, edwardengland, walterkennedy, richardnoland, williamburke, edwardjordan, georgecusack, philiproche, turnjoe, johncornelius"
,,4,"227,08",Chinese pirates,4850,Q6299253,human,44983,9003,"0,9006","0,9242",25,2,"0,96",6,"0,2",FALSE,"25: zhengyisao, zhengzhilong, ganning, cheungpotsai, wangzhi, zhengjing, zhengyi, limahong, lidan, chenzuyi"
,,,doge,,,,,,,,,,,,,,,
,,,score,name,rank,wikidata,type,members rank mean,members rank median,members system interesting score mean,members system interesting score median,valid members count,invalid members count,valid members ratio,nonavailable members count,nonavailable members ratio,is merged,names
,,1,"238,53",Doges of Venice,127409,Q534630,human,121740,5410,"0,8972","0,921",130,31,"0,81",2,"0,01",TRUE,"128: napoleon, enricodandolo, ludovicomanin, johnjuliusnorwich, francescomorosini, marinofaliero, paololucioanafesto, leonardoloredan, andreagritti, francescofoscari"
,,1,"224,27",CubeSats,16695,Q2976857,CubeSat,3445,879,"0,7824","0,7103",246,705,"0,26",23,"0,15",TRUE,"150: capstone, swayam, liciacube, sacred, near-earthasteroidscout, lunarflashlight, asteria, argomoon, estcube-1, biosentinel"
,,1,"214,52",Duke of Amalfi,5434,Q1262807,human,89936,1072,"0,908","0,9307",34,40,"0,47",2,"0,03",FALSE,"34: alfonsoxiiiofspain, philipivofspain, robertguiscard, ottaviopiccolomini, rogerborsa, guaimarivofsalerno, giovannad’aragonaduchessofamalfi, generaleneasilviopiccolomini, ferranteiigonzaga, gisulfiiofsalerno"
,,0,"212,31",Internet phenomena,468246,Q6023923,Internet meme,259419,50092,"0,8705","0,9311",222,1584,"0,12",87,"0,45",TRUE,"193: morbius, lean, rule34, nonutnovember, russiansleepexperiment, rickrolling, loss, creepypasta, willsmith-chrisrockslappingincident, harambe"
,,1,"210,64",Works by Giovanni Bellini,13743,Q3884078,creative work,37461,2509,"0,7625","0,9302",121,213,"0,36",10,"0,09",FALSE,"99: isbn, waterlilies, pietà, listofpaintingsbycaravaggio, listofpaintingsbyjohannesvermeer, 100greatpaintings, thefeastofthegods, feastofthegods, drunkennessofnoah, sanzaccariaaltarpiece"
,,1,"209,44",Paintings by Tintoretto,9269,Q3884090,painting,9629,3789,"0,8603","0,9307",69,116,"0,38",9,"0,23",TRUE,"35: lastsupper, susannaandtheelders, miracleoftheslave, theoriginofthemilkyway, marsandvenussurprisedbyvulcan, findingofthebodyofsaintmark, crucifixion, ilparadiso, thewashingofthefeet, saintmark’sbodybroughttovenice"
