,,,,,,,,,,,,,,,,,,
MH,KW,TC,,,,,,popularity of names in Wikipedia,,simple characters in names,,correctness of extracted names,,,popularity of names in ENS,,,
,,,,,,,,,,,,,,,,,,
,,,apple,,,,,,,,,,,,,,,
,,,score,name,rank,wikidata,type,members rank mean,members rank median,members system interesting score mean,members system interesting score median,valid members count,invalid members count,valid members ratio,nonavailable members count,nonavailable members ratio,is merged,names
,5,,"237,89",Apple cultivars,389795,Q493703,apple cultivar,16878,3872,"0,8896","0,9315",238,658,"0,27",70,"0,3",FALSE,"227: grannysmith, fuji, goldendelicious, gala, mcintosh, honeycrisp, crippspink, reddelicious, cosmiccrisp, belledeboskoop"
,4,,"237,04",Apple dishes,24824,Q19839599,dish,158556,55538,"0,9182","0,9317",45,566,"0,07",24,"0,51",FALSE,"45: frenchfries, eggsbenedict, ricepudding, nationaldish, baozi, tartetatin, friedrice, applepie, scrambledeggs, relish"
,2,,"235,19",Apple typefaces,7733,Q2258110,typeface,80025,12591,"0,9331","0,9341",24,28,"0,47",14,"0,62",FALSE,"21: helvetica, timesroman, blackletter, sanfrancisco, myriad, monaco, menlo, lucidagrande, chicago, bitstreamvera"
,2,,"234,47",Apple operating systems,381689,Q24885025,operating system,644555,150331,"0,844","0,7821",132,66,"0,67",24,"0,18",FALSE,"131: iphoneos, ios, osx, macos, macosx, unix, macosmonterey, ios16, macosventura, macosbigsur"
,2,,"234,18",Apple printers,6454,Q3620912,printer,47112,12628,"0,9318","0,9317",10,46,"0,18",3,"0,2",FALSE,"10: plotter, dotmatrixprinter, laserwriter, thermaltransferprinter, deskjet, imagewriter, stylewriter, colorstylewriter, appledaisywheelprinter, colorlaserwriter"
,2,,"233,71",Apple II games,36094,Q1101766,video game,22771,1954,"0,8498","0,9312",1146,476,"0,71",236,"0,29",TRUE,"804: tetris, pac-man, role-playingvideogame, platformgame, donkeykong, adventuregame, graphicadventure, graphicadventuregame, spaceinvaders, stealthgame"
,2,,"231,37",Apple IIGS games,7368,Q6561808,video game,51137,7856,"0,8097","0,9311",300,270,"0,53",74,"0,37",TRUE,"198: tetris, supermariobros, pac-man, spaceinvaders, wolfenstein3d, lemmings, castlewolfenstein, bubblebobble, anotherworld, gauntlet"
,5,,"230,45",Apples,1704,Q6132343,taxon,114288,35240,"0,9284","0,9315",9,28,"0,25",3,"0,22",FALSE,"9: crabapple, wildapple, malussieversii, reinette, ciderapple, applecrab, pippinapple, aiailu, firikipiliou"
,3,,"229,38",Japanese apple cultivars,4538,Q63671498,apple cultivar,18514,4850,"0,8948","0,9315",193,174,"0,53",65,"0,33",FALSE,"193: grannysmith, fuji, goldendelicious, gala, mcintosh, honeycrisp, crippspink, reddelicious, cosmiccrisp, belledeboskoop"
,2,,"228,66",Apple Inc. employees,3641,Q9068571,human,76017,6084,"0,9102","0,9307",134,4,"0,98",32,"0,23",FALSE,"134: queenraniaofjordan, reidhoffman, trentreznor, ericschmidt, ronaldwayne, markrober, chrisannbrennan, marcbenioff, robertpera, iangoodfellow"
,,,apples,,,,,,,,,,,,,,,
,,,score,name,rank,wikidata,type,members rank mean,members rank median,members system interesting score mean,members system interesting score median,valid members count,invalid members count,valid members ratio,nonavailable members count,nonavailable members ratio,is merged,names
,5,,"240,12",Apples,1704,Q6132343,taxon,114288,35240,"0,9284","0,9315",9,28,"0,25",3,"0,22",FALSE,"9: crabapple, wildapple, malussieversii, reinette, ciderapple, applecrab, pippinapple, aiailu, firikipiliou"
,5,,"237,40",Apple cultivars,389795,Q493703,apple cultivar,16878,3872,"0,8896","0,9315",238,658,"0,27",70,"0,3",FALSE,"227: grannysmith, fuji, goldendelicious, gala, mcintosh, honeycrisp, crippspink, reddelicious, cosmiccrisp, belledeboskoop"
,4,,"236,55",Apple dishes,24824,Q19839599,dish,158556,55538,"0,9182","0,9317",45,566,"0,07",24,"0,51",FALSE,"45: frenchfries, eggsbenedict, ricepudding, nationaldish, baozi, tartetatin, friedrice, applepie, scrambledeggs, relish"
,2,,"234,70",Apple typefaces,7733,Q2258110,typeface,80025,12591,"0,9331","0,9341",24,28,"0,47",14,"0,62",FALSE,"21: helvetica, timesroman, blackletter, sanfrancisco, myriad, monaco, menlo, lucidagrande, chicago, bitstreamvera"
,2,,"234,04",Apple operating systems,381689,Q24885025,operating system,644555,150331,"0,844","0,7821",132,66,"0,67",24,"0,18",FALSE,"131: iphoneos, ios, osx, macos, macosx, unix, macosmonterey, ios16, macosventura, macosbigsur"
,2,,"233,69",Apple printers,6454,Q3620912,printer,47112,12628,"0,9318","0,9317",10,46,"0,18",3,"0,2",FALSE,"10: plotter, dotmatrixprinter, laserwriter, thermaltransferprinter, deskjet, imagewriter, stylewriter, colorstylewriter, appledaisywheelprinter, colorlaserwriter"
,2,,"233,27",Apple II games,36094,Q1101766,video game,22771,1954,"0,8498","0,9312",1146,476,"0,71",236,"0,29",TRUE,"804: tetris, pac-man, role-playingvideogame, platformgame, donkeykong, adventuregame, graphicadventure, graphicadventuregame, spaceinvaders, stealthgame"
,2,,"230,94",Apple IIGS games,7368,Q6561808,video game,51137,7856,"0,8097","0,9311",300,270,"0,53",74,"0,37",TRUE,"198: tetris, supermariobros, pac-man, spaceinvaders, wolfenstein3d, lemmings, castlewolfenstein, bubblebobble, anotherworld, gauntlet"
,3,,"228,94",Japanese apple cultivars,4538,Q63671498,apple cultivar,18514,4850,"0,8948","0,9315",193,174,"0,53",65,"0,33",FALSE,"193: grannysmith, fuji, goldendelicious, gala, mcintosh, honeycrisp, crippspink, reddelicious, cosmiccrisp, belledeboskoop"
,2,,"228,22",Apple Inc. employees,3641,Q9068571,human,76017,6084,"0,9102","0,9307",134,4,"0,98",32,"0,23",FALSE,"134: queenraniaofjordan, reidhoffman, trentreznor, ericschmidt, ronaldwayne, markrober, chrisannbrennan, marcbenioff, robertpera, iangoodfellow"
,,,bmw,,,,,,,,,,,,,,,
,,,score,name,rank,wikidata,type,members rank mean,members rank median,members system interesting score mean,members system interesting score median,valid members count,invalid members count,valid members ratio,nonavailable members count,nonavailable members ratio,is merged,names
,4,,"242,19",BMW engines,255852,Q2723810,"engine, human",172429,112830,"0,7862","0,7814",91,163,"0,36",5,"0,04",TRUE,"91: bmwb58, bmws58, v8engine, bmws54, bmwm54, bmwm57, bmws55, bmwn55, v12engine, bmws52"
,3,,"231,11",BMW designers,1820,Q8285202,human,51306,24577,"0,9258","0,9302",21,2,"0,95",4,"0,14",FALSE,"21: giorgettogiugiaro, marcellogandini, henrikfisker, chrisbangle, giovannimichelotti, karimhabib, paulbracq, clausluthe, jozefkaba, adrianvanhooydonk"
,3,,"219,79",Rear-wheel-drive vehicles,58802,Q7037482,automobile model,120750,43525,"0,8487","0,9206",1536,338,"0,82",188,"0,13",FALSE,"1412: toyotasupra, nissanskyline, mazdarx-7, toyotahilux, toyotamasterline, toyotacrown, ladariva, teslamodels, mercedes-benzw124, teslamodel3"
,2,,"218,33",Aircraft engines,202620,Q930689,aircraft engine,36881,14002,"0,7636","0,7742",668,1862,"0,26",4,0,FALSE,"666: ramjet, cfminternationalcfm56, generalelectricf108, cfminternationalleap, prattwhitneypw1000g, prattwhitneyf135, rocketdyners-25, generalelectricge90, aviadvigatelpd-14, generalelectricf110"
,3,,"218,21",Sedans,27737,Q8727255,automobile model,121428,52303,"0,852","0,9221",1036,101,"0,91",87,"0,09",FALSE,"941: volkswagenbeetle, nissanskyline, toyotamasterline, toyotacrown, hondaaccord, ladariva, mercedes-benzw124, toyotayaris, austinnewmarket, mazda3"
,3,,"218,03",2000s cars,37453,Q6278620,automobile model,256934,148002,"0,872","0,9304",605,136,"0,82",118,"0,2",FALSE,"586: toyotasupra, volkswagenbeetle, toyotalandcruiser, bmw3series, mazdarx-7, bmwm3, toyotahilux, toyotarav4, toyotacrown, hondaaccord"
,3,,"217,55",Executive cars,32952,Q8430408,automobile model,152969,85266,"0,8119","0,7814",179,19,"0,91",17,"0,09",FALSE,"171: toyotacrown, toyotacrowneight, teslamodels, mercedes-benze-class, mercedes-benzw123, lexusgs, citroënds, gaz-24, audirs6, porschetaycan"
,3,,"217,54",2010s cars,28106,Q6278623,automobile model,185069,78844,"0,8472","0,9199",1081,186,"0,85",160,"0,15",FALSE,"1034: toyotasupra, toyotalandcruiser, nissangt-r, nissanskyline, bmwm3, toyotahilux, toyotarav4, toyotacrown, hondaaccord, ladariva"
,2,,"216,67",Aircraft engines of Germany during World War II,10732,Q6605119,engine,97985,36244,"0,7436","0,7424",76,115,"0,4",5,"0,05",FALSE,"76: dieselengine, jetengine, gasturbine, rocketengine, kuznetsovnk-12, junkersjumo004, bmw801, daimler-benzdb610, daimler-benzdb628, db605"
,3,,"216,44",Convertibles,11882,Q6929265,automobile model,188275,80087,"0,8427","0,9203",319,51,"0,86",68,"0,23",FALSE,"292: volkswagenbeetle, mazdarx-7, mercedes-benzw124, fordmodelt, chevroletimpala, mercedes-benzc-class, pontiacfirebird, suzukijimny, minihatch, peugeot206"
,,,hulk,,,,,,,,,,,,,,,
,,,score,name,rank,wikidata,type,members rank mean,members rank median,members system interesting score mean,members system interesting score median,valid members count,invalid members count,valid members ratio,nonavailable members count,nonavailable members ratio,is merged,names
,5,,"240,09",Hulk supporting characters,27526,Q4432887,fictional character,451849,96945,"0,9059","0,9317",131,139,"0,49",94,"0,74",FALSE,"125: spider-man, namor, sub-mariner, ironman, sorcerersupreme, doctorstrange, she-hulk, captainamerica, joefixit, hulk"
,5,,"237,72",Hulk (comics) films,8424,Q7141745,film,696095,96382,"0,9312","0,9305",6,6,"0,55",3,"0,33",FALSE,"6: theincrediblehulk, hulk, thedeathoftheincrediblehulk, thetrialoftheincrediblehulk, theincrediblehulkreturns, hulkwheremonstersdwell"
,3,,"236,72",British prison hulks,11393,Q6565028,prison,119223,28491,"0,9321","0,932",3,146,"0,02",2,"0,33",FALSE,"3: penalcolonies, prisonship, reformatory"
,5,,"229,14",The Incredible Hulk characters,2663,Q6599718,fictional character,461682,68916,"0,9054","0,9316",87,113,"0,44",60,"0,71",FALSE,"83: spider-man, namor, ironman, doctorstrange, she-hulk, captainamerica, hulk, deadpool, wolverine, modok"
,3,,"227,48",The Incredible Hulk (1978 TV series) episodes,71467,Q3546606,television series episode,64971,64971,"0,6383","0,6383",2,415,0,2,"0,5",FALSE,"2: newwarriors, marvel’smostwanted"
,2,,"226,57",Hulk and the Agents of S.M.A.S.H. episodes,19181,Q15995631,television series episode,33454,33454,"0,8171","0,8171",2,378,"0,01",2,"0,5",FALSE,"2: x-menprydeofthex-men, breakout"
,3,,"214,84",Films based on Marvel Comics publications,1346086,Q1369019,film,2194907,1392190,"0,8213","0,9304",128,278,"0,32",57,"0,46",FALSE,"121: doctorstrangeinthemultiverseofmadness, thorloveandthunder, blackpantherwakandaforever, spider-mannowayhome, morbius, ant-manandthewaspquantumania, blackpanther, avengersendgame, eternals, theking’sman"
,3,,"214,62",Films based on English-language comics,46626,Q1741678,film,1105034,260337,"0,839","0,9306",414,163,"0,72",161,"0,4",FALSE,"399: doctorstrangeinthemultiverseofmadness, thebatman, thorloveandthunder, blackpantherwakandaforever, blackadam, spider-mannowayhome, morbius, ant-manandthewaspquantumania, blackpanther, avengersendgame"
,5,,"213,86",Marvel Comics characters,128564,Q11819106,fictional character,211857,38338,"0,9114","0,9317",4144,5372,"0,44",1089,"0,66",TRUE,"1643: bible, moonknight, spider-man, peterparker, satan, archangel, kangtheconqueror, namor, sub-mariner, namorthesub-mariner"
,2,,"213,78",Programs previously broadcast by NBC,68141,Q6635421,television program,145177,17218,"0,8691","0,9314",1312,656,"0,67",520,"0,4",FALSE,"1296: manifest, theoffice, friends, theblacklist, thisisus, brooklynnine-nine, laworderspecialvictimsunit, chicagofire, seinfeld, littlehouseontheprairie"
,,,marvel,,,,,,,,,,,,,,,
,,,score,name,rank,wikidata,type,members rank mean,members rank median,members system interesting score mean,members system interesting score median,valid members count,invalid members count,valid members ratio,nonavailable members count,nonavailable members ratio,is merged,names
,3,,"235,13",Marvel Girl,9888,Q60064551,comics character,348301,150528,"0,9316","0,9315",3,3,"0,6",3,"0,67",FALSE,"3: jeangrey, rachelsummers, valeriarichards"
,5,,"234,07",Ultimate Marvel characters,113541,Q6601364,fictional character,282615,85847,"0,9091","0,9318",407,193,"0,68",314,"0,78",FALSE,"403: moonknight, kangtheconqueror, namor, wandamaximoff, alternativeversionsofscarletwitch, morbiusthelivingvampire, thanos, she-hulk, gilgamesh, brucebanner"
,5,,"233,99",Marvel Comics characters,128564,Q11819106,fictional character,211857,38338,"0,9114","0,9317",4144,5372,"0,44",1089,"0,66",TRUE,"1643: bible, moonknight, spider-man, peterparker, satan, archangel, kangtheconqueror, namor, sub-mariner, namorthesub-mariner"
,3,,"232,68",Marvel Cinematic Universe television series actors (Marvel Studios),66456,Q104144547,human,2007970,1253413,"0,8984","0,9308",182,506,"0,26",93,"0,51",FALSE,"182: scarlettjohansson, chadwickboseman, chrishemsworth, evanpeters, natalieportman, robertdowneyjr, florencepugh, oscarisaac, chrisevans, taikawaititi"
,3,,"232,19",Marvel Cinematic Universe television series actors (Marvel Television),41252,Q19753554,television program,1408440,744614,"0,8126","0,9314",71,547,"0,12",29,"0,62",FALSE,"45: moonknight, she-hulkattorneyatlaw, msmarvel, wandavision, loki, whatif, daredevilbornagain, daredevil, werewolfbynight, hawkeye"
,2,,"232,16",Sphinx (Marvel Comics),11059,Q2278346,fictional character,502155,156489,"0,9153","0,932",120,95,"0,56",102,"0,86",FALSE,"118: spider-man, moses, kangtheconqueror, namor, ironman, thanos, she-hulk, captainamerica, hulk, blackbolt"
,2,,"231,71",Marvel Anime episodes,22808,Q4436793,television series episode,33454,33454,"0,8171","0,8171",2,135,"0,01",2,"0,5",FALSE,"2: x-menprydeofthex-men, breakout"
,2,,"230,79",Marvel Cinematic Universe films,17303937,Q16148930,film,2801896,1656172,"0,8253","0,9306",110,570,"0,16",59,"0,56",TRUE,"104: doctorstrangeinthemultiverseofmadness, thorloveandthunder, blackpantherwakandaforever, spider-mannowayhome, untitledspider-mannowayhomesequel, morbius, ant-manandthewaspquantumania, blackpanther, avengerssecretwars, avengersthekangdynasty"
,3,,"230,45",Marvel Comics aliens,5935,Q6240182,comics character,181107,37791,"0,8971","0,9307",85,41,"0,68",57,"0,66",FALSE,"85: thanos, gorrthegodbutcher, autolycus, venom, galactus, skaar, carnage, silversurfer, knull, gamora"
,4,,"230,43",Marvel 1602 characters,6149,Q6589343,fictional character,805589,393751,"0,9277","0,9322",60,103,"0,37",55,"0,93",FALSE,"58: spider-man, namor, scarletwitch, ironman, doctorstrange, captainamerica, hulk, clea, wolverine, doctordoom"
,,,marvel characters,,,,,,,,,,,,,,,
,,,score,name,rank,wikidata,type,members rank mean,members rank median,members system interesting score mean,members system interesting score median,valid members count,invalid members count,valid members ratio,nonavailable members count,nonavailable members ratio,is merged,names
,5,,"251,39",Ultimate Marvel characters,113541,Q6601364,fictional character,282615,85847,"0,9091","0,9318",407,193,"0,68",314,"0,78",FALSE,"403: moonknight, kangtheconqueror, namor, wandamaximoff, alternativeversionsofscarletwitch, morbiusthelivingvampire, thanos, she-hulk, gilgamesh, brucebanner"
,5,,"251,31",Marvel Comics characters,128564,Q11819106,fictional character,211857,38338,"0,9114","0,9317",4144,5372,"0,44",1089,"0,66",TRUE,"1643: bible, moonknight, spider-man, peterparker, satan, archangel, kangtheconqueror, namor, sub-mariner, namorthesub-mariner"
,4,,"247,75",Marvel 1602 characters,6149,Q6589343,fictional character,805589,393751,"0,9277","0,9322",60,103,"0,37",55,"0,93",FALSE,"58: spider-man, namor, scarletwitch, ironman, doctorstrange, captainamerica, hulk, clea, wolverine, doctordoom"
,0.1,,"242,30",Lists of Marvel Comics characters,1525441,Q96251657,fictional character,245041,13280,"0,9088","0,9312",48,179,"0,21",18,"0,35",TRUE,"48: bertrandcrawley, godzilla, randallflagg, wiccan, mobiusmmobius, everettkross, moongirl, ka-zar, kool-aidman, listofmarvelcomicscharactersb"
,3,,"242,26",Thor (Marvel Comics) supporting characters,52314,Q6600248,fictional character,265961,60302,"0,9173","0,9318",319,270,"0,54",225,"0,75",FALSE,"297: spider-man, kangtheconqueror, namor, scarletwitch, ironman, thanos, she-hulk, gorrthegodbutcher, captainamerica, hulk"
,4,,"240,83",Marvel Comics Golden Age characters,12930,Q6589348,fictional character,303885,24650,"0,9151","0,9318",112,177,"0,39",70,"0,63",FALSE,"109: namor, scarletwitch, ironman, doctorstrange, she-hulk, captainamerica, hulk, deadpool, wolverine, thor"
,4,,"239,16",Characters of the Marvel Cinematic Universe,1308260,Q614085,fictional character,405999,211442,"0,9172","0,9315",391,1480,"0,21",212,"0,82",TRUE,"258: sauron, kangtheconqueror, scarletcenturion, rama-tut, namor, superman, darthvader, americachavez, utopianparallel, she-hulk"
,3,,"235,13",Marvel Girl,9888,Q60064551,comics character,348301,150528,"0,9316","0,9315",3,3,"0,6",3,"0,67",FALSE,"3: jeangrey, rachelsummers, valeriarichards"
,2,,"232,68",Marvel Cinematic Universe television series actors (Marvel Studios),66456,Q104144547,human,2007970,1253413,"0,8984","0,9308",182,506,"0,26",93,"0,51",FALSE,"182: scarlettjohansson, chadwickboseman, chrishemsworth, evanpeters, natalieportman, robertdowneyjr, florencepugh, oscarisaac, chrisevans, taikawaititi"
,2,,"232,19",Marvel Cinematic Universe television series actors (Marvel Television),41252,Q19753554,television program,1408440,744614,"0,8126","0,9314",71,547,"0,12",29,"0,62",FALSE,"45: moonknight, she-hulkattorneyatlaw, msmarvel, wandavision, loki, whatif, daredevilbornagain, daredevil, werewolfbynight, hawkeye"
,,,fruit,,,,,,,,,,,,,,,
,,,score,name,rank,wikidata,type,members rank mean,members rank median,members system interesting score mean,members system interesting score median,valid members count,invalid members count,valid members ratio,nonavailable members count,nonavailable members ratio,is merged,names
,5,,"241,21",Tropical fruit,25495,Q7461140,taxon,185376,12049,"0,915","0,9185",196,13,"0,94",26,"0,13",FALSE,"196: avocado, pineapple, jackfruit, coconut, eggplant, lychee, papaya, tamarind, passifloraedulis, soursop"
,5,,"239,97",Fruit vegetables,11145,Q8475074,taxon,489451,95225,"0,9102","0,9303",44,8,"0,86",15,"0,32",FALSE,"44: maize, tomato, eggplant, cucumber, pea, chayote, jalapeño, physalisperuviana, capsicum, breadfruit"
,5,,"239,20",Culinary fruits,1637947,Q497975,fruit,678399,330500,"0,9293","0,9311",26,815,"0,03",11,"0,38",FALSE,"26: banana, malusdomestica, orange, citrusjaponica, kumquat, zucchini, citrus, nepheliumlappaceum, bloodorange, citrusclementina"
,4,,"236,62",Japanese fruit,4044,Q8562719,taxon,132901,47876,"0,8959","0,925",50,4,"0,94",16,"0,3",FALSE,"50: yuzu, diospyroskaki, vacciniumvitis-idaea, prunusmume, vacciniumuliginosum, citrusunshiu, satsuma, actinidiapolygama, shinemuscat, akebiaquinata"
,5,,"235,64",Desert fruits,5386,Q8374995,taxon,104172,11437,"0,9125","0,917",47,4,"0,94",3,"0,04",FALSE,"47: datepalm, opuntiaficus-indica, opuntia, saguaro, cucumismetuliferus, ziziphusspina-christi, ziziphusmauritiana, sclerocaryabirrea, selenicereusundatus, pachycereuspringlei"
,3,,"234,54",Oranges (fruit),3039,Q7352275,taxon,184438,11515,"0,9176","0,9311",15,16,"0,5",2,"0,07",FALSE,"15: bergamotorange, citrussinensis, bitterorange, trifoliateorange, hassakuorange, kanpei, mandora, lemonadefruit, citrange, kojiorange"
,1,,"234,21",Fruits Basket characters,299098,Q3267831,fictional character,47594,47594,"0,9312","0,9312",1,245,0,2,1,FALSE,1: tohruhonda
,4,,"228,34",Fruits originating in Asia,5227,Q8475079,taxon,257296,6102,"0,9174","0,9199",105,10,"0,92",16,"0,14",FALSE,"105: pomegranate, ficuscarica, fig, jackfruit, coconut, eggplant, prunuspersica, mandarinorange, jujube, mangosteen"
,4,,"227,53",Fruits originating in Africa,4379,Q9168449,taxon,145819,8912,"0,9121","0,9192",104,2,"0,99",8,"0,07",FALSE,"104: ficuscarica, fig, watermelon, tamarind, adansonia, calabash, coffea, adansoniadigitata, pear, synsepalumdulcificum"
,4,,"225,79",Sour fruits,1433,Q30676302,taxon,661937,417860,"0,929","0,9304",11,3,"0,85",5,"0,36",FALSE,"11: pomegranate, lemon, tamarind, prunuscerasifera, prunuscerasus, redcurrant, sorbusdomestica, garciniaindica, prunuscerasoides, montmorencycherry"
,,,fruits,,,,,,,,,,,,,,,
,,,score,name,rank,wikidata,type,members rank mean,members rank median,members system interesting score mean,members system interesting score median,valid members count,invalid members count,valid members ratio,nonavailable members count,nonavailable members ratio,is merged,names
,,3,"242,23",Culinary fruits,1637947,Q497975,fruit,678399,330500,"0,9293","0,9311",26,815,"0,03",11,"0,38",FALSE,"26: banana, malusdomestica, orange, citrusjaponica, kumquat, zucchini, citrus, nepheliumlappaceum, bloodorange, citrusclementina"
,,5,"239,06",Tropical fruit,25495,Q7461140,taxon,185376,12049,"0,915","0,9185",196,13,"0,94",26,"0,13",FALSE,"196: avocado, pineapple, jackfruit, coconut, eggplant, lychee, papaya, tamarind, passifloraedulis, soursop"
,,3,"238,67",Desert fruits,5386,Q8374995,taxon,104172,11437,"0,9125","0,917",47,4,"0,94",3,"0,04",FALSE,"47: datepalm, opuntiaficus-indica, opuntia, saguaro, cucumismetuliferus, ziziphusspina-christi, ziziphusmauritiana, sclerocaryabirrea, selenicereusundatus, pachycereuspringlei"
,,5,"237,82",Fruit vegetables,11145,Q8475074,taxon,489451,95225,"0,9102","0,9303",44,8,"0,86",15,"0,32",FALSE,"44: maize, tomato, eggplant, cucumber, pea, chayote, jalapeño, physalisperuviana, capsicum, breadfruit"
,0.2,0,"236,91",Fruits Basket characters,299098,Q3267831,fictional character,47594,47594,"0,9312","0,9312",1,245,0,2,1,FALSE,1: tohruhonda
,,3,"234,46",Japanese fruit,4044,Q8562719,taxon,132901,47876,"0,8959","0,925",50,4,"0,94",16,"0,3",FALSE,"50: yuzu, diospyroskaki, vacciniumvitis-idaea, prunusmume, vacciniumuliginosum, citrusunshiu, satsuma, actinidiapolygama, shinemuscat, akebiaquinata"
,,2,"232,39",Oranges (fruit),3039,Q7352275,taxon,184438,11515,"0,9176","0,9311",15,16,"0,5",2,"0,07",FALSE,"15: bergamotorange, citrussinensis, bitterorange, trifoliateorange, hassakuorange, kanpei, mandora, lemonadefruit, citrange, kojiorange"
,,4,"230,77",Fruits originating in Asia,5227,Q8475079,taxon,257296,6102,"0,9174","0,9199",105,10,"0,92",16,"0,14",FALSE,"105: pomegranate, ficuscarica, fig, jackfruit, coconut, eggplant, prunuspersica, mandarinorange, jujube, mangosteen"
,,4,"229,96",Fruits originating in Africa,4379,Q9168449,taxon,145819,8912,"0,9121","0,9192",104,2,"0,99",8,"0,07",FALSE,"104: ficuscarica, fig, watermelon, tamarind, adansonia, calabash, coffea, adansoniadigitata, pear, synsepalumdulcificum"
,,4,"228,82",Sour fruits,1433,Q30676302,taxon,661937,417860,"0,929","0,9304",11,3,"0,85",5,"0,36",FALSE,"11: pomegranate, lemon, tamarind, prunuscerasifera, prunuscerasus, redcurrant, sorbusdomestica, garciniaindica, prunuscerasoides, montmorencycherry"
,,,britney spears,,,,,,,,,,,,,,,
,,,score,name,rank,wikidata,type,members rank mean,members rank median,members system interesting score mean,members system interesting score median,valid members count,invalid members count,valid members ratio,nonavailable members count,nonavailable members ratio,is merged,names
,5,,"265,21",Britney Spears filmography,2949,Q13630445,film,178150,41431,"0,9155","0,9311",19,284,"0,06",5,"0,21",FALSE,"19: videoalbum, musicvideos, austinpowersingoldmember, fahrenheit911, crossroads, jackass3d, paulyshoreisdead, longshot, corporateanimals, framingbritneyspears"
,5,,"259,44",Songs recorded by Britney Spears,74766,Q1278951,song,79223,48602,"0,8494","0,9325",61,441,"0,12",15,"0,5",TRUE,"28: tom’sdiner, toxic, everytime, gimmemore, youdrivemecrazy, i’maslave4u, myprerogative, sometimes, lucky, i’mnotagirlnotyetawoman"
,5,,"257,30",Songs written by Britney Spears,11672,Q8764268,song,42615,21422,"0,9343","0,9348",5,32,"0,14",4,"0,75",FALSE,"4: everytime, someday, perfume, itshouldbeeasy"
,5,,"253,78",Unreleased songs recorded by Britney Spears,18400,Q85781016,song,89866,52191,"0,8599","0,9325",34,238,"0,13",18,"0,53",FALSE,"32: tom’sdiner, toxic, laislabonita, telephone, allthatshewants, everytime, gimmemore, kiss, youdrivemecrazy, i’maslave4u"
,5,,"247,13",Britney Spears albums,662,Q6843306,album,205164,195543,"0,933","0,9331",9,1,1,9,"0,89",FALSE,"9: babyonemoretime, oopsididitagain, blackout, inthezone, britney, glory, circus, femmefatale, britneyjean"
,1,,"232,50",Seven Spears of Shizugatake,26130,Q2738084,human,708183,250179,"0,8284","0,9185",12,11,"0,55",3,"0,17",FALSE,"12: tokugawaieyasu, toyotomihideyoshi, ishidamitsunari, katōkiyomasa, toyotomihideyori, shibatakatsuie, fukushimamasanori, wakizakayasuharu, katōyoshiaki, katagirikatsumoto"
,2,,"222,21",American film actresses,531661,Q4889256,human,365588,47276,"0,9146","0,9312",11178,47,1,851,"0,09",TRUE,"9040: amberheard, marilynmonroe, jennaortega, anneheche, priscillapresley, jenniferlopez, taylorswift, meghanmarkle, meghanduchessofsussex, angelinajolie"
,2,,"222,04",2021 films,117410,Q32672310,film,185337,34039,"0,8786","0,9311",2161,72,"0,97",699,"0,33",FALSE,"2145: spider-mannowayhome, dune, notimetodie, theblackphone, eternals, coda, thepowerofthedog, houseofgucci, theking’sman, don’tlookup"
,2,,"221,85",21st-century American actresses,53741,Q8206361,human,523527,116474,"0,9113","0,931",5544,37,"0,99",829,"0,15",FALSE,"5539: amberheard, jennaortega, anneheche, jenniferlopez, taylorswift, meghanduchessofsussex, angelinajolie, jenniferconnelly, zendaya, winonaryder"
,2,,"221,76",American television actresses,45957,Q6561621,human,407674,72257,"0,9133","0,9311",10540,50,1,830,"0,11",TRUE,"7747: amberheard, jennaortega, anneheche, priscillapresley, jenniferlopez, taylorswift, meghanduchessofsussex, angelinajolie, jenniferconnelly, kimkardashian"
,,,bmw car models,,,,,,,,,,,,,,,
,,,score,name,rank,wikidata,type,members rank mean,members rank median,members system interesting score mean,members system interesting score median,valid members count,invalid members count,valid members ratio,nonavailable members count,nonavailable members ratio,is merged,names
